id,text,commercial_use,distribution,modification,private_use,patent_use,trademark_use,disclose_source,license_and_copyright_notice,same_license,state_changes,liability,warranty,is_granted
1,this software is provided as is without any express or implied warranty,0,0,0,0,0,0,0,0,0,0,0,1,0
2,in no event will the authors be held liable for any damages arising from the use of this software,0,0,0,0,0,0,0,0,0,0,1,0,0
3,permission is granted to anyone to use this software for any purpose including commercial applications and to alter it and redistribute it freely subject to the following restrictions,1,1,1,1,0,0,0,0,0,0,0,0,1
4,the origin of this software must not be misrepresented you must not claim that you wrote the original software,0,0,0,0,0,0,0,0,0,0,0,0,0
5,if you use this software in a product an acknowledgment in the product documentation would be appreciated but is not required,0,0,0,0,0,0,0,0,0,0,0,0,1
6,altered source versions must be plainly marked as such and must not be misrepresented as being the original software,0,0,0,0,0,0,0,0,0,1,0,0,1
