id,text,commercial_use,distribution,modification,private_use,patent_use,trademark_use,disclose_source,license_and_copyright_notice,same_license,state_changes,liability,warranty,is_granted
1,the cougaar open source license cosl is a modified version of the osi approved bsd license,0,0,0,0,0,0,0,0,1,0,0,0,1
2,cosl license  redistribution and use in source and binary forms with or without modification are permitted provided that the following conditions are met 1,0,1,1,1,0,0,0,0,0,0,0,0,1
3,redistributions of source code must retain the original authors copyright notice this list of conditions and the following disclaimer,0,0,0,0,0,0,0,1,0,0,0,0,1
4,redistributions in binary form must reproduce the original authors copyright notice this list of conditions and the following disclaimer in the documentation and or other materials provided with the distribution,0,1,0,0,0,0,0,1,0,0,0,0,1
5,the end user documentation included with the redistribution if any must include the following acknowledgement this product includes software developed in part by support from the defense advanced research project agency darpa,0,0,0,0,0,0,0,0,0,0,0,0,1
6,neither the name of the darpa nor the names of its contributors may be used to endorse or promote products derived from this software without specific prior written permission,0,0,0,0,0,1,0,0,0,0,0,0,0
7,this software is provided by the copyright holders and contributors as is and any express or implied warranties including but not limited to the implied warranties of merchantability and fitness for a particular purpose are disclaimed,0,0,0,0,0,0,0,0,0,0,0,1,0
