id,text,commercial_use,distribution,modification,private_use,patent_use,trademark_use,disclose_source,license_and_copyright_notice,same_license,state_changes,liability,warranty,is_granted
1,this library is free software you can redistribute it and or modify it under the terms of the gnu library general public license as published by the free software foundation either version 2 of the license or at your option any later version,0,1,1,0,0,0,0,0,0,0,0,0,1
2,this library is distributed in the hope that it will be useful but without any warranty without even the implied warranty of merchantability or fitness for a particular purpose,0,0,0,0,0,0,0,0,0,0,0,1,0
3,see the gnu library general public license for more details,0,0,0,0,0,0,0,0,0,0,0,0,1
4,you should have received a copy of the gnu library general public license along with this library if not write to the free software foundation inc 51 franklin street fifth floor boston ma 02110 1301 usa mini xml license lgpl 20 with exception the mini xml library and included programs are provided under the terms of the gnu library general public license lgpl with the following exceptions 1,0,0,1,0,0,0,0,0,0,0,0,0,1
5,static linking of applications to the mini xml library does not constitute a derivative work and does not require the author to provide source code for the application use the shared mini xml libraries or link their applications against a user supplied version of mini xml,0,0,0,0,0,0,1,0,0,0,0,0,1
6,if you link the application to a modified version of mini xml then the changes to mini xml must be provided under the terms of the lgpl in sections 1 2 and 4,0,0,1,0,0,0,0,0,0,0,0,0,1
7,you do not have to provide a copy of the mini xml license with programs that are linked to the mini xml library nor do you have to identify the mini xml license in your program or documentation as required by section 6 of the lgpl,0,0,0,0,0,0,0,0,0,0,0,0,1
