id,text,commercial_use,distribution,modification,private_use,patent_use,trademark_use,disclose_source,license_and_copyright_notice,same_license,state_changes,liability,warranty,is_granted
1,disclaimer of warranty these software programs are available to the user without any license fee or royalty on an as is basis,0,0,0,0,0,0,0,0,0,0,0,1,0
2,the mpeg software simulation group disclaims any and all warranties whether express implied or statuary including any implied warranties or merchantability or of fitness for a particular purpose,0,0,0,0,0,0,0,0,0,0,0,1,0
3,in no event shall the copyright holder be liable for any incidental punitive or consequential damages of any kind whatsoever arising from the use of these programs,0,0,0,0,0,0,0,0,0,0,1,0,0
4,this disclaimer of warranty extends to the user of these programs and users customers employees agents transferees successors and assigns,0,0,0,0,0,0,0,0,0,0,0,0,0
5,the mpeg software simulation group does not represent or warrant that the programs furnished hereunder are free of infringement of any third party patents,0,0,0,0,0,0,0,0,0,0,0,0,0
6,commercial implementations of mpeg 1 and mpeg 2 video including shareware are subject to royalty fees to patent holders,0,1,0,0,1,0,0,0,0,0,0,0,1
