id,text,commercial_use,distribution,modification,private_use,patent_use,trademark_use,disclose_source,license_and_copyright_notice,same_license,state_changes,liability,warranty,is_granted
1,this code is distributed in the hope that it will be useful but without any warranty without even the implied warranty of merchantability or fitness for a particular purpose,0,0,0,0,0,0,0,0,0,0,0,1,0
2,you may freely use copy and distribute this software as long as all copyright notices including this notice remain intact and that you do not try to claim it as your own or try to sell it,1,1,1,1,0,0,0,1,0,0,0,0,1
3,you may alter the code as long as you send me any diffs this will ensure that you have an easier time of it when you upgrade ,0,0,0,0,0,0,0,0,0,0,0,0,1
4,parts of this code copyright c 2007 david buzz bussenschutt,0,0,0,0,0,0,0,0,0,0,0,0,1
5,<davidbuzz@gmailcom> perl port of this code is copyright c 2001 mark bush,0,0,0,0,0,0,0,1,0,0,0,0,1
6,<markbush@bushnetdemoncouk> the code is originally based on fetchmail code which is copyright c 1997 eric s raymond,0,0,0,0,0,0,0,0,0,0,0,0,1
