id,text,commercial_use,distribution,modification,private_use,patent_use,trademark_use,disclose_source,license_and_copyright_notice,same_license,state_changes,liability,warranty,is_granted
1,university corporation for advanced internet development inc all rights reserved redistribution and use in source and binary forms with or without modification are permitted provided that the following conditions are met redistributions of source code must retain the above copyright notice this list of conditions and the following disclaimer,0,1,1,1,0,0,0,1,0,0,0,0,1
2,redistributions in binary form must reproduce the above copyright notice this list of conditions and the following disclaimer in the documentation and or other materials provided with the distribution if any must include the following acknowledgment this product includes software developed by the university corporation for advanced internet development <http  wwwucaidedu>internet2 project,0,0,0,0,0,0,0,1,0,0,0,0,1
3,alternately this acknowledegement may appear in the software itself if and wherever such third party acknowledgments normally appear,0,0,0,0,0,0,0,0,0,0,0,0,0
4,neither the name of opensaml nor the names of its contributors nor internet2 nor the university corporation for advanced internet development inc nor ucaid may be used to endorse or promote products derived from this software without specific prior written permission,0,0,0,0,0,1,0,0,0,0,0,0,0
5,for written permission please contact opensaml@opensamlorg products derived from this software may not be called opensaml internet2 ucaid or the university corporation for advanced internet development nor may opensaml appear in their name without prior written permission of the university corporation for advanced internet development,0,0,0,0,0,1,0,0,0,0,0,0,1
6,this software is provided by the copyright holders and contributors as is and with all faults,0,0,0,0,0,0,0,0,0,0,0,0,0
7,any express or implied warranties including but not limited to the implied warranties of merchantability fitness for a particular purpose and non infringement are disclaimed and the entire risk of satisfactory quality performance accuracy and effort is with licensee,0,0,0,0,0,0,0,0,0,0,1,0,0
