id,text,commercial_use,distribution,modification,private_use,patent_use,trademark_use,disclose_source,license_and_copyright_notice,same_license,state_changes,liability,warranty,is_granted
1,oracle sql developer license terms oracle sql developer data modeler license terms export controls on the programs selecting the accept license agreement button is a confirmation of your agreement that you comply now and during the trial term with each of the following statements  you are not a citizen national or resident of and are not under control of the government of cuba iran sudan libya north korea syria nor any country to which the united states has prohibited export,0,0,0,0,0,0,0,0,0,0,0,0,1
2, you will not download or otherwise export or re export the programs directly or indirectly to the above mentioned countries nor to citizens nationals or residents of those countries,0,0,0,0,0,0,0,0,0,0,0,0,1
3, you are not listed on the united states department of treasury lists of specially designated nationals specially designated terrorists and specially designated narcotic traffickers nor are you listed on the united states department of commerce table of denial orders,0,0,0,0,0,1,0,0,0,0,0,0,0
4,you will not download or otherwise export or re export the programs directly or indirectly to persons on the above mentioned lists,0,1,0,0,0,0,0,0,0,0,0,0,1
5,you will not use the programs for and will not allow the programs to be used for any purposes prohibited by united states law including without limitation for the development design manufacture or production of nuclear chemical or biological weapons of mass destruction,1,0,0,0,0,0,0,0,0,0,1,0,0
6,export restrictions you agree that us export control laws and other applicable export and import laws govern your use of the programs including technical data additional information can be found on oracleÃ¢Â®s global trade compliance web site http  wwworaclecom products export,0,0,0,0,0,0,0,0,0,0,0,0,1
7,you agree that neither the programs nor any direct product thereof will be exported directly or indirectly in violation of these laws or will be used for any purpose prohibited by these laws including without limitation nuclear chemical or biological weapons proliferation,0,0,0,0,0,0,0,0,0,0,0,0,1
8,oracle employees under no circumstances are oracle employees authorized to download software for the purpose of distributing it to customers,0,0,0,0,0,0,0,0,0,0,0,0,1
9,oracle products are available to employees for internal use or demonstration purposes only,0,0,0,0,0,0,0,0,0,0,0,0,1
10,in keeping with oracles trade compliance obligations under us and applicable multilateral law failure to comply with this policy could result in disciplinary action up to and including termination,0,0,0,0,0,0,0,0,1,0,1,0,0
11,note you are bound by the oracle technology network otn license agreement terms,0,0,0,0,0,0,0,0,0,0,0,0,1
12,the otn license agreement terms also apply to all updates you receive under your technology track subscription,0,0,0,0,0,0,0,0,0,0,0,0,1
13,the otn license agreement terms below supercede any shrinkwrap license on the otn technology track software cds and previous otn license terms including the oracle program license as modified by the otn program use certificate,0,0,0,0,0,0,0,0,1,0,0,0,1
14,oracle sql developer license agreement oracle sql developer data modeler license agreement we us and our refers to oracle america inc for and on behalf of itself and its subsidiaries and affiliates under common control,0,0,0,0,0,0,0,0,0,0,0,0,0
15,you and your refers to the individual or entity that wishes to use the programs from oracle,0,0,0,0,0,0,0,0,0,0,0,0,0
16,programs refers to the oracle software product you wish to download and use and program documentation,0,0,0,0,0,0,0,0,0,0,0,0,1
17,license refers to your right to use the programs under the terms of this agreement,0,0,0,0,0,0,0,0,0,0,0,0,1
18,this agreement is governed by the substantive and procedural laws of california,0,0,0,0,0,0,0,0,0,0,0,0,0
19,you and oracle agree to submit to the exclusive jurisdiction of and venue in the courts of san francisco san mateo or santa clara counties in california in any dispute arising out of or relating to this agreement,0,0,0,0,0,0,0,0,0,0,0,0,0
20,we are willing to license the programs to you only upon the condition that you accept all of the terms contained in this agreement,0,0,0,0,0,0,0,0,0,0,0,0,1
21,read the terms carefully and select the accept button at the bottom of the page to confirm your acceptance,0,0,0,0,0,0,0,0,0,0,0,0,1
22,if you are not willing to be bound by these terms select the do not accept button and the registration process will not continue,0,0,0,0,0,0,0,0,0,0,0,0,1
23,license rights we grant you a nonexclusive nontransferable limited license to use the programs solely for your business operations and any third party training as part of such business operations,0,0,0,0,0,0,0,0,0,0,0,0,1
24,program documentation may be accessed online at http  wwworaclecom technetwork indexes documentation indexhtml,0,0,0,0,0,0,0,0,0,0,0,0,1
25,ownership and restrictions we retain all ownership and intellectual property rights in the programs,0,1,0,0,0,0,0,0,0,0,0,0,1
26,you may make a sufficient number of copies of the programs for the licensed use and one copy of the programs for backup purposes,1,0,0,0,0,0,0,0,0,0,0,0,1
27,you may not   remove or modify any program markings or any notice of our proprietary rights   make the programs available in any manner to any third party other than as specified above   use the programs for any purpose other than as provided above   assign this agreement or give or transfer the programs or an interest in them to another individual or entity   cause or permit reverse engineering unless required by law for interoperability disassembly or decompilation of the programs   disclose results of any program benchmark tests without our prior consent,0,0,0,0,0,0,0,0,0,0,0,0,1
28,export you agree that us export control laws and other applicable export and import laws govern your use of the programs including technical data additional information can be found on oracles global trade compliance web site located at http  wwworaclecom products export indexhtml?contenthtml,0,0,0,0,0,0,0,0,0,0,0,0,1
29,you agree that neither the programs nor any direct product thereof will be exported directly or indirectly in violation of these laws or will be used for any purpose prohibited by these laws including without limitation nuclear chemical or biological weapons proliferation,0,0,0,0,0,0,0,0,0,0,1,0,1
30,disclaimer of warranty and exclusive remedies the programs are provided as is without warranty of any kind,0,0,0,0,0,0,0,0,0,0,0,1,0
31,we further disclaim all warranties express and implied including without limitation any implied warranties of merchantability fitness for a particular purpose or noninfringement,0,0,0,0,0,0,0,0,0,0,0,1,0
32,in no event shall we be liable for any indirect incidental special punitive or consequential damages or damages for loss of profits revenue data or data use incurred by you or any third party whether in an action in contract or tort even if we have been advised of the possibility of such damages,0,0,0,0,0,0,0,0,0,0,1,0,0
33,our entire liability for damages hereunder shall in no event exceed one thousand dollars us $1000,0,0,0,0,0,0,0,0,0,0,1,0,0
34,trial programs included with orders we may include additional programs with an order which may be used for trial purposes only,0,0,0,0,0,0,0,0,0,0,0,0,1
35,you will have 30 days from the delivery date to evaluate these programs,0,0,0,0,0,0,0,0,0,0,0,0,1
36,any use of these programs after the 30 day trial period requires you to obtain the applicable license,0,0,0,0,0,0,0,0,0,0,0,0,1
37,programs licensed for trial purposes are provided as is and we do not provide technical support or any warranties for these programs,0,0,0,0,0,0,0,0,0,0,0,0,0
38,technical support our technical support organization does not provide technical support phone support or updates specifically for the programs licensed under this agreement,0,0,0,0,0,0,0,0,0,0,0,0,0
39,however if you have a supported license of an oracle database program then the technical support organization will provide technical support phone support for the program licensed hereunder in conjunction with the oracle database program license,0,0,0,0,0,0,0,0,0,0,0,0,1
40,end of agreement you may terminate this agreement by destroying all copies of the programs,0,0,0,0,0,0,0,0,0,0,0,0,1
41,we have the right to terminate your right to use the programs if you fail to comply with any of the terms of this agreement in which case you shall destroy all copies of the programs,0,0,0,0,0,0,0,0,0,0,0,0,1
42,relationship between the parties the relationship between you and us is that of licensee licensor,0,0,0,0,0,0,0,0,0,0,0,0,0
43,neither party will represent that it has any authority to assume or create any obligation express or implied on behalf of the other party nor to represent the other party as agent employee franchisee or in any other capacity,0,0,0,0,0,0,0,0,0,0,0,0,0
44,nothing in this agreement shall be construed to limit either partys right to independently develop or distribute software that is functionally similar to the other partys products so long as proprietary information of the other party is not included in such software,0,1,0,0,0,0,0,0,0,0,0,0,1
45,open source third party technology that may be appropriate or necessary for use with the program may be specified in the program documentation,0,0,0,0,0,0,0,0,0,0,0,0,1
46,to the extent stated in the program documentation such third party technology is licensed to you under the terms of the third party technology license agreement specified in the program documentation and not under the terms of this agreement,0,0,0,0,0,0,0,0,1,0,0,0,0
47,nothing in this agreement should be construed as modifying or limiting your rights to use such third party technology under the terms of the specified third party license,0,0,0,0,0,0,0,0,0,0,0,0,0
48,entire agreement you agree that this agreement is the complete agreement for the programs and licenses and this agreement supersedes all prior or contemporaneous agreements or representations,0,0,0,0,0,0,0,0,1,0,0,0,0
49,if any term of this agreement is found to be invalid or unenforceable the remaining provisions will remain effective,0,0,0,0,0,0,0,0,0,0,0,1,1
