id,text,commercial_use,distribution,modification,private_use,patent_use,trademark_use,disclose_source,license_and_copyright_notice,same_license,state_changes,liability,warranty,is_granted
1,permission to use copy modify and distribute this software for any purpose and without fee is hereby granted provided that the above copyright notice appear in all copies and that both the copyright notice and this permission notice appear in supporting documentation and that the name of silicon graphics inc not be used in advertising or publicity pertaining to distribution of the software without specific written prior permission,0,1,1,1,0,0,0,1,0,0,0,0,1
2,the material embodied on this software is provided to you as is and without warranty of any kind express implied or otherwise including without limitation any warranty of merchantability or fitness for a particular purpose,0,0,0,0,0,0,0,0,0,0,0,1,0
3,in no event shall silicon graphics inc be liable to you or anyone else for any direct special incidental indirect or consequential damages of any kind or any damages whatsoever including without limitation loss of profit loss of use savings or revenue or the claims of third parties whether or not silicon graphics inc has been advised of the possibility of such loss however caused and on any theory of liability arising out of or in connection with the possession use or performance of this software,0,0,0,0,0,0,0,0,0,0,1,0,0
4,us government users restricted rights use duplication or disclosure by the government is subject to restrictions set forth in far 5222719c2 or subparagraph c1ii of the rights in technical data and computer software clause at dfars 252227 7013 and or in similar or successor clauses in the far or the dod or nasa far supplement,0,1,0,0,0,0,0,0,0,0,0,0,1
5,unpublished   rights reserved under the copyright laws of the united states,0,0,0,0,0,0,0,0,0,0,0,0,1
6,contractor manufacturer is silicon graphics inc 2011 n shoreline blvd mountain view ca 94039 7311,0,0,0,0,0,0,0,0,0,0,0,0,0
