id,text,commercial_use,distribution,modification,private_use,patent_use,trademark_use,disclose_source,license_and_copyright_notice,same_license,state_changes,liability,warranty
134,if the software includes adobe air adobe flash player shockwave player or authorware player collectively adobe runtime then this section 144 applies a adobe runtime restrictions,,,,,,,,,,,,
135,you must not use adobe runtimes on any non pc device or with any embedded or device version of any operating system,,,,,,,,,,,,
136,for the avoidance of doubt and by example only you may not use adobe runtimes on any 1 mobile device set top box handheld phone game console tv dvd player media center other than with windows xp media center edition and its successors electronic billboard or other digital signage internet appliance or other internet connected device pda medical device atm telematic device gaming machine home automation system kiosk remote control device or any other consumer electronics device 2 operator based mobile cable satellite or television system or 3 other closed system device,,,,,,,,,,,,
137,additional information on licensing adobe runtimes is available at http  wwwadobecom go licensing,,,,,,,,,,,,
138,you must not distribute an adobe runtime except as a fully integrated portion of a developer application that is created using the software including the utilities provided with the software for example as part of an application that is packaged to run on the apple ios or androidâ¢ operating systems,,,,,,,,,,,,
139,distribution of the resulting output file or developer application on a non pc device requires you to obtain licenses which may be subject to additional royalties,,,,,,,,,,,,
140,it is solely your responsibility to obtain licenses for non pc devices and pay applicable royalties we grant no license to any third party technologies to run developer applications or output files on non pc devices under these terms,,,,,,,,,,,,
141,except as expressly provided in this section you may not distribute adobe runtime,,,,,,,,,,,,
142,subject to the contribute publishing services software end user license agreement accompanying the software you may not connect to the contribute publishing services software unless you have purchased a license to connect to the contribute publishing services software for each individual who may connect to the contribute publishing services software,,,,,,,,,,,,
143,however trial versions of adobe contribute software may install and connect to the contribute publishing services software in accordance with the contribute publishing services software end user license agreement,,,,,,,,,,,,
144,if the software includes adobe presenter and you install or use the adobe connect add in in connection with the use of the software you must not install or use the adobe connect add in on anything other than a computer and you must not install or use the adobe add in on any non pc product including but not limited to a web appliance set top box handheld phone or web pad device,,,,,,,,,,,,
145,further you may only use the portion of the software that is embedded in a presentation information or content created and generated using the software the adobe presenter run time together with the presentation information or content in which it is embedded,,,,,,,,,,,,
146,you must not use and must cause all licensees of the presentation information or content not to use the adobe presenter run time other than as embedded in the presentation information or content,,,,,,,,,,,,
147,in addition you must not use and must cause all licensees of the presentation information or content not to modify reverse engineer or disassemble the adobe presenter run time,,,,,,,,,,,,
148,147 flash builder with livecycle data services data management library,,,,,,,,,,,,
149,you must not use fdsswc for any purpose other than to provide client side data management capabilities and as an output file within software you develop subject to the following you must not a use fdsswc to enable associations or offline capabilities within software or b incorporate fdsswc into any software that is similar to adobe livecycle data services or blazeds,,,,,,,,,,,,
150,if you would like to do any of the foregoing you will need to request a separate license from us,,,,,,,,,,,,
151,if the software includes certain components designed to work with or access the dps services dps desktop tools then you must only install and use the dps desktop tools to a create or produce the content to be displayed within a content viewer as defined in the terms of use related to dps the content is referred to as output b evaluate and testing the output or c where available accessing and using dps,,,,,,,,,,,,
152,except as explicitly permitted in this section 148 you must not display distribute modify or publicly perform the dps desktop tools,,,,,,,,,,,,
153,if there is any conflict between this section and other sections then this section governs in relation to the relevant jurisdiction,,,,,,,,,,,,
154,for consumers in new zealand who obtain the software for personal domestic or household use not business purposes this agreement is subject to the consumer guarantees act,,,,,,,,,,,,
155,if you obtained the software in the european economic area eea you usually reside in the eea and you are a consumer that is your use of the software is for personal non business related purposes then your warranty period with regard to the software is the duration of your subscription,,,,,,,,,,,,
156,our entire liability related to any warranty claim and your sole and exclusive remedy under any warranty will be limited to either at our option support of our software based on the warranty claim replacement of the software or if support or replacement is not practicable refund of prepaid and unused subscription fee proportionate to the specific software,,,,,,,,,,,,
157,furthermore while these terms apply to any damages claims you make in respect of your use of the software we will be liable for direct losses that are reasonably foreseeable in the event of our breach of this agreement,,,,,,,,,,,,
158,you should take all reasonable measures to avoid and reduce damages in particular by making backup copies of the software and its computer data,,,,,,,,,,,,
159,nothing included in these terms limits any non waivable right to decompile the software that you may enjoy under the law,,,,,,,,,,,,
160,for example if you are located in the european union eu you may have the right under applicable law to decompile the software if it is necessary to do so in order to achieve interoperability of the software with another software program and we has not made this information available,,,,,,,,,,,,
161,under this circumstance you must first ask us in writing to provide the information necessary to achieve this interoperability,,,,,,,,,,,,
162,in addition the decompilation may only be performed by you or someone who may use the software on your behalf,,,,,,,,,,,,
163,we have the right to impose reasonable conditions before providing the information,,,,,,,,,,,,
164,you may use the information we supply or that you obtain only for the purpose described in this paragraph,,,,,,,,,,,,
165,you may not disclose the information to any third party or use the information in a manner that infringes our copyright or a copyright of one or our licensors,,,,,,,,,,,,
166,if you obtained the software in australia then the following provision applies notwithstanding anything stated to the contrary in these terms notice to consumers in australia our goods come with guarantees that cannot be excluded under the australian consumer law,,,,,,,,,,,,
167,you are entitled to a replacement or refund for a major failure and for compensation for any other reasonably foreseeable loss or damage,,,,,,,,,,,,
168,you are also entitled to have the goods repaired or replaced if the goods fail to be of acceptable quality and the failure does not amount to a major failure,,,,,,,,,,,,
169,for us government procurements software is a commercial computer software as defined in far 12212 and subject to restricted rights as defined in far section 52227 19 commercial computer software   restricted rights and dfars 2277202 rights in commercial computer software or commercial computer software documentation as applicable and any successor regulations,,,,,,,,,,,,
170,any use modification reproduction release performance display or disclosure of the software by the us government must be in accordance with license rights and restrictions described in these terms,,,,,,,,,,,,
171,we respect the intellectual property rights of others and we expect our users to do the same,,,,,,,,,,,,
172,we will respond to clear notices of copyright infringement consistent with the digital millennium copyright act dmca,,,,,,,,,,,,
173,if you believe that your work has been infringed in connection with the services please provide written notification via regular mail or via fax not via email or phone to our copyright agent contact information below that contains all of the following elements a a physical or electronic signature of the person authorized to act on behalf of the owner of the copyright interest that is alleged to have been infringed b a description of the copyrighted works infringed c a description of where the content that you claim is infringing is located on the services d information sufficient to permit us to contact you such as your physical address telephone number and email address e a statement by you that you have a good faith belief that the use of the content identified in your notice in the manner complained of is not authorized by the copyright owner its agent or the law and f a statement by you that the information in your notice is accurate and under penalty of perjury that you are the copyright owner or are authorized to act on the copyright ownerâs behalf,,,,,,,,,,,,
174,before you file the notification please carefully consider whether or not the use of copyrighted material at issue is protected by the fair use doctrine as you could be liable for costs and attorneysâ fees should you file a takedown notice where there is no infringing use,,,,,,,,,,,,
175,if you are unsure whether a use of your copyrighted material constitutes infringement please contact an attorney,,,,,,,,,,,,
176,in addition you may wish to consult publicly available reference materials such as those found at the us,,,,,,,,,,,,
177,if you believe we disabled or removed access to your content as a result of an improper copyright infringement notice please provide pursuant to the dmca written notification via regular mail or via fax not via email or phone to our copyright agent contact information below which must contain all of the following elements a a physical or electronic signature of the subscriber b identification of the content that was removed from the services and the location of the service on which the content appeared before it was removed c a statement under penalty of perjury that you have a good faith belief that the content was removed or disabled as a result of mistake or misidentification of the content to be removed or disabled d information sufficient to permit us to contact you such as your physical address telephone number and email address and e a statement that you consent to jurisdiction of the federal district court for the district where you reside or of santa clara county california if you reside outside of the united sates and that you will accept service of process from the person who provided notification under dmca subsection c1c or an agent of the person,,,,,,,,,,,,
178,before you file a counter notification please carefully consider whether or not the use of the copyrighted material at issue is infringing as you could be liable for costs and attorneysâ fees in the event that a court determines your counter notification misrepresented that the content was removed by mistake,,,,,,,,,,,,
179,if you are unsure whether use of the content at issue constitutes infringement please contact an attorney,,,,,,,,,,,,
180,in addition you may wish to consult publicly available reference materials such as those found at wwwchillingeffectsorg,,,,,,,,,,,,
181,our copyright agent for notice of claims of copyright infringement can be reached as follows the copyright agent will not remove content from the services in response to phone or email notifications regarding allegedly infringing content since a valid dmca notice must be signed under penalty of perjury by the copyright owner or by a person authorized to act on his or her behalf,,,,,,,,,,,,
182,please submit the notifications by fax or ordinary mail only and as further described by this section,,,,,,,,,,,,
183,the copyright agent should be contacted only if you believe that your work has been used or copied in a way that constitutes copyright infringement and that the infringement is occurring on the services,,,,,,,,,,,,
184,all other inquiries directed to the copyright agent will not be responded to,,,,,,,,,,,,
185,if you are a business company or organization then we may no more than once every 12 months upon seven 7 daysâ prior notice to you appoint our personnel or an independent third party auditor who is obliged to maintain confidentiality to inspect your records systems and facilities to verify that your installation and use of any and all software or services is in conformity with its valid licenses from us,,,,,,,,,,,,
186,additionally you will provide us with all records and information requested by us in order to verify that its installation and use of any and all software and services is in conformity with your valid licenses from us within 30 days of our request,,,,,,,,,,,,
187,if the verification discloses a shortfall in licenses for the software or services you will immediately acquire any necessary licenses subscriptions and any applicable back maintenance and support,,,,,,,,,,,,
188,if the underpaid fees exceed 5% of the value of the payable license fees then you will also pay for our reasonable cost of conducting the verification,,,,,,,,,,,,
189,the english version of these terms will be the version used when interpreting or construing these terms,,,,,,,,,,,,
190,you may send the notices to us to at the following address adobe systems 345 park avenue san jose california 95110â2704 attention general counsel,,,,,,,,,,,,
191,we may notify you by email postal mail postings within the services or other legally acceptable means,,,,,,,,,,,,
192,these terms constitute the entire agreement between you and us regarding your use of the services and software and supersede any prior agreements between you and us relating to the services,,,,,,,,,,,,
193,you may not assign or otherwise transfer these terms or your rights and obligations under these terms in whole or in part without our written consent,,,,,,,,,,,,
194,we may transfer our rights under these terms to a third party,,,,,,,,,,,,
195,if a particular term is not enforceable the unenforceability of that term will not affect any other terms,,,,,,,,,,,,
196,our failure to enforce or exercise any of these terms is not a waiver of that section,,,,,,,,,,,,
197,the software may contain third party software subject to additional terms and conditions available at http  wwwadobecom go thirdparty,,,,,,,,,,,,
198,the following notice applies to software containing avc import and export functionality this product is licensed under the avc patent portfolio license for the personal non commercial use of a consumer to a encode video in compliance with the avc standard avc video and or b decode avc video that was encoded by a consumer engaged in a personal non commercial activity and or was obtained from a video provider licensed to provide avc video,,,,,,,,,,,,
199,no license is granted or implied for any other use,,,,,,,,,,,,
200,additional information may be obtained from mpeg la llc,,,,,,,,,,,,
201,the following notice applies to software containing mpeg 2 import and export functionality use of this product other than consumer personal use in any manner that complies with the mpeg 2 standard for encoding video information for packaged media is expressly prohibited without a license under applicable patents in the mpeg 2 patent portfolio which license is available from mpeg la llc,,,,,,,,,,,,
202,if the software is downloaded from the apple itunes application store then you acknowledge and agree to the following additional terms a apple has no liability for the software and its content b your use of the software is limited to a non transferable license to use the software on any iphoneâ¢ ipadâ¢ or ipod touchâ¢ that you own or control as allowed by the application store terms of service c apple has no obligation whatsoever to furnish any maintenance or support services for the software d to the extent permitted by applicable law apple has no warranty obligation to the software and adobe will be responsible for any claims losses liabilities damages costs or expenses attributable to any failure to conform to any warranty set forth in this agreement e apple is not liable for any claims relating to the software or your possession and or use of the software including but not limited to i product liability claims ii any claim that the software fails to conform to any applicable legal requirement and iii consumer protection claims f apple is not liable for any third party claims that the software infringes a third partyâs intellectual property rights and g apple and its subsidiaries are third party beneficiaries of this agreement with respect to any software and that apple will have the right to enforce the agreement against you as a third party beneficiary,,,,,,,,,,,,
