id,text,commercial_use,distribution,modification,private_use,patent_use,trademark_use,disclose_source,license_and_copyright_notice,same_license,state_changes,liability,warranty
1,public domain mark 10 no copyright this work has been identified as being free of known restrictions under copyright law including all related and neighboring rights,,,,,,,,,,,,
2,you can copy modify distribute and perform the work even for commercial purposes all without asking permission,,,,,,,,,,,,
3,other information the work may not be free of known copyright restrictions in all jurisdictions,,,,,,,,,,,,
4,persons may have other rights in or related to the work such as patent or trademark rights and others may have rights in how the work is used such as publicity or privacy rights,,,,,,,,,,,,
5,in some jurisdictions moral rights of the author may persist beyond the term of copyright,,,,,,,,,,,,
6,these rights may include the right to be identified as the author and the right to object to derogatory treatments,,,,,,,,,,,,
7,unless expressly stated otherwise the person who identified the work makes no warranties about the work and disclaims liability for all uses of the work to the fullest extent permitted by applicable law,,,,,,,,,,,,
