id,text,commercial_use,distribution,modification,private_use,patent_use,trademark_use,disclose_source,license_and_copyright_notice,same_license,state_changes,liability,warranty
359,c for arcgis online ela arcgis online for organizations and paid developer plan accounts i licensee is also permitted to 1 charge an additional fee to third parties to access licensees value added applications subject to the terms of this license agreement and 2 transfer licensees value added applications to a third partys arcgis online account subject to the following a licensee may charge third parties a fee for licensees value added applications,,,,,,,,,,,,
360,b licensee is not obligated to provide technical support for the third partys general use of its arcgis online account not related to licensees value added applications,,,,,,,,,,,,
361,c licensee is not responsible for any fees accrued through the third partys use of licensees value added applications that have been transferred to or implemented on the third partys arcgis online account,,,,,,,,,,,,
362,d licensee is not permitted to invite licensees of an arcgis online public plan to participate in private groups,,,,,,,,,,,,
363,this restriction also applies to licensees of education plan accounts and ngo npo plan accounts,,,,,,,,,,,,
364,d for arcgis online public plan accounts development and testing plan accounts education plan accounts and ngo npo use of arcgis online for organizations accounts licensee is not permitted to charge an additional fee to third parties to access licensees value added applications or generate more than incidental advertising revenue as a consequence of the deployment or use of the value added applications,,,,,,,,,,,,
365,charging a fee to access licensees value added applications or generating more than incidental advertising revenue requires an arcgis online ela arcgis online for organizations or paid developer plan account,,,,,,,,,,,,
366,public plan accounts are licensed for the personal use of an individual,,,,,,,,,,,,
367,any use of public plan accounts by an individual for the benefit of a for profit business or a government agency is prohibited,,,,,,,,,,,,
368,âª this restriction does not apply to educational institutions when used for teaching purposes only qualified ngo npo organizations and press or media organizations,,,,,,,,,,,,
369,individuals affiliated with these specific types of organization are permitted to use arcgis online public plan accounts for the benefit of their affiliated organizations,,,,,,,,,,,,
370,public plan account licensees are not permitted to create private groups or participate in any private group created by licensees of arcgis online for organizations education ngo npo or ela plans,,,,,,,,,,,,
371,f for arcgis online development and testing plan accounts i,,,,,,,,,,,,
372,subject to the terms of this license agreement licensee is permitted to 1 allow third parties to access licensees value added applications powered by their development and testing plan account but only if the value added applications is published for public access and is not used for the benefit of a for profit business or government agency,,,,,,,,,,,,
373,âª this restriction does not apply to educational institutions when used for teaching purposes only qualified ngo npo organizations and press or media organizations,,,,,,,,,,,,
374,individuals affiliated with these specific types of organizations are permitted to use arcgis online development and testing plan accounts for the benefit of their affiliated organizations,,,,,,,,,,,,
375,development and testing plan account licensees are not permitted to create private groups or participate in any private group created by licensees of arcgis online for organizations education ngo npo or ela plans,,,,,,,,,,,,
376,g for arcgis online paid developer plan accounts or development and testing plan accounts i licensee is limited to one million 1000000 basemap and one million 1000000 geosearch transactions per month in conjunction with licensees account,,,,,,,,,,,,
377,transaction is defined in the documentation at arcgis resources at http  linksesricom agol transactiondef,,,,,,,,,,,,
378,h licensee is not permitted to be the licensee of an arcgis online account for or on behalf of a third party,,,,,,,,,,,,
379,âª this restriction does not apply to education institutions that are permitted to be licensees of arcgis online public plan accounts on behalf of registered students of the education institution for teaching purposes only,,,,,,,,,,,,
380,education institutions are also permitted to provide access to a single arcgis online public plan account to more than one 1 registered student when used for teaching purposes only,,,,,,,,,,,,
381,the terms online ela account organizations plan account developer plan account public plan account development and testing plan account and education plan account refer to different types of arcgis online accounts,,,,,,,,,,,,
382,world geocoding service licensee may not store the geocoded results generated by the service without an arcgis online account,,,,,,,,,,,,
383,b infographics service licensee may use the data accessible through this service for display purposes only,,,,,,,,,,,,
384,licensee is prohibited from saving any data accessible through this service,,,,,,,,,,,,
385,licensee may not display or post any combination of more than one hundred 100 esri business analyst online or esri community analyst reports and maps on licensees external websites,,,,,,,,,,,,
386,licensee may create publicly display and distribute maps in hard copy and static electronic format for news reporting purposes subject to any restrictions for arcgis online data set forth in addendum 2 note 1,,,,,,,,,,,,
387,addendum 4 limited use programs e300 4 this limited use programs addendum addendum 4 applies to any licensee that has been qualified by esri or its authorized distributor to participate in any of the programs described herein,,,,,,,,,,,,
388,this addendum 4 includes the licensees existing master license agreement if any or the license agreement found at http  wwwesricom legal software license as applicable the license agreement which is incorporated by reference,,,,,,,,,,,,
389,this addendum 4 takes precedence over conflicting terms of the license agreement,,,,,,,,,,,,
390,esri reserves the right to update the terms from time to time,,,,,,,,,,,,
391,âª educational programs 1 âª grant programs 2 âª home use program 3 âª other esri limited use programs 4 notes 1,,,,,,,,,,,,
392,educational programs licensee agrees to use products solely for educational purposes during the educational use term,,,,,,,,,,,,
393,licensee shall not use products for any administrative use unless licensee has acquired an administrative use term license,,,,,,,,,,,,
394,administrative use means administrative activities that are not directly related to instruction or education such as asset mapping facilities management demographic analysis routing campus safety and accessibility analysis,,,,,,,,,,,,
395,licensee shall not use products for revenue generating or for profit purposes,,,,,,,,,,,,
396,grant programs licensee may use products only for noncommercial purposes,,,,,,,,,,,,
397,except for cost recovery of using and operating the products licensee shall not use products for revenue generating or for profit purposes,,,,,,,,,,,,
398,all arcgis for home use program products are provided as term licenses and are identified on esris home use program website found at http  wwwesricom software arcgis arcgis for home or licensees authorized distributors website,,,,,,,,,,,,
399,b esri grants to licensee a personal nonexclusive nontransferable single use license without the authorization to install or use a second copy solely to use the products provided under the arcgis for home use program as set forth in the applicable ordering documents i for which the applicable license fees have been paid ii for licensees own noncommercial internal use iii in accordance with this license agreement and the configuration ordered by licensee or as authorized by esri or its authorized distributor and iv for a period of twelve 12 months unless terminated earlier in accordance with the license agreement,,,,,,,,,,,,
400,noncommercial means use in a personal or individual capacity that i is not compensated in any fashion ii is not intended to produce any works for commercial use or compensation iii is not intended to provide a commercial service and iv is neither conducted nor funded by any person or entity engaged in the commercial use application or exploitation of works similar to the licensed products,,,,,,,,,,,,
401,installation support for a period of ninety 90 days is included with arcgis for home use,,,,,,,,,,,,
402,as discussed further on the esri or authorized distributors website esri provides technical support in response to specific inquiries,,,,,,,,,,,,
403,software is provided only for standard hardware platforms and operating systems supported by esri as described in the software documentation,,,,,,,,,,,,
404,esri is not responsible for making or arranging for updates to interfaces for nonstandard devices or custom applications,,,,,,,,,,,,
405,esri installation support will be provided in compliance with the esri arcgis for home use installation support document on the esri website at http  wwwesricom ~ media files pdfs legal pdfs home use installation supportpdf,,,,,,,,,,,,
406,esri supports users solely with the installation of esri software,,,,,,,,,,,,
407,esris support website is at http  supportesricom en support,,,,,,,,,,,,
408,support provided by an authorized distributor will be in accordance with the distributors technical support program terms and conditions,,,,,,,,,,,,
409,other esri limited use programs if licensee acquires products under any limited use program not listed above licensees use of the products may be subject to the terms set forth in the applicable launching page or enrollment form or as described on esris website in addition to the nonconflicting terms of this addendum 4,,,,,,,,,,,,
