id,text,commercial_use,distribution,modification,private_use,patent_use,trademark_use,disclose_source,license_and_copyright_notice,same_license,state_changes,liability,warranty
94,c if your principal place of business for entities or place of residence for individuals is in greece all disputes as defined above will be governed by greek law and the parties submit to the exclusive jurisdiction of the courts of athens in relation to any dispute,,,,,,,,,,,,
95,in the event that either party is prevented from performing or is unable to perform any of its obligations under this agreement except payment obligations due to any cause beyond its reasonable control the affected party shall give written notice thereof to the other party and its performance shall be extended for the period of delay or inability to perform due to such occurrence,,,,,,,,,,,,
96,any notice or communication hereunder shall be in writing and either personally delivered or sent via confirmed facsimile confirmed electronic transmission recognized express delivery courier or certified or registered mail prepaid and return receipt requested addressed to the other party which in the case of developer shall be the email address that developer provided to google upon signing up for the services and in the case of google shall be google inc 1600 amphitheatre parkway mountain view ca 94043 usa with a copy to legal department,,,,,,,,,,,,
97,all notices shall be in english and deemed to have been received when they are hand delivered or five business days of their mailing or upon confirmed electronic transmission or confirmed facsimile transmission,,,,,,,,,,,,
98,this agreement and the rights and obligations hereunder may not be assigned transferred or delegated in whole or in part whether voluntarily or by operation of law contract merger whether developer is the surviving or disappearing entity stock or asset sale consolidation dissolution through government action or otherwise by developer without googleâs prior written consent,,,,,,,,,,,,
99,any assignment or transfer in violation of the foregoing shall automatically be null and void and google may immediately terminate this agreement upon such an attempt,,,,,,,,,,,,
100,this agreement shall be binding upon and inure to the benefit of any permitted successors representatives and permitted assigns of the parties hereto,,,,,,,,,,,,
101,the parties shall be independent contractors under this agreement and nothing herein will constitute either party as the employer employee agent or representative of the other party or both parties as joint venturers or partners for any purpose,,,,,,,,,,,,
102,neither party will have the right or authority to assume or create any obligation or responsibility on behalf of the other party,,,,,,,,,,,,
