id,text,commercial_use,distribution,modification,private_use,patent_use,trademark_use,disclose_source,license_and_copyright_notice,same_license,state_changes,liability,warranty
1,before filing or continuing to prosecute any legal proceeding or claim other than a defensive action arising from termination of a covered license we commit to extend to the person or entity you accused of violating the covered license the following provisions regarding cure and reinstatement taken from gpl version 3,,,,,,,,,,,,
2,as used here the term this license refers to the specific covered license being enforced,,,,,,,,,,,,
3,however if you cease all violation of this license then your license from a particular copyright holder is reinstated a provisionally unless and until the copyright holder explicitly and finally terminates your license and b permanently if the copyright holder fails to notify you of the violation by some reasonable means prior to 60 days after the cessation,,,,,,,,,,,,
4,moreover your license from a particular copyright holder is reinstated permanently if the copyright holder notifies you of the violation by some reasonable means this is the first time you have received notice of violation of this license for any work from that copyright holder and you cure the violation prior to 30 days after your receipt of the notice,,,,,,,,,,,,
5,we intend this commitment to be irrevocable and binding and enforceable against us and assignees of or successors to our copyrights,,,,,,,,,,,,
