id,text,commercial_use,distribution,modification,private_use,patent_use,trademark_use,disclose_source,license_and_copyright_notice,same_license,state_changes,liability,warranty
1,permission is granted to anyone to use this software free of charge for any purpose including commercial applications and to redistribute it provided that the warranty disclaimer is accepted and the following conditions are met all redistributions must keep the original package intact,,,,,,,,,,,,
2,especially you must retain all copyright notices that are currently in place and this license without modification,,,,,,,,,,,,
3,the origin of this software must not be misrepresented you must not claim that you wrote the original software,,,,,,,,,,,,
4,you may distribute this software using any medium you see fit provided you do not charge the user for the software itself see details below,,,,,,,,,,,,
5,allowed distribution channels include magazines addon cds   dvds   other addon media download portals your personal website or other distribution media if the following conditions are met no payment before downloads and no wrapper installers that have ads or install adware   spyware,,,,,,,,,,,,
6,ads on the pages of your download portal or website are acceptable,,,,,,,,,,,,
7,explicitly allowed is payed content as typical for printed magazines or books where the software is an addon and not the main content,,,,,,,,,,,,
8,if it is a digital magazine or e book please notify your readers in a freely accessible part that the software is freeware and optionally provide a link to http  mh nexusde hxd ,,,,,,,,,,,,
