id,text,commercial_use,distribution,modification,private_use,patent_use,trademark_use,disclose_source,license_and_copyright_notice,same_license,state_changes,liability,warranty
1,portions of this software were developed by the unidata program at the university corporation for atmospheric research,,,,,,,,,,,,
2,access and use of this software shall impose the following obligations and understandings on the user,,,,,,,,,,,,
3,the user is granted the right without any fee or cost to use copy modify alter enhance and distribute this software and any derivative works thereof and its supporting documentation for any purpose whatsoever provided that this entire notice appears in all copies of the software derivative works and supporting documentation,,,,,,,,,,,,
4,further ucar requests that the user credit ucar unidata in any publications that result from the use of this software or in any product that includes this software although this is not an obligation,,,,,,,,,,,,
5,the names ucar and or unidata however may not be used in any advertising or publicity to endorse or promote any products or commercial entity unless specific written permission is obtained from ucar unidata,,,,,,,,,,,,
6,the user also understands that ucar unidata is not obligated to provide the user with any support consulting training or assistance of any kind with regard to the use operation and performance of this software nor to provide the user with any updates revisions new versions or bug fixes,,,,,,,,,,,,
7,this software is provided by ucar unidata as is and any express or implied warranties including but not limited to the implied warranties of merchantability and fitness for a particular purpose are disclaimed,,,,,,,,,,,,
