id,text,commercial_use,distribution,modification,private_use,patent_use,trademark_use,disclose_source,license_and_copyright_notice,same_license,state_changes,liability,warranty
1,netcat is entirely my own creation although plenty of other code was used as examples,,,,,,,,,,,,
2,it is freely given away to the internet community in the hope that it will be useful with no restrictions except giving credit where it is due,,,,,,,,,,,,
3,no gpls berkeley copyrights or any of that nonsense,,,,,,,,,,,,
4,the author assumes no responsibility for how anyone uses it,,,,,,,,,,,,
5,if netcat makes you rich somehow and youre feeling generous mail me a check,,,,,,,,,,,,
6,if you are affiliated in any way with microsoft network get a life,,,,,,,,,,,,
