id,text,commercial_use,distribution,modification,private_use,patent_use,trademark_use,disclose_source,license_and_copyright_notice,same_license,state_changes,liability,warranty
1,redistribution and use in source and binary forms with or without modification are permitted provided that the following conditions are met redistribution of source code must retain the above copyright notice this list of conditions and the following disclaimer,,,,,,,,,,,,
2,redistribution in binary form must reproduce the above copyright notice this list of conditions and the following disclaimer in the documentation and or other materials provided with the distribution,,,,,,,,,,,,
3,neither the name of oracle and or its affiliates,,,,,,,,,,,,
4,or the names of contributors may be used to endorse or promote products derived from this software without specific prior written permission,,,,,,,,,,,,
5,this software is provided as is without a warranty of any kind,,,,,,,,,,,,
6,all express or implied conditions representations and warranties including any implied warranty of merchantability fitness for a particular purpose or non  infringement are hereby excluded,,,,,,,,,,,,
7,sun and its licensors shall not be liable for any damages suffered by licensee as a result of using modifying or distributing this software or its derivatives,,,,,,,,,,,,
8,in no event will sun or its licensors be liable for any lost revenue profit or data or for direct indirect special consequential incidental or punitive damages however caused and regardless of the theory of liability arising out of the use of or inability to use this software even if sun has been advised of the possibility of such damages,,,,,,,,,,,,
