id,text,commercial_use,distribution,modification,private_use,patent_use,trademark_use,disclose_source,license_and_copyright_notice,same_license,state_changes,liability,warranty
127,shared modifications means modifications that licensee distributes or uses for a commercial use in addition to any modifications provided by licensee at licenseeâs option pursuant to section 22 or received by licensee from another helix licensee pursuant to section 23,,,,,,,,,,,,
128,source code means the preferred form of the covered code for making modifications to it including all modules it contains plus any associated interface definition files scripts used to control compilation and installation of an executable,,,,,,,,,,,,
129,specifications means the specifications for the helix dna code and other documentation as published by rn from time to time on the helix community website,,,,,,,,,,,,
130,technology compatibility kit or tck means the interoperability testing specification documentation and related testing tools made available to licensee by rn from time to time for the purpose of testing licenseeâs implementations of the covered code,,,,,,,,,,,,
131,rn may in its sole discretion and from time to time revise a tck to correct errors or omissions and in connection with upgrades,,,,,,,,,,,,
132,upgrades means new versions of helix dna code designated exclusively by rn as an upgrade and released by rn from time to time under the terms of this license,,,,,,,,,,,,
133,upgraded code means the source code or executables for upgrades possibly including modifications made by other helix licensees,,,,,,,,,,,,
134,attachment a required notices attachment a 1 required in all cases notice to be included in header file of all error corrections and shared modifications portions copyright 1994 2007 â© realnetworks inc all rights reserved,,,,,,,,,,,,
135,the contents of this file and the files included with this file are subject to the current version of realnetworks community source license version 30 the license,,,,,,,,,,,,
136,you may not use this file except in compliance with the license executed by both you and realnetworks,,,,,,,,,,,,
137,you may obtain a copy of the license at https  wwwhelixcommunityorg content rcsl,,,,,,,,,,,,
138,you may also obtain a copy of the license by contacting realnetworks directly,,,,,,,,,,,,
139,please see the license for the rights obligations and limitations governing use of the contents of the file,,,,,,,,,,,,
140,this file is part of the helix dna code,,,,,,,,,,,,
141,realnetworks inc is the developer of the original code and owns the copyrights in the portions it created,,,,,,,,,,,,
142,this file and the files included with this file are distributed on an as is basis without warranty of any kind either express or implied and realnetworks hereby disclaims all such warranties including without limitation any warranties of merchantability fitness for a particular purpose quiet enjoyment or non infringement,,,,,,,,,,,,
143,contributors technology compatibility kit test suites location attachment a 2 sample licensee certification by clicking the `agree button below you certify that you are a licensee in good standing under the realnetworks community source license â research and development or the realnetworks community source license â commercial each a license and that your access use and distribution of code and information you may obtain at this site is subject to the license,,,,,,,,,,,,
144,if you are not a licensee under the realnetworks community source license you may not download copy or use the helix dna code,,,,,,,,,,,,
145,attachment a 3 required student notification this software and related documentation has been obtained by your educational institution subject to the realnetworks community source license,,,,,,,,,,,,
146,you have been provided access to the software and related documentation for use only in connection with your course work and research activities as a matriculated student of your educational institution,,,,,,,,,,,,
147,this software and related documentation contains proprietary material of realnetworks inc which are protected by various intellectual property rights,,,,,,,,,,,,
148,you may not use this file except in compliance with the license,,,,,,,,,,,,
