id,text,commercial_use,distribution,modification,private_use,patent_use,trademark_use,disclose_source,license_and_copyright_notice,same_license,state_changes,liability,warranty
72,the obligations of recipient under section 141 will not apply to any confidential information that a is now or thereafter becomes generally known or available to the public through no act or omission on the part of recipient or any of its representatives affiliates or agents or any third party subject to any use or disclosure restrictions with respect to such confidential information b was known by or lawfully in the possession of recipient prior to receiving such information from discloser without restriction as to use or disclosure c is rightfully acquired by recipient from a third party who has the right to disclose it and who provides it without restriction as to use or disclosure or d is independently developed by recipient without access use or reference to any confidential information of discloser,,,,,,,,,,,,
73,the provisions of section 141 will not restrict recipient from disclosing discloserâs confidential information to the extent required by any law enforcement agencies or regulators or compelled by a court or administrative agency of competent jurisdiction provided that to the extent permissible under law recipient uses reasonable efforts to give discloser advance notice of such required disclosure as appropriate in order to enable discloser to prevent or limit disclosure,,,,,,,,,,,,
74,upon termination of the agreement or support and maintenance recipient will promptly return to discloser or at discloserâs option destroy all tangible items and embodiments containing or consisting of discloserâs confidential information and all copies thereof and provide written certification of such destruction or return by an authorized person,,,,,,,,,,,,
75,recipient agrees that due to the unique nature of the confidential information the unauthorized disclosure or use of the confidential information will cause irreparable harm and significant injury to discloser the extent of which will be difficult to ascertain and for which there will be no adequate remedy at law,,,,,,,,,,,,
76,accordingly recipient agrees that discloser in addition to any other available remedies will have the right to an immediate injunction and other equitable relief enjoining any breach or threatened breach of this section 14 without the necessity of posting any bond or other security,,,,,,,,,,,,
77,recipient will notify discloser in writing immediately upon recipientâs becoming aware of any such breach or threatened breach,,,,,,,,,,,,
78,this agreement will commence upon splunkâs first delivery of the software specified in the order or splunkâs other initial delivery of the software to customer and will remain in effect until the expiration of the applicable software license term unless earlier terminated pursuant to section 16 the âtermâ,,,,,,,,,,,,
79,for the avoidance of doubt termination of a license term shall not affect the term of any other licenses applicable to other splunk products and services that customer has purchased,,,,,,,,,,,,
80,further termination of a content subscription shall not affect the term of the base license applicable to the software that customer has purchased,,,,,,,,,,,,
81,unless otherwise indicated in the order the term for purchased software free software splunk extensions and splunk developer tools if applicable will continue indefinitely unless and until terminated pursuant to section 16,,,,,,,,,,,,
82,if the order indicates a term of a specific duration for any of the foregoing the licenses granted to customer for such purchased software or free software will terminate automatically upon expiration of such term,,,,,,,,,,,,
83,upon expiration of any term the applicable software will stop working automatically,,,,,,,,,,,,
84,if customer is granted a license for evaluation software then the term for such evaluation software will be specified in the order or with the license key,,,,,,,,,,,,
85,if no such term is specified the term for evaluation software is thirty 30 days from the date the license key is delivered,,,,,,,,,,,,
86,any license keys provided for evaluation software will automatically expire and cause the evaluation software to become non operational at the end of the term,,,,,,,,,,,,
87,if customer wishes to use the evaluation software after the term expires then customer must obtain the applicable paid license,,,,,,,,,,,,
88,either party may terminate this agreement by written notice to the other party if the other party materially breaches this agreement and does not cure the breach within thirty 30 days of receiving written notice of the breach pursuant to section 232 below,,,,,,,,,,,,
89,in addition splunk may immediately terminate this agreement in whole or in part including with respect to any term by written notice to customer a if customer materially breaches section 3 and b as set forth in section 6,,,,,,,,,,,,
90,splunk may also terminate customerâs license to any evaluation software at any time with or without cause by notice to customer,,,,,,,,,,,,
91,if customer is the government then termination terms and conditions will be governed by 48 cfr,,,,,,,,,,,,
92,upon any expiration or termination of this agreement the rights and licenses granted to customer hereunder will automatically terminate and customer agrees to cease immediately using the splunk materials and to return or destroy all copies of the splunk materials and other splunk confidential information in customerâs possession or control and certify in writing the completion of such return or destruction in accordance with section145,,,,,,,,,,,,
93,upon termination of this agreement splunk will have no obligation to refund any fees or other amounts received from customer during the term and notwithstanding any early termination above customer shall still be required to pay all fees payable under an order ie no such early termination shall relieve customer of its obligations to pay all fees payable under an order unless otherwise provided in this agreement,,,,,,,,,,,,
94,termination of support and maintenance terms and conditions due to splunkâs breach is provided in section 32 of exhibit c section 1 definitions section 5 ownership section 9 software verification and audit section 11 warranty disclaimer section 12 limitation of liability section 13 indemnity section 14 confidentiality section 16 termination and sections 17 export through 23 general will survive any expiration or termination of this agreement,,,,,,,,,,,,
95,customer will comply fully with all relevant export laws and regulations of the united states and any other country âexport lawsâ where customer uses any of the splunk materials,,,,,,,,,,,,
96,customer certifies that customer is not on any of the relevant us government lists of prohibited persons including the treasury departmentâs list of specially designated nationals and the commerce departmentâs list of denied persons or entity list,,,,,,,,,,,,
97,customer further certifies that customer will not export re export ship transfer or otherwise use the splunk materials in any country subject to an embargo or other sanction by the united states and that customer will not use the splunk materials for any purpose prohibited by the export laws including but not limited to nuclear chemical missile or biological weapons related end uses,,,,,,,,,,,,
98,customer acknowledges that all splunk materials were developed entirely at private expense and that no part of the splunk materials was first produced in the performance of a government contract,,,,,,,,,,,,
99,customer agrees that all splunk materials and any derivatives thereof are âcommercial itemsâ as defined in 48 cfr,,,,,,,,,,,,
100,â§ 2101 and if customer is the government then such use duplication reproduction release modification disclosure or transfer of this commercial product and data is restricted in accordance with 48 cfr,,,,,,,,,,,,
101,â§â§ 2277202 1 through 2277202 4 as applicable the splunk materials are licensed to government end users a only as commercial items and b with only those rights as are granted to all other users pursuant to this agreement and any related agreements as applicable,,,,,,,,,,,,
102,accordingly customer will have no rights in the splunk materials except as expressly agreed to in writing by customer and splunk,,,,,,,,,,,,
103,customer agrees that splunk may publish a brief description of customerâs deployment of the software and identify customer as a splunk customer on any of splunkâs websites client lists press releases and or other marketing materials,,,,,,,,,,,,
104,certain extensions and other materials or services made available for download or access on splunkbase are developed and or provided by third parties âthird party contentâ,,,,,,,,,,,,
105,splunk makes such third party content available for download on splunkbase as a convenience to its customers but splunk neither controls nor endorses nor is splunk responsible for any third party content including the accuracy integrity quality legality usefulness or safety of third party content,,,,,,,,,,,,
106,certain third party content may among other things be inaccurate nonfunctional infringing or dangerous,,,,,,,,,,,,
107,nothing in this agreement or on splunkbase will be deemed to be a representation or warranty by splunk with respect to any third party content even if a particular extension or other item of third party content is identified as âcertifiedâ or validated for use with software,,,,,,,,,,,,
108,splunk has no obligation to monitor third party content and splunk may block or disable access to any third party content at any time,,,,,,,,,,,,
109,in addition the availability of any third party content through splunkbase does not imply splunkâs endorsement of or affiliation with any provider of such third party content nor does such availability create any legal relationship between customer and any such provider,,,,,,,,,,,,
110,customerâs use of third party content is at customerâs own risk and may be subject to any additional terms conditions and policies applicable to such third party content such as license terms terms of service or privacy policies of the providers of such third party content,,,,,,,,,,,,
111,if customer acquired the software through an authorized reseller partner or oem of splunk âauthorized partnerâ then notwithstanding anything to the contrary in this agreement a customerâs use of the software is subject to any additional terms in the agreement provided by the authorized partner b customer agrees to pay the authorized partner the fees and other applicable fees and customer will have no direct fee payment obligations to splunk for such software c customerâs agreement with the authorized partner is between customer and the authorized partner and is not binding on splunk and d splunk may terminate this agreement including customerâs right to use the software if splunk does not receive payment for customerâs use of the software from the authorized partner or if customer breaches any term of this agreement,,,,,,,,,,,,
112,if customerâs warranty and support terms stated in its agreement with the authorized partner are different from those set forth in this agreement then such different terms are solely between customer and the authorized partner and splunk will have no obligations to customer under this agreement with respect to such different terms,,,,,,,,,,,,
113,except as set forth in the preceding sentence if there is any conflict or inconsistency between this agreement and customerâs agreement with authorized partner then this agreement will control and will resolve such inconsistency as between splunk and customer,,,,,,,,,,,,
114,unless customer is the government this agreement will be governed by and construed in accordance with the laws of the state of california as if performed wholly within the state and without giving effect to the conflicts of law principles of any jurisdiction or the united nations convention on contracts for the international sale of goods the application of which is expressly excluded,,,,,,,,,,,,
115,any legal action or proceeding arising under this agreement will be brought exclusively in the federal or state courts located in san francisco california and the parties hereby consent to personal jurisdiction and venue therein except that splunk may seek injunctive relief to prevent improper or unauthorized use or disclosure of any splunk materials in any court of competent jurisdiction,,,,,,,,,,,,
116,if customer is the government this agreement will be governed by and interpreted in accordance with the contract disputes act of 1978 as amended 41 usc,,,,,,,,,,,,
117,failure of the parties to reach agreement on any request for equitable adjustment claim appeal or action arising under or relating to this agreement will be a dispute to be resolved in accordance with the clause at 48 cfr â§ 52233 1 which is incorporated in this agreement by reference,,,,,,,,,,,,
118,customerâs issuance of a purchase order constitutes acceptance of this agreement notwithstanding anything to the contrary in such purchase order,,,,,,,,,,,,
119,if any purchase order contains any terms or conditions that are different from or additional to the terms and conditions set forth in this agreement then splunk expressly rejects such different or additional terms and conditions and such different or additional terms and conditions will not become a part of the agreement between the parties notwithstanding any subsequent acknowledgement invoice or license key that splunk may issue,,,,,,,,,,,,
120,all notices required or permitted under this agreement will be in writing and delivered in person by confirmed facsimile transmission by overnight delivery service or by registered or certified mail postage prepaid with return receipt requested and in each instance will be deemed given upon receipt,,,,,,,,,,,,
121,all communications will be sent to the addresses set forth in the applicable order or to such other address as may be specified by either party to the other party in accordance with this section,,,,,,,,,,,,
122,customer may not assign delegate or transfer this agreement in whole or in part by agreement operation of law or otherwise without the prior written consent of splunk,,,,,,,,,,,,
123,splunk may assign this agreement in whole or in part to an affiliate or in connection with an internal reorganization or a merger acquisition or sale of all or substantially all of splunkâs assets to which this agreement relates,,,,,,,,,,,,
124,splunk may also assign its rights to receive payment due as a result of performance of this agreement to a bank trust company or other financing institution including any federal lending agency in accordance with the assignment of claims act 31 usc,,,,,,,,,,,,
125,â§ 3727 and may assign this agreement in accordance with the provisions at 48 cfr â§ 4212 as applicable,,,,,,,,,,,,
126,any attempt to assign this agreement other than as permitted herein will be null and void,,,,,,,,,,,,
127,subject to the foregoing this agreement will bind and inure to the benefit of the partiesâ permitted successors and assigns,,,,,,,,,,,,
128,except as otherwise expressly set forth in this agreement the rights and remedies of either party as set forth in this agreement are not exclusive and are in addition to any other rights and remedies now or hereafter provided by law or at equity,,,,,,,,,,,,
129,the waiver by either party of a breach of or a default under this agreement will not be effective unless in writing,,,,,,,,,,,,
130,the failure by either party to enforce any provisions of this agreement will not constitute a waiver of any other right hereunder or of any subsequent enforcement of that or any other provisions,,,,,,,,,,,,
131,if a court of competent jurisdiction holds any provision of this agreement invalid or unenforceable the remaining provisions of the agreement will remain in full force and effect and the provision affected will be construed so as to be enforceable to the maximum extent permissible by law,,,,,,,,,,,,
132,for purposes of interpreting this agreement a unless the context otherwise requires the singular includes the plural and the plural includes the singular b unless otherwise specifically stated the words âhereinâ âhereofâ and âhereunderâ and other words of similar import refer to this agreement as a whole and not to any particular section or paragraph c the words âincludeâ and âincludingâ will not be construed as terms of limitation and will therefore mean âincluding but not limited toâ and âincluding without limitationâ d unless otherwise specifically stated the words âwritingâ or âwrittenâ mean preserved or presented in retrievable or reproducible form whether electronic including email but excluding voice mail or hard copy e the captions and section and paragraph headings used in this agreement are inserted for convenience only and will not affect the meaning or interpretation of this agreement and f the references herein to the parties will refer to their permitted successors and assigns,,,,,,,,,,,,
133,the software and other splunk extensions may be configured to allow splunk to collect and process technical and related information about customerâs use of the software which may include without limitation ingest volume search concurrency number of unique user logins internet protocol addresses page views session duration and other similar data and certain aggregated anonymized information about the software environment such as hardware identification operating system application version performance configuration and other usage information,,,,,,,,,,,,
134,splunk uses this information to support and troubleshoot issues provide updates automate invoices analyze trends and improve splunkâs products or services,,,,,,,,,,,,
135,participation in the collection and processing of such data by splunk is voluntary except for certain free or evaluation software or other programs as designated by splunk which may require customerâs participation in an in product analytics program as a condition of receiving access to and using such software and instructions on how to disable these in product collection features are set forth in splunkâs end user documentation,,,,,,,,,,,,
136,splunk collects and processes the information it collects subject to splunkâs privacy policy which can be found at https  wwwsplunkcom en_us legal privacy privacy policyhtml and is hereby incorporated by reference and made a part of this agreement,,,,,,,,,,,,
137,this agreement along with any additional terms incorporated herein by reference including the order and the exhibits hereto constitute the complete and exclusive understanding and agreement between the parties and supersedes any and all prior or contemporaneous agreements communications and understandings written or oral relating to their subject matter,,,,,,,,,,,,
138,any waiver modification or amendment of any provision of this agreement will be effective only if in writing and signed by duly authorized representatives of both parties,,,,,,,,,,,,
139,any terms and conditions contained or referenced by either party in a quote purchase order acceptance invoice or any similar document purporting to modify the terms and conditions contained in this agreement will be disregarded and have no effect unless otherwise expressly agreed to by the parties in accordance with the preceding sentence,,,,,,,,,,,,
140,exhibit a exhibit b licensed capacity the licensed capacity and other license limitations associated with each purchased software can be found here https  wwwsplunkcom en_us legal licensed capacityhtml exhibit c splunk inc support and maintenance terms and conditions customer agrees that the following terms and conditions âterms and conditionsâ will govern the delivery of any support and or maintenance services by splunk âsupportâ listed on an order entered into pursuant to the software license agreement the âagreementâ to which these terms and conditions are attached and made a part thereof,,,,,,,,,,,,
141,subject to customerâs termination rights set forth in the agreement ordering any support from splunk or any authorized partner indicates customerâs acceptance of these terms and conditions,,,,,,,,,,,,
142,these terms and conditions are effective upon receipt and confirmation of acceptance of customerâs purchase order by splunk or an authorized partner the âeffective dateâ,,,,,,,,,,,,
143,subject to customerâs timely payment of the applicable annual support fees set forth in the order the âsupport feesâ splunk will provide the level of support identified in the order in accordance with the support descriptions set forth below,,,,,,,,,,,,
144,no other maintenance or support for the software is included,,,,,,,,,,,,
145,support fees will be due and payable in accordance with the order,,,,,,,,,,,,
146,splunk will notify electronically or otherwise customer of the then current annual support fee for customerâs level of support in each notice of term renewal,,,,,,,,,,,,
147,splunk will have no obligation of any kind to provide support for issues caused by or arising out of any of the following each a âlicensee generated errorâ i modifications to the software not made by splunk ii use of the software other than as authorized in the agreement or as provided in the documentation for the software iii damage to the machine on which the software is installed iv customerâs continued failure to use the software without reference to the documentation v versions of the software other than the supported version defined in section266 vi third party products not expressly supported by splunk and described in the documentation or vii conflicts related to replacing or installing hardware drivers and software that are not expressly supported by splunk and described in the documentation,,,,,,,,,,,,
148,if splunk determines that support for an issue caused by a licensee generated error splunk will notify customer as soon as reasonably possible under the circumstances,,,,,,,,,,,,
149,if customer agrees that splunk should provide support for the licensee generated error via a confirming email then splunk will have the right to invoice customer at splunkâs then current time and materials rates for any such support provided by splunk,,,,,,,,,,,,
150,subject to customerâs payment of the applicable annual support fees if customer are a licensee of a splunk extension supported by splunk splunk will provide an initial response and acknowledgement in accordance with p3 terms as described in the support programs as defined below,,,,,,,,,,,,
151,updates for the software will be provided when made available,,,,,,,,,,,,
152,no other sections in these terms and conditions apply to splunk extensions,,,,,,,,,,,,
153,support is delivered only in english unless customer is in a location where splunk has made localized support available,,,,,,,,,,,,
154,261 splunk supportcustomerâs order will identify the level of support customer purchases for the applicable purchased software,,,,,,,,,,,,
155,a summary of the different support programs and levels are described here http  wwwsplunkcom en_us support and services support programshtml âsupport programsâ,,,,,,,,,,,,
156,support cases are handled based on case priority levels as described in the support programs,,,,,,,,,,,,
157,when submitting a case customer will select the priority for initial response by logging the case online in accordance with the priority guidelines set forth in the support programs,,,,,,,,,,,,
158,when the case is received splunk support may change the priority if the issue does not conform to the criteria for the selected priority and will provide customer with notice electronic or otherwise of such change,,,,,,,,,,,,
159,support will be provided solely to the authorized individuals specified by customer that splunk will communicate with that individuals when providing support âsupport contactsâ,,,,,,,,,,,,
160,splunk strongly recommends that customerâs support contacts be trained on the purchased software,,,,,,,,,,,,
161,customerâs order will indicate a maximum number of authorized support contacts for customerâs license level,,,,,,,,,,,,
162,customer will be asked to designate customerâs authorized support contacts including their primary email address and splunkcom login id following splunkâs acknowledgment of customerâs order,,,,,,,,,,,,
163,should splunk in its sole judgment determine that there is a defect in the purchased software it will at its sole option repair that defect in the version of the software that customer is currently using or instruct customer to install a newer version of the software with that defect repaired,,,,,,,,,,,,
164,splunk reserves the right to provide customer with a workaround in lieu of fixing a defect should it in its sole judgment determine that it is more effective to do so,,,,,,,,,,,,
165,support is provided via telephone email and web portal,,,,,,,,,,,,
166,support will be delivered by a member of splunkâs technical support team during the regional hours of operation listed in the support programs page,,,,,,,,,,,,
