id,text,commercial_use,distribution,modification,private_use,patent_use,trademark_use,disclose_source,license_and_copyright_notice,same_license,state_changes,liability,warranty
1,splunk software license agreement this splunk software license agreement âagreementâ governs the licensing installation and use of splunk software,,,,,,,,,,,,
2,by downloading and or installing splunk software a you are indicating that you have read and understand this agreement and agree to be legally bound by it on behalf of the company government or other entity for which you are acting for example as an employee or government official or if there is no company government or other entity for which you are acting on behalf of yourself as an individual and b you represent and warrant that you have the authority to act on behalf of and bind such company government or other entity if any,,,,,,,,,,,,
3,without limiting the foregoing you and your entity if any acknowledge that by submitting an order for the splunk software you and your entity if any have agreed to be bound by this agreement,,,,,,,,,,,,
4,as used in this agreement âsplunkâ refers to splunk inc a delaware corporation with its principal place of business at 270 brannan street san francisco california 94107 usa and âcustomerâ refers to the company government or other entity on whose behalf you have entered into this agreement or if there is no such entity you as an individual,,,,,,,,,,,,
5,subject to customerâs compliance with this agreement including customerâs timely payment of all license fees splunk grants to customer a nonexclusive worldwide nontransferable nonsublicensable license during the applicable term to install and use the purchased software within the licensed capacity solely for customerâs internal business purposes,,,,,,,,,,,,
6,if the applicable order specifies that any software is provided under an evaluation license or a free trial license then subject to customerâs compliance with this agreement splunk grants to customer a nonexclusive worldwide nontransferable nonsublicensable license during the applicable term to install and use the evaluation software within the licensed capacity solely for evaluating whether customer wishes to purchase a commercial license for such software,,,,,,,,,,,,
7,notwithstanding anything to the contrary in this agreement splunk does not provide maintenance and support section 7 warranty section 10 or indemnification section 13 with respect to evaluation software,,,,,,,,,,,,
8,if the applicable order specifies that any software is provided under a test and development license then subject to customerâs compliance with this agreement splunk grants to customer a nonexclusive worldwide nontransferable nonsublicensable license during the applicable term to install and use the test and development software within the licensed capacity in a non production system used for software product migration testing software product pre production staging testing new data sources types or use cases or other non production use,,,,,,,,,,,,
9,in no way should the test and development software be used for any revenue generation commercial activity or other productive business or purpose,,,,,,,,,,,,
10,notwithstanding anything to the contrary in this agreement splunk does not provide warranty section 10 or indemnification section 13 with respect to the test and development software,,,,,,,,,,,,
11,splunk may make certain software available for license without charge and such free software may have limited features functions or other limitations of any kind,,,,,,,,,,,,
12,subject to customerâs compliance with this agreement splunk grants to customer a nonexclusive worldwide nontransferable nonsublicensable license during the applicable term to install and use the free software within the licensed capacity solely for customerâs internal business purposes,,,,,,,,,,,,
13,notwithstanding anything to the contrary in this agreement splunk does not provide maintenance and support section 7 warranty section 10 or indemnification section 13 with respect to free software,,,,,,,,,,,,
14,when the applicable order specifies a content subscription service as elected by customer splunk will deliver or otherwise make available the applicable content subscription service to customer during the subscription period and subject to customerâs compliance with this agreement including customerâs timely payment of all applicable content subscription fees splunk grants to such customer a nonexclusive worldwide nontransferable nonsublicensable license during the applicable subscription period to install and use the subscribed content solely in connection with the designated purchased software and solely for customerâs internal business purposes,,,,,,,,,,,,
15,such content will be treated as purchased software under this agreement except that section 10 warranty will not apply,,,,,,,,,,,,
16,subject to customerâs compliance with this agreement including customerâs timely payment of all license fees if any splunk grants to customer a nonexclusive worldwide nontransferable nonsublicensable license to use splunk extensions solely in connection with applicable software that customer has licensed from splunk subject to the same limitations and restrictions including with respect to term and licensed capacity that apply to the software with which the splunk extensions are used,,,,,,,,,,,,
17,notwithstanding the foregoing if any splunk extension is provided to customer under a separate license agreement that grants customer more permissive or broader rights with respect to such splunk extension eg a separate license agreement that is provided to customer as part of the download process for such splunk extension then that separate license agreement and not this agreement will govern customerâs installation and use of such splunk extension but for clarity this agreement will apply to all other splunk extensions,,,,,,,,,,,,
18,subject to customerâs compliance with this agreement splunk grants to customer a nonexclusive worldwide nontransferable nonsublicensable license a to copy modify and use the splunk developer tools solely to develop extensions for use with the designated software or splunk extension âcustomer extensionsâ including to support interoperability between the software or splunk extension and customerâs system or environment and b to distribute the customer extensions exclusively for the use with the designated software or splunk extension,,,,,,,,,,,,
19,the foregoing license is subject to the following conditions x splunk proprietary legends or notices contained in the splunk developer tools may not be removed or altered when used in or with the customer extension and y customer may not make any statement that customer extension is certified or that its performance is guaranteed by splunk,,,,,,,,,,,,
20,customer retains title to the customer extensions subject to splunkâs ownership set forth in section 5,,,,,,,,,,,,
21,if customer allows end users of customer extensions to modify or distribute the customer extensions customer shall limit such modification or distribution to use with the designated software or splunk extension only and will flow down the conditions in x and y above to end users of customer extensions,,,,,,,,,,,,
22,customer agrees to assume full responsibility for the performance and distribution of customer extensions,,,,,,,,,,,,
23,customer acknowledges that certain software may contain open source software,,,,,,,,,,,,
24,open source software may be identified in the end user documentation or in a list of the open source software provided to customer upon customerâs written request,,,,,,,,,,,,
25,any open source software that is delivered to customer as part of purchased software and which may not be taken out of the purchased software or used separately from the purchased software is covered by the warranty support and indemnification provisions applicable to purchased software,,,,,,,,,,,,
26,customer acknowledges that specific terms required by the respective licensor of the open source software may apply to the use of open source software which terms shall be included in the documentation however these terms will not a impose any additional restrictions on customers use of the software or b negate or amend splunkâs responsibilities with respect to purchased software,,,,,,,,,,,,
27,unless otherwise expressly permitted by splunk customer will not and customer has no right to a copy any splunk materials except as required to run the software and for reasonable backup purposes b modify adapt or create derivative works of any splunk materials c rent lease loan resell transfer sublicense distribute disclose or otherwise provide any splunk materials to any third party d decompile disassemble or reverse engineer any splunk materials or determine or attempt to determine any source code algorithms methods or techniques embodied in any splunk materials except to the extent expressly permitted by applicable law notwithstanding a contractual prohibition to the contrary e access or use any disabled materials f provide to any third party the results of any benchmark tests or other evaluation of any splunk materials without splunkâs prior written consent g attempt to disable or circumvent any license key or other technological mechanisms or measures intended to prevent limit or control use or copying of or access to any splunk materials including in order to gain access to any disabled materials h remove or obscure any copyright trademark patent or other proprietary notices legends or symbols from any splunk materials i exceed the licensed capacity or violate other license limitations identified in exhibit b or elsewhere in this agreement j separately use any of the applicable features and functionalities of the splunk materials with external applications or code not furnished by splunk or any data not processed by the software except otherwise specifically permitted in the documentation k misuse the software or use the software for any illegal harmful fraudulent or offensive purposes l otherwise access or use any splunk materials except as expressly authorized in this agreement or m encourage or assist any third party to do any of the foregoing,,,,,,,,,,,,
28,customer acknowledges that the software may be configured to display warnings reduce available functionality and or cease functioning if unauthorized or improper use is detected including if the term expires or the licensed capacity is reached or exceeded,,,,,,,,,,,,
29,customer may permit its authorized consultants contractors and agents âservice providersâ to access and use the software solely on customerâs behalf in connection with providing services to customer subject to the terms and conditions of this agreement,,,,,,,,,,,,
30,any such access or use by a service provider will be subject to the same limitations and restrictions that apply to customer under this agreement and customer will be jointly and severally liable for any service providerâs actions relating to or use of the software,,,,,,,,,,,,
31,for avoidance of doubt the aggregate use by customer and all of its service providers must not exceed the licensed capacity and nothing in this section 4 is intended to or will be deemed to increase any licensed capacity,,,,,,,,,,,,
32,splunk its suppliers and or licensors own all worldwide right title and interest in and to the splunk materials including all related intellectual property rights,,,,,,,,,,,,
33,except for the licenses expressly granted to customer in section 2 customer will not acquire or claim any right title or interest in or to any splunk materials or related intellectual property rights whether by implication operation of law or otherwise,,,,,,,,,,,,
34,notwithstanding anything to the contrary the software is licensed not sold to customer,,,,,,,,,,,,
35,to the extent that customer provides any feedback customer grants to splunk a perpetual irrevocable worldwide nonexclusive transferable sublicensable royalty free fully paid up right and license to use and commercially exploit the feedback in any manner splunk deems fit,,,,,,,,,,,,
36,customer will pay all license fees set forth in the order the âlicense feesâ for the software delivered to customer no later than thirty 30 days after the date of splunkâs applicable invoice,,,,,,,,,,,,
37,customer will also pay all content subscription fees as may be applicable to the purchased software as identified in the order the âcontent subscription feesâ collectively together with license fees the âfeesâ,,,,,,,,,,,,
38,without limitation of splunkâs other termination rights if customer fails to pay the fees when due then splunk may terminate this agreement and all licenses granted hereunder by notice to customer,,,,,,,,,,,,
39,any fees and payment terms for splunk extensions not included in the order will be as set forth on the download page for such splunk extensions,,,,,,,,,,,,
40,if customer has purchased support and maintenance for the purchased software as set forth in the order the âsupport servicesâ then splunk will provide the level of support and maintenance included in the order in accordance with the terms and conditions set forth in exhibit c configuration services,,,,,,,,,,,,
41,subject to customerâs payment of applicable fees splunk will provide the deployment usage assistance configuration and or training services if any set forth in the order the âprofessional servicesâ in accordance with splunkâs standard professional services terms and conditions provided at https  wwwsplunkcom en_us legal professional services agreementhtml which terms and conditions are hereby incorporated by reference and made a part of this agreement,,,,,,,,,,,,
42,at splunkâs request customer will furnish splunk with a certification signed by customerâs authorized representative verifying that the software is being used in accordance with this agreement and the applicable order,,,,,,,,,,,,
43,also if customer has purchased an offering that requires usage reporting as identified in the order customer agrees to provide such reporting pursuant to the requirements set forth by splunk,,,,,,,,,,,,
44,upon at least ten 10 daysâ prior written notice to customer splunk may audit customerâs and its service providersâ use of the software to ensure that customer and such service providers are in compliance with this agreement and the applicable order,,,,,,,,,,,,
45,any such audit will be conducted during regular business hours at customerâs and or its service providers facilities will not unreasonably interfere with customerâs or its service providersâ business and will comply with customerâs or its service providersâ reasonable security procedures,,,,,,,,,,,,
46,customer will and will ensure that its service providers provide splunk with reasonable access to all relevant records and facilities reasonably necessary to conduct the audit,,,,,,,,,,,,
47,if an audit reveals that customer and or any service provider has exceeded the licensed capacity or the scope of customerâs license grant during the period audited then splunk will invoice customer and customer will promptly pay splunk any underpaid fees based on splunkâs price list in effect at the time the audit is completed,,,,,,,,,,,,
48,if the excess usage exceeds ten percent 10% of the licensed capacity then customer will also pay splunkâs reasonable costs of conducting the audit,,,,,,,,,,,,
49,customer will ensure that its service providers provide splunk with the access described in this section 9,,,,,,,,,,,,
50,this section 9 will survive expiration or termination of this agreement for a period of three 3 years,,,,,,,,,,,,
51,splunk warrants that for a period of thirty 30 days from the delivery of purchased software the purchased software will substantially perform the material functions described in splunkâs user documentation for such purchased software when used in accordance with the user documentation,,,,,,,,,,,,
52,the sole liability of splunk and its affiliates and suppliers licensors and customerâs sole remedy for any failure of the purchased software to conform to the foregoing warranty is for splunk to do one of the following at splunkâs sole option and discretion a modify or provide an enhancement for the purchased software so that it conforms to the foregoing warranty b replace customerâs copy of the purchased software with a copy that conforms to the foregoing warranty or c terminate the license with respect to the non conforming purchased software and refund the license fees paid by customer for such non conforming purchased software,,,,,,,,,,,,
53,all warranty claims must be made by written notice from customer to splunk on or before the expiration of the warranty period as detailed in section 232 below,,,,,,,,,,,,
54,except as expressly set forth in section 10 above the splunk materials open source software third party content support services and professional services are provided âas isâ with no warranties whatsoever express or implied,,,,,,,,,,,,
55,to the full extent permitted by law splunk and its suppliers and licensors disclaim all warranties other than as expressly set forth in section 10 including any implied warranties of merchantability satisfactory quality fitness for a particular purpose noninfringement or quiet enjoyment and any warranties arising out of course of dealing or trade usage,,,,,,,,,,,,
56,without limitation of the generality of the foregoing splunk does not warrant that use of the software or splunk materials will be uninterrupted error free or secure or that all defects will be corrected,,,,,,,,,,,,
57,to the full extent permitted by applicable law and notwithstanding any failure of essential purpose of any limited remedy or limitation of liability a splunk and its affiliates subsidiaries officers directors employees agents partners including authorized partners as defined in section 21 below and licensors the âsplunk entitiesâ will not be liable for any special indirect incidental consequential or punitive damages including any damages arising from loss of use loss of data lost profits lost revenue business interruption or costs of procuring substitute software or services arising out of or relating to this agreement or the subject matter hereof and b splunk entitiesâ total cumulative liability arising out of or relating to this agreement or the subject matter hereof will not exceed the amounts paid by customer to splunk for the purchased software in the twelve 12 months prior to the event giving rise to such liability in each of the foregoing cases a and b regardless of whether such liability arises from contract indemnification warranty tort including negligence strict liability or otherwise and regardless of whether splunk has been advised of the possibility of such loss or damage,,,,,,,,,,,,
58,in addition customer and not splunk is solely responsible for the accuracy quality and security of customerâs data and for maintaining a backup of all such data and for ensuring the security and integrity of customerâs and its service providerâs data computers networks and systems including with respect to protecting against viruses and malware,,,,,,,,,,,,
59,splunk will defend customer against any claim demand suit or proceeding brought against customer by a third party alleging that purchased software infringes or misappropriates such third partyâs intellectual property rights âclaimâ and splunk will pay all damages finally awarded against customer by a court of competent jurisdiction as a result of such claim subject to the other terms and conditions of this agreement,,,,,,,,,,,,
60,notwithstanding the foregoing splunk has no obligation to indemnify customer with respect to a use of the purchased software in a manner that is not permitted under the agreement or that is inconsistent with splunkâs applicable user documentation b modifications to the splunk materials made by anyone other than splunk c the combination of software with hardware or software not made by splunk or with third party services processes or materials where the infringement or misappropriation would not occur but for such combination d customerâs continued use of the purchased software or other allegedly infringing activity after receiving notice of the alleged infringement or e any version of the purchased software that is no longer supported by splunk a through e collectively âexcluded mattersâ,,,,,,,,,,,,
61,if an applicable claim is made or appears likely to be made splunk may at its option and expense modify the affected purchased software so that it is non infringing or replace it with substantially functionally equivalent software,,,,,,,,,,,,
62,if splunk determines that neither is reasonably feasible splunk may terminate customerâs applicable license and refund customer a pro rata refund of the fees previously paid by customer which will be calculated using the remainder of the license term beginning with the date of splunkâs receipt of notice of the applicable claim or if the purchased software is licensed under a perpetual license a refund of fees previously paid by customer less straight line depreciation on a three year basis from the delivery of the applicable software,,,,,,,,,,,,
63,the obligations set forth in this section constitute customerâs sole and exclusive remedy and splunkâs entire liability with respect to any claims that the purchased software infringes any third partyâs intellectual property rights,,,,,,,,,,,,
64,customer will defend splunk against any claim brought against splunk by a third party arising out of or relating to any excluded matter or any customer extension and customer will pay all damages finally awarded against splunk by a court of competent jurisdiction as a result of such claim,,,,,,,,,,,,
65,each partyâs indemnity obligations set forth in this section 13 are conditioned upon the party seeking indemnification x providing prompt written notice to the other party of the applicable claim y giving the indemnifying party sole control of the defense and or settlement of the applicable claim except that i the indemnified party may participate in the defense with counsel of its choice at its own expense and ii the indemnifying party will not agree to any settlement that imposes a material obligation on the indemnified party without the indemnified partyâs prior written consent not to be unreasonably withheld or delayed and z providing reasonable cooperation and assistance in the defense and negotiations,,,,,,,,,,,,
66,âconfidential informationâ means any technical or business information ideas materials know how or other subject matter that is disclosed by one party to the other party that a if disclosed in writing is marked âconfidentialâ or âproprietaryâ at the time of such disclosure b if disclosed orally is identified as âconfidentialâ or âproprietaryâ at the time of such disclosure and is summarized in a writing sent by the disclosing party to the receiving party within thirty 30 days after any such disclosure or c under the circumstances a person exercising reasonable business judgment would understand to be confidential or proprietary,,,,,,,,,,,,
67,confidential information of splunk will include the splunk materials including any license keys,,,,,,,,,,,,
68,the party receiving confidential information ârecipientâ agrees a to maintain the confidential information of the party disclosing such information the âdiscloserâ in strict confidence b not to disclose such confidential information to any third parties and c not to use any such confidential information for any purpose other than to exercise its rights or perform its obligations under this agreement,,,,,,,,,,,,
69,recipient will treat confidential information of the discloser with the same degree of care as it accords to its own confidential information but in no event with less than reasonable care,,,,,,,,,,,,
70,recipient may disclose the confidential information of discloser to its directors officers employees and subcontractors collectively ârepresentativesâ who have a bona fide need to know such confidential information provided that each such representative is bound by a legal obligation as protective of the other partyâs confidential information as those set forth herein,,,,,,,,,,,,
71,recipientâs obligations under this section 14 will continue in effect for a period of three 3 years from the date of last disclosure of confidential information by discloser except that customerâs obligations under this section 14 will continue in effect in perpetuity with respect to splunk materials,,,,,,,,,,,,
