id,text,commercial_use,distribution,modification,private_use,patent_use,trademark_use,disclose_source,license_and_copyright_notice,same_license,state_changes,liability,warranty
1,distribution notice you are free to distribute this zip in its original state to any public www site online service or bbs without explicitly obtaining the authors permission,,,,,,,,,,,,
2,you are free distribute vbalgrid6ocx unmodified or to use or modify the source code as you wish,,,,,,,,,,,,
3,however you must not distribute modified versions of vbalgrid6ocx unless you have changed the filename and the progid project name,,,,,,,,,,,,
4,if you wish to distribute this zip by any other means ie,,,,,,,,,,,,
5,if you want to include it on a cd or any other software media then the express permission of the author is required,,,,,,,,,,,,
