id,text,commercial_use,distribution,modification,private_use,patent_use,trademark_use,disclose_source,license_and_copyright_notice,same_license,state_changes,liability,warranty
124,some states or countries do not allow the exclusion or limitation of liability for consequential or incidental damages the above limitation may not apply to you,,,,,,,,,,,,
125,in such instances and as long as you obtained the software from winzip or a winzip authorized reseller winzip may be liable to you i without limitation for damages you have incurred under or in connection with this eula only if the damage has been caused by the willful or grossly negligent act of winzip and ii for those typical damages that were reasonably foreseeable and which have been caused by any other negligent breach of an essential contractual duty by winzip,,,,,,,,,,,,
126,these aforementioned limitations apply irrespective of their legal basis in particular with regard to any pre contractual or auxiliary contractual claims,,,,,,,,,,,,
127,these limitations shall not apply however to any mandatory liability under the applicable product liability laws nor to any damage which is caused due to the breach of an express warranty to the extent that such express warranty was intended to protect consumers against the specific damage incurred nor to damages due to loss of life injury or prejudice to health,,,,,,,,,,,,
128,with respect to any acquisition of the software by or for any unit or agency of the united states government the government the software shall be classified as commercial computer software as that term is defined in the applicable provisions of the federal acquisition regulation the far and supplements thereto including the department of defense dod far supplement the dfars,,,,,,,,,,,,
129,the software was developed entirely at private expense and no part of the software was first produced in the performance of a government contract,,,,,,,,,,,,
130,if the software is supplied for use by dod the software is delivered subject to the terms of this eula and either i in accordance with dfars 2277202 1a and 2277202 3a or ii with restricted rights in accordance with dfars 252 227 7013 c1iioct 1988 as applicable,,,,,,,,,,,,
131,if the software is supplied for use by a federal agency other than dod the software is restricted computer software delivered subject to the terms of this eula and i far 12212a ii far 52227 19 or iii far 52227 14 alt iii as applicable,,,,,,,,,,,,
132,the contractor manufacturer is corel corporation 1600 carling avenue ottawa ontario canada k1z 8r7,,,,,,,,,,,,
133,if you are located in a country embargoed by the united states or you are on the united states treasury departments list of specially designated nationals you may not engage in commercial activities with us or our authorized resellers,,,,,,,,,,,,
134,you may not download distribute export re export or redistribute the software including any winzip shareware product i into or to a national or resident of any country to which the united states has embargoed goods or ii to anyone on the united states treasury departments list of specially designated nationals or the united states commerce departments table of deny orders,,,,,,,,,,,,
135,by downloading or using the software you are representing and warranting that you are not located in under the control of or a national or resident of any such country or on any such list,,,,,,,,,,,,
136,except pursuant to a separate express written fully executed agreement with winzip you may not purchase a license to use the software for the purpose of exporting it to a country other than the original country of sale nor may you retain the services of a third party to purchase a license to use the software if in doing so you will require such third party to send via any means electronic or otherwise the software to you in a country other than the original country of sale,,,,,,,,,,,,
137,if you purchased or downloaded the software in the united states then this eula is governed by the laws of the united states and the state of california without reference to conflict of laws principles,,,,,,,,,,,,
138,any dispute between you and winzip regarding this eula will be subject to the exclusive venue of the state and federal courts in the state of california,,,,,,,,,,,,
139,this eula specifically excludes the united nations convention on contracts for the international sale of goods and any legislation implementing such convention if otherwise applicable,,,,,,,,,,,,
140,except as expressly set forth herein to the extent permitted by applicable law this eula shall not prejudice the non excludable statutory rights of any party dealing as a consumer,,,,,,,,,,,,
141,if you acquired the software in canada unless expressly prohibited by local law this eula is governed by the laws in force in the province of ontario canada and any dispute between you and winzip regarding this eula will be subject to the exclusive jurisdiction of the federal and provincial courts sitting in toronto ontario,,,,,,,,,,,,
142,if you acquired the software in the european union iceland norway or switzerland then local law applies,,,,,,,,,,,,
143,if you acquired the software in any other country then local law may apply,,,,,,,,,,,,
144,this eula is the entire agreement between you and winzip and supersedes any other communications or advertisements with respect to the software and documentation,,,,,,,,,,,,
145,the software or any feature or part thereof may not be available in all languages or in all countries,,,,,,,,,,,,
146,if winzip has provided you with a translation of the english language version of this eula you agree that such translation is provided for your convenience only and that the english language version not the translation of this eula will be legally binding on you,,,,,,,,,,,,
147,the english language version of this eula and not its translations will govern in the event of a conflict between the english language version and a translation,,,,,,,,,,,,
148,the original english version of this eula can be found at http  winzipcom en eulahtm,,,,,,,,,,,,
149,if and to the extent any provision of this eula is held illegal invalid or unenforceable in whole or in part under applicable law such provision or such portion thereof shall be ineffective as to the jurisdiction in which it is illegal invalid or unenforceable but only to the extent of its illegality invalidity or unenforceability and shall be deemed modified to the extent necessary to conform to applicable law so as to give the maximum effect to the intent of the parties,,,,,,,,,,,,
150,no term or provision in this eula will be considered waived and no breach excused unless such waiver is in writing signed on behalf of the party against whom the waiver is asserted,,,,,,,,,,,,
151,no waiver whether express or implied will constitute consent to waiver of or excuse of any other different or subsequent breach,,,,,,,,,,,,
152,no modifications or amendments to this eula will be binding upon winzip unless made in writing and duly executed by you and an authorized representative of winzip,,,,,,,,,,,,
153,some software versions may not be compatible with various computer operating systems and winzip may not release updates,,,,,,,,,,,,
154,the software may not be compatible with computer operating systems that you may purchase now or in the future,,,,,,,,,,,,
155,you understand that the software may be incorporated into and may incorporate itself into software and other technology owned and controlled by third parties,,,,,,,,,,,,
156,any and all other third party software or technology that may be distributed together with the software may be subject to you explicitly accepting a license agreement with that third party and your use of that software constitutes acceptance of such terms,,,,,,,,,,,,
157,winzips licensors shall be direct and intended third party beneficiaries of this eula,,,,,,,,,,,,
158,additional eula terms encryption technology contained in winzip products you agree that winzip cannot guarantee that the encryption technology contained in the software is completely secure from decoding by third parties,,,,,,,,,,,,
159,accordingly winzip will not be responsible for any losses whatsoever resulting from third party decoding of or access to your files,,,,,,,,,,,,
160,self extracting zip files created by winzips self extractor trial version software may contain extractor software extraction software,,,,,,,,,,,,
161,you may not alter or modify the extraction software nor give anyone permission to do so,,,,,,,,,,,,
162,under no circumstances are you licensed to distribute extraction software,,,,,,,,,,,,
163,if you create self extracting zip files using an evaluation version of winzip self extractor software you may not transmit your zip files to a third party,,,,,,,,,,,,
164,however the fully licensed non trial version of winzip self extractor may be used to create an unlimited number of freely distributable royalty free self  extracting zip files subject to the terms of this eula,,,,,,,,,,,,
165,additional terms applicable to users of software located in germany or austria if you obtained the software from winzip or a winzip authorized reseller in germany or austria and such country is your legal residence then the germany and austrian product liability and other consumer protection laws concerning remedies for defective goods shall apply and govern any inconsistencies between such laws and the provisions of this eula set forth above,,,,,,,,,,,,
166,additional terms applicable to users of hardware or software located in the united kingdom if i you are acting as a consumer and the united kingdom is where your legal residence ii you entered into this eula in the united kingdom and iii you have obtained the software from winzip or a winzip authorized reseller in the united kingdom a consumer then the limitation of liability and warranty provisions set forth in applicable consumer protection and warranty laws of the united kingdom shall apply and govern any inconsistencies between such laws and the provisions of this eula set forth above,,,,,,,,,,,,
167,additional terms applicable to users of hardware or software located in australia limited warranty australian consumers only our goods come with guarantees that cannot be excluded under the australian consumer law,,,,,,,,,,,,
168,you are entitled to a replacement or refund for major failure and compensation for any other reasonably foreseeable loss or damage,,,,,,,,,,,,
169,you are also entitled to have the goods repaired or replaced if goods fail to be of acceptable quality and the failure does not amount to a major failure,,,,,,,,,,,,
170,the term major failure is defined in the australian consumer law and includes but is not limited to where the goods are substantially unfit for purpose and cannot easily and within a reasonable time be remedied to make them fit for such a purpose or where the goods depart in one or more significant respects if they were supplied by description – from that description,,,,,,,,,,,,
171,the warranty provided under this section is provided by corel corporation of 1600 carling avenue ottawa ontario k1z 8r7 canada,,,,,,,,,,,,
172,we warrant that the media on which software is furnished will be free of defects in materials and workmanship under normal use for a period of ninety 90 days from the date you purchased the software,,,,,,,,,,,,
173,the benefits provided by this express warranty are in addition to any other rights and remedies of the consumer under any law in relation to the goods or service to which the warranty relates,,,,,,,,,,,,
174,the software when properly installed and under normal use will substantially conform to the features and functionality as set forth in the documentation accompanying the software however the software may contain normal bugs and errors,,,,,,,,,,,,
175,bug fixes and updates will be provided from time to time,,,,,,,,,,,,
176,if the disc is defective then without limiting any other obligations at law winzip will replace the defective computer disc if you return the defective disc to us with a copy of your receipt,,,,,,,,,,,,
177,any replacement software will be warranted for the original warranty period covered by this section,,,,,,,,,,,,
178,exclusions australia only the warranty provided under this section does not cover defects or problems that arise due to you causing the software to become of unacceptable quality such as failure to take reasonable care or damage caused by abnormal use,,,,,,,,,,,,
179,further you assume all responsibilities for choosing installing and using the software,,,,,,,,,,,,
180,except as set out above to the maximum extent permitted by applicable law winzip disclaims all other warranties either express or implied including but not limited to non infringement with respect to the software and the accompanying written materials,,,,,,,,,,,,
181,if you alter the software in any way without being authorized by winzip winzip will not remedy defects caused by such alteration and you are liable for any damages incurred by winzip due to your unauthorized alteration,,,,,,,,,,,,
182,if you install pre release version products marked as such you do so at your own risk,,,,,,,,,,,,
183,pre release version products are to be used only for test purposes in testing environments and must not be used for production purposes,,,,,,,,,,,,
184,the software may contain open source materials eg any software subject to open source copyleft gnu general public license library general public license lesser general public license mozilla license berkeley software distribution license open source initiative license mit apache or public domain licenses or similar license,,,,,,,,,,,,
185,to the extent permissible at law winzip makes no warranties and shall have no liability direct or indirect whatsoever with respect to open source materials contained in the software,,,,,,,,,,,,
186,how to claim under the warranty australia only for the warranty to be honored you must contact winzips customer service centre at help@winzipcom and seek a return merchandise authorization rma,,,,,,,,,,,,
187,more detailed rma instructions together with shipping information and an rma number will then be sent to you by email,,,,,,,,,,,,
188,you will be required to provide proof of purchase and bear the costs of returning the software,,,,,,,,,,,,
189,the software together with all related media and manuals must be returned to corel corporation attention manufacturing winzip 1600 carling avenue ottawa ontario k1z 8r7 canada and must be uninstalled from your computer and any storage devices and you must delete any backup copies,,,,,,,,,,,,
190,we will endeavor to process your claim within ten 10 business days from the date winzip receives it,,,,,,,,,,,,
191,if we accept that the software is defective a replacement disc will be provided to you by mail,,,,,,,,,,,,
192,indirect and consequential loss australia only to the extent permitted under australian law winzip shall have no liability for indirect or consequential damages,,,,,,,,,,,,
193,you assume the entire cost of any damage resulting from the information contained in or compiled by the software,,,,,,,,,,,,
194,to the maximum extent permitted by applicable law in no event will winzip or its suppliers or licensors be liable for any damages for loss of business profits business interruption loss of business information or other indirect pecuniary loss arising out of the use or inability to use the software even if such party has been advised of the possibility of such damages,,,,,,,,,,,,
195,additional terms applicable to users of software containing shareware certain software are shareware and as such are acquired without charge and can be used for a limited period of time for evaluation purposes and are subject to the particular end user license for such shareware,,,,,,,,,,,,
196,additional terms applicable to users of clipart stock photo images video content audio clips fonts and sample content our software may contain clipart photo images video content audio clips collectively referred to as the images or clips software data files that render typeface designs when used in conjunction with appropriate hardware and software for example only without limitationttf or otf files referred to as font software and the graphic rendering generated by the font software referred to as font output and sample content such as forms templates tubes or similar items collectively referred to as the sample content that are either owned by us or licensed from a third party,,,,,,,,,,,,
197,except as required in the paragraph below as a user of our software you are free to use modify and publish the images or clips font output or sample content as follows you may i incorporate any images or clips font output or sample content into your own original work and publish display and distribute your work in any media provided you include a copyright notice in your work reflecting on the copyright ownership of both you and winzip as follows copyright c 20__ [your name] winzip computing sl,,,,,,,,,,,,
198, and ii make one 1 copy of the images or clips font software or sample content for backup or archival purposes,,,,,,,,,,,,
199,you may not resell sublicense or otherwise make available the images or clips or font software for use or distribution separately or detached from a product or web page,,,,,,,,,,,,
200,for example the images or clips or font output may be used by you as part of a web page design but not be made available for downloading separately use of the font software as a web font utilizing the css3@font face specification or similar is specifically prohibited or in a format designed or intended for permanent storage or re use by others,,,,,,,,,,,,
201,you may not provide the images or clips or font software to third parties or permit the use of the images or clips or font software or font output by third parties separately or as part of any other product however third parties may be provided with copies of the images or clips or font output including in digital files as part of a work product,,,,,,,,,,,,
202,you may not create scandalous obscene defamatory or immoral works using the images or clips font software font output or sample content nor use the images or clips font software font output or sample content for any other purpose which is prohibited by law,,,,,,,,,,,,
203,you may not permit the use of the images or clips font software font output or sample content or any part thereof as a trademark or service mark or claim any proprietary rights of any sort in the images or clips font software font output or sample content or any part thereof,,,,,,,,,,,,
204,you may not use any of the images or clips which contain identifiable individuals or entities for any commercial purpose including without limitation in a manner which suggests their association with or endorsement of any product or service,,,,,,,,,,,,
205,you may not use the images or clips in electronic format on line or in multimedia applications unless the images or clips are incorporated for viewing purposes only and no permission is given to download and or save the images or clips for any reason,,,,,,,,,,,,
206,you may not rent lease sublicense or lend the images or clips or font software or font output or any copies thereof to another person or legal entity,,,,,,,,,,,,
207,you may not modify the font software in any way,,,,,,,,,,,,
208,you may not use any images or clips presented in any software splashscreens welcome screens product packaging and or marketing collateral,,,,,,,,,,,,
209,you may not use any images or clips font software or font output or sample content except as expressly permitted by this eula,,,,,,,,,,,,
210,you may however transfer subject to winzips license transfer authorization all your eula to use the images or clips or font software to another person or legal entity provided that i you transfer the software including the images or clips or font software and this eula including all copies except copies incorporated into your work product as permitted under this eula to such person or entity ii you retain no copies including copies stored on a computer or other storage device and iii the receiving party agrees to be bound by the terms and conditions of this eula,,,,,,,,,,,,
