id,license_text,is_granted
389,"The SOFTWARE PRODUCT and any related documentation is provided ""as is"" without warranty of any kind, either express or implied, including, without limitation, the implied warranties or merchantability, fitness for a particular purpose, or noninfringement.",0
152,"Modified versions of the CGIC library should not be distributed without the attachment of a clear statement regarding the author of the modifications, and this notice may in no case be removed.",1
276,"Except as otherwise expressly provided, Hauppauge grants no express or implied right under Hauppauge patents, copyrights, trademarks, or other intellectual property rights.",0
369,"Except as expressly stated in this notice, no other rights or licenses, express or implied, are granted by Apple herein, including but not limited to any patent rights that may be infringed by your software program or by other works in which the Apple Software may be incorporated.",0
131,"Neither the name of Sun Microsystems, Inc. or the names of contributors may be used to endorse or promote products derived from this software without specific prior written permission.",0
316,"Any person who transfers this source code or any derivative work must include the IBM copyright notice, this paragraph, and the preceding two paragraphs in the transferred software.",1
373,"THIS SOFTWARE IS PROVIDED BY THE COPYRIGHT HOLDERS AND CONTRIBUTORS ""AS IS"" AND ANY EXPRESS OR IMPLIED WARRANTIES, INCLUDING, BUT NOT LIMITED TO, THE IMPLIED WARRANTIES OF MERCHANTABILITY AND FITNESS FOR A PARTICULAR PURPOSE ARE DISCLAIMED.",0
439,Executable forms of this program distributed without the source code must be accompanied by a conspicuous copy of this permission notice and a statement that tells the recipient how to obtain the source code.,1
83,"Except as expressly stated in this notice, no other rights or licenses, express or implied, are granted by Apple herein, including but not limited to any patent rights that may be infringed by your derivative works or by other works in which the Apple Software may be incorporated.",0
21,"Each contributor grants you a non-exclusive, worldwide, royalty-free patent license under the contributor's essential patent claims, to make, use, sell, offer for sale, import and otherwise run, modify and propagate the contents of its contributor version.",1
354,"THIS SOFTWARE IS PROVIDED BY DON CAPPS AND THE IOZONE CREW ""AS IS"" AND ANY EXPRESS OR IMPLIED WARRANTIES, INCLUDING, BUT NOT LIMITED TO, THE IMPLIED WARRANTIES OF MERCHANTABILITY AND FITNESS FOR A PARTICULAR PURPOSE ARE DISCLAIMED.",0
532,"By obtaining, using and/or copying this work, you (the licensee) agree that you have read, understood, and will comply with the following terms and conditions: Permission to use, copy, and modify this software and its documentation, with or without modification, for any purpose and without fee or royalty is hereby granted, provided that you include the following on ALL copies of the software and documentation or portions thereof, including modifications, that you make",1
352,"THIS SOFTWARE IS PROVIDED BY THE COPYRIGHT HOLDERS AND CONTRIBUTORS ""AS IS"" AND ANY EXPRESS OR IMPLIED WARRANTIES, INCLUDING, BUT NOT LIMITED TO, THE IMPLIED WARRANTIES OF MERCHANTABILITY AND FITNESS FOR A PARTICULAR PURPOSE ARE DISCLAIMED.",0
558,"(""SUN"") AND ITS LICENSORS SHALL NOT BE LIABLE FOR ANY DAMAGES SUFFERED BY LICENSEE AS A RESULT OF USING, MODIFYING OR DISTRIBUTING THIS SOFTWARE OR ITS DERIVATIVES.",0
311,"IN NO EVENT SHALL IBM OR ITS LICENSORS BE LIABLE FOR INCIDENTAL, CONSEQUENTIAL OR PUNITIVE DAMAGES.",0
106,"Despite the lack of warranty, we would like to hear about any problem you find.",0
477,"Provided that these terms and disclaimer and all copyright notices are retained or reproduced in an accompanying document, permission is granted to deal in this work without restriction, including unlimited rights to use, publicly perform, distribute, sell, modify, merge, give away, or sublicence.",1
429,"Permission to use, copy, modify, and distribute this software for any purpose without fee is hereby granted, provided that this entire notice is included in all copies of any software which is or includes a copy or modification of this software and in all copies of the supporting documentation for such software.",1
388,"You may reproduce and distribute an unlimited number of copies of the SOFTWARE PRODUCT; provided that each copy shall be a true and complete copy, including all copyright and trademark notices (if applicable) , and shall be accompanied by a copy of this text file.",1
280,"Redistributions of source code must retain the above copyright notice, this list of conditions, and the following disclaimer.",1
173,"It is provided ""as is"" without expressed or implied warranty.",0
480,"THE SOFTWARE IS PROVIDED ""AS IS"", WITHOUT WARRANTY OF ANY KIND, EXPRESS OR IMPLIED, INCLUDING BUT NOT LIMITED TO THE WARRANTIES OF MERCHANTABILITY, FITNESS FOR A PARTICULAR PURPOSE AND NONINFRINGEMENT.",0
14,"You are permitted to use the Standard Version and create and use Modified Versions for any purpose without restriction, provided that you do not Distribute the Modified Version.",1
456,"THIS DATABASE IS PROVIDED BY MAXMIND, INC ``AS IS'' AND ANY EXPRESS OR IMPLIED WARRANTIES, INCLUDING, BUT NOT LIMITED TO, THE IMPLIED WARRANTIES OF MERCHANTABILITY AND FITNESS FOR A PARTICULAR PURPOSE ARE DISCLAIMED.",0
489,"You are hereby granted a copyright license to use, modify, and distribute the SOFTWARE so long as this entire notice is retained without alteration in any modified and/or redistributed versions, and that such modified versions are clearly identified as such.",1
457,"Redistribution and use in source and binary forms, without modification, are permitted provided that the following conditions are met: Redistributions of source code must retain the above copyright notice, this list of conditions and the following disclaimer.",1
461,"Redistribution and use in source and binary forms, with or without modification, are permitted provided that the following conditions are met: - Redistributions of source code must retain the above copyright notice, this list of conditions and the following disclaimer.",1
422,"Redistributions of source code must retain the above copyright notice, this list of conditions and the following disclaimer.",1
419,"Redistributions in binary form must reproduce the above copyright notice, this list of conditions and the following disclaimer in the documentation and/or other materials provided with the distribution.",1
473,"This library is distributed in the hope that it will be useful, but WITHOUT ANY WARRANTY; without even the implied warranty of MERCHANTABILITY or FITNESS FOR A PARTICULAR PURPOSE.",0
142,"(Unless it's your neighbour in need of a cup of sugar), in which case you MAY act NON-nicely STANDARD DISCLAIMER Though every reasonable effort has been made in testing this script, the Author accepts no liability whatsoever.",0
522,You may redistribute noweb in whole or in part provided you acknowledge its source and include this COPYRIGHT file.,1
108,"Permission to modify and distribute modified fonts for any purpose is hereby granted without fee, provided that the copyright notice, author statement, this permission notice and location of original fonts (http://www.ctan.org/tex-archive/fonts/cm/ps-type1/bakoma) appear in all copies of modified fonts and related documentation.",1
551,"Redistribution and use in source and binary forms, with or without modification, are permitted provided that the following conditions are met: Redistributions of source code must retain the above copyright notice, this list of conditions and the following disclaimer.",1
50,"The Work and any derivative works thereof only may be used or intended for use with the web services, computing platforms or applications provided by Amazon.com, Inc. or its affiliates, including Amazon Web Services LLC.",1
107,"Permission to copy and distribute these fonts for any purpose is hereby granted without fee, provided that the above copyright notice, author statement and this permission notice appear in all copies of these fonts and related documentation.",1
96,The name of Atmel Corporation may not be used to endorse or promote products derived from this Firmware without specific prior written consent.,0
470,"THIS SOFTWARE IS PROVIDED AS IS, WITHOUT REPRESENTATION FROM THE UNIVERSITY OF MICHIGAN AS TO ITS FITNESS FOR ANY PURPOSE, AND WITHOUT WARRANTY BY THE UNIVERSITY OF MICHIGAN OF ANY KIND, EITHER EXPRESS OR IMPLIED, INCLUDING WITHOUT LIMITATION THE IMPLIED WARRANTIES OF MERCHANTABILITY AND FITNESS FOR A PARTICULAR PURPOSE.",0
164,the right to modify this software - the right to distribute this software - the right to let this software used - the right to devolve the part or the whole of the rights related to this software The managers have a duty to resolve malfunctions of this software.,1
114,"Permission is hereby granted, free of charge, to any person obtaining a copy of the fonts accompanying this license (""Fonts"") and associated documentation files (the ""Font Software""), to reproduce and distribute the Font Software, including without limitation the rights to use, copy, merge, publish, distribute, and/or sell copies of the Font Software, and to permit persons to whom the Font Software is furnished to do so, subject to the following conditions: The above copyright and trademark notices and this permission notice shall be included in all copies of one or more of the Font Software typefaces.",1
104,"If you change the generating script, you must include code in it such that any output is clearly labeled as generated by a modified script.",1
143,"Permission to use, copy, modify, distribute, and sell this software and its documentation for any purpose is hereby granted without fee, provided that (i) the above copyright notices and this permission notice appear in all copies of the software and related documentation, and (ii) the name of Wolfram Gloger may not be used in any advertising or publicity relating to the software.",1
519,"Permission to use, copy, modify, and distribute this software is freely granted, provided that the above copyright notice, this notice and the following disclaimer are preserved with no changes.",1
400,"This library is distributed in the hope that it will be useful, but WITHOUT ANY WARRANTY; without even the implied warranty of MERCHANTABILITY or FITNESS FOR A PARTICULAR PURPOSE.",0
47,"Subject to the terms and conditions of this License, each Licensor grants to you a perpetual, worldwide, non-exclusive, royalty-free patent license to make, have made, use, sell, offer for sale, import, and otherwise transfer its Work, in whole or in part.",1
89,"Certain Limitations and Conditions You are not licensed under this License to distribute the Program or derivative works thereof, or to make any use other than Internal Use of the Program or derivative works thereof.",0
212,"THE SOFTWARE AND DOCUMENTATION, IF ANY, ARE PROVIDED ""AS IS"" AND ANY EXPRESS OR IMPLIED WARRANTIES (INCLUDING, BUT NOT LIMITED TO, THE IMPLIED WARRANTIES OF MERCHANTABILITY AND FITNESS FOR A PARTICULAR PURPOSE) ARE DISCLAIMED.",0
307,"Permission is granted to anyone to use this Software free of charge for any purpose, including commercial applications, and to redistribute it, provided that the warranty disclaimer is accepted and the following conditions are met: All redistributions must keep the original package intact.",1
199,"ANY EXPRESS OR IMPLIED WARRANTIES, INCLUDING, BUT NOT LIMITED TO, THE IMPLIED WARRANTIES OF MERCHANTABILITY AND FITNESS FOR A PARTICULAR PURPOSE ARE DISCLAIMED.",0
416,"In no event will NSA be liable for any damages, including loss of data, lost profits, cost of cover, or other special, incidental, consequential, direct or indirect damages arising from the software or the use thereof, however caused and on any theory of liability.",0
80,"This Apple software is supplied to you by Apple Computer, Inc. (""Apple"") in consideration of your agreement to the following terms, and your use, installation, modification or redistribution of this Apple software constitutes acceptance of these term",1
496,"in no event shall NAIST be liable for any special, indirect or consequential damages or any damages whatsoever resulting from loss of use, data or profits, whether in an action of contract, negligence or other tortuous action, arising out of or in connection with the use or performance of this software.",0
99,"IN NO EVENT SHALL ATMEL BE LIABLE FOR ANY DIRECT, INDIRECT, INCIDENTAL, SPECIAL, EXEMPLARY, OR CONSEQUENTIAL DAMAGES (INCLUDING, BUT NOT LIMITED TO, PROCUREMENT OF SUBSTITUTE GOODS OR SERVICES; LOSS OF USE, DATA, OR PROFITS; OR BUSINESS INTERRUPTION) HOWEVER CAUSED AND ON ANY THEORY OF LIABILITY, WHETHER IN CONTRACT, STRICT LIABILITY, OR TORT (INCLUDING NEGLIGENCE OR OTHERWISE) ARISING IN ANY WAY OUT OF THE USE OF THIS FIRMWARE, EVEN IF ADVISED OF THE POSSIBILITY OF SUCH DAMAGE",0
408,"IN NO EVENT SHALL THE AUTHORS OR COPYRIGHT HOLDERS BE LIABLE FOR ANY CLAIM, DAMAGES OR OTHER LIABILITY, WHETHER IN AN ACTION OF CONTRACT,TORT OR OTHERWISE, ARISING FROM, OUT OF OR IN CONNECTION WITH THE SOFTWARE OR THE USE OR OTHER DEALINGS IN THE SOFTWARE.",0
358,This utility is free for non-commercial (personal) use.,1
251,"You may copy and distribute verbatim copies of the Program's source code as you receive it, in any medium, provided that you conspicuously and appropriately publish on each copy an appropriate copyright notice and disclaimer of warranty; keep intact all the notices that refer to this General Public License and to the absence of any warranty; and give any other recipients of the Program a copy of this General Public License along with the Program.",1
205,"THE SOFTWARE IS PROVIDED ""AS IS"", WITHOUT WARRANTY OF ANY KIND, EXPRESS OR IMPLIED, INCLUDING BUT NOT LIMITED TO THE WARRANTIES OF MERCHANTABILITY, FITNESS FOR A PARTICULAR PURPOSE AND NONINFRINGEMENT.",0
169,"IN NO EVENT SHALL CARNEGIE MELLON UNIVERSITY BE LIABLE FOR ANY DIRECT, INDIRECT, INCIDENTAL, SPECIAL, EXEMPLARY, OR CONSEQUENTIAL DAMAGES (INCLUDING, BUT NOT LIMITED TO, PROCUREMENT OF SUBSTITUTE GOODS OR SERVICES; LOSS OF USE, DATA, OR PROFITS; OR BUSINESS INTERRUPTION) HOWEVER CAUSED AND ON ANY THEORY OF LIABILITY, WHETHER IN CONTRACT, STRICT LIABILITY, OR TORT (INCLUDING NEGLIGENCE OR OTHERWISE) ARISING IN ANY WAY OUT OF THE USE OF THIS SOFTWARE, EVEN IF ADVISED OF THE POSSIBILITY OF SUCH DAMAGE.",0
267,"This software is provided ""as is,"" without warranty of any kind, express or implied.",0
222,"Redistributions of source code must retain the above copyright notice(s), this list of conditions and the following disclaimer as the first lines of this file unmodified other than the possible addition of one or more copyright notices.",1
218,"Redistributions of source code must retain the above copyright notices, this list of conditions, and the disclaimer below.",1
325,"This document and translations of it may be copied and furnished to others, and derivative works that comment on or otherwise explain it or assist in its implementation may be prepared, copied, published and distributed, in whole or in part, without restriction of any kind, provided that the above copyright notice and this paragraph are included on all such copies and derivative works.",1
283,"DISCLAIMER: THIS SOFTWARE IS PROVIDED BY THE HDF GROUP AND THE CONTRIBUTORS ""AS IS"" WITH NO WARRANTY OF ANY KIND, EITHER EXPRESSED OR IMPLIED.",0
349,"Redistribution and use in binary form, without modification, are permitted provided that the following conditions are met: Redistributions must reproduce the above copyright notice and the following disclaimer in the documentation and/or other materials provided with the distribution.",1
562,"THE DATA IS PROVIDED ON AN “AS IS�?BASIS, WITHOUT WARRANTIES OR CONDITIONS OF ANY KIND, EITHER EXPRESS OR IMPLIED INCLUDING, WITHOUT LIMITATION, ANY WARRANTIES OR CONDITIONS OF TITLE, NON-INFRINGEMENT, MERCHANTABILITY OR FITNESS FOR A PARTICULAR PURPOSE.",0
22,"corresponding Source conveyed, and Installation Information provided, in accord with this section must be in a format that is publicly documented (and with an implementation available to the public in source code form), and must require no special password or key for unpacking, reading or copying.",1
225,"Permission is hereby granted, free of charge, to use and distribute this software and its documentation without restriction, including without limitation the rights to use, copy, modify, merge, publish, distribute, sublicense, and/or sell copies of this work, and to permit persons to whom this work is furnished to do so, subject to the following conditions",1
297,HP DOES NOT WARRANT THAT THE SOFTWARE OR DOCUMENTATION IS ERROR FREE.,0
502,"Redistributions in source code must retain the above copyright notice, this list of conditions, and the following disclaimer.",1
156,Redistributions of source code must retain copyright statements and notices.,1
67,"Redistributions in binary form must reproduce the above copyright notice, this list of conditions and the following disclaimer in the documentation and/or other materials provided with the distribution.",1
249,"Google hereby grants to you a perpetual, worldwide, non-exclusive, no-charge, royalty-free, irrevocable (except as stated in this section) patent license to make, have made, use, offer to sell, sell, import, transfer, and otherwise run, modify and propagate the contents of this implementation, where such license applies only to those patent claims, both currently owned by Google and acquired in the future, licensable by Google that are necessarily infringed by this implementation.",1
65,"This product distributed in hope it may be useful, but without any warranty; without even the implied warranty of merchantability or fitness for a particular purpose and compliance with any standards.",0
144,"THE SOFTWARE IS PROVIDED ""AS-IS"" AND WITHOUT WARRANTY OF ANY KIND, EXPRESS, IMPLIED OR OTHERWISE, INCLUDING WITHOUT LIMITATION, ANY WARRANTY OF MERCHANTABILITY OR FITNESS FOR A PARTICULAR PURPOSE.",0
332,"This software is provided ""as is,"" without warranty of any kind, express or implied.",0
548,"Redistributions in binary form must reproduce the above copyright notice, this list of conditions and the following disclaimer in the documentation and/or other materials provided with the distribution, if any, must include the following acknowledgment: ""This product includes software developed by the University Corporation for Advanced Internet Development <http://www.ucaid.edu>Internet2 Project.",1
241,"Permission to modify and distribute modified versions of this software is granted, provided that: 1) the modifications are licensed under the same terms as this software; ",1
16,"Redistribution and use in source and binary forms, with or without modification, are permitted provided that the following conditions are met:",1
238,"If you distribute any modified version, its source contains a clear description of the ways in which it differs from the original version, and a clear indication that the changes are not mine.",1
341,"Redistributions in binary form must reproduce the authors' copyright notice(s), this list of conditions, and the following disclaimer in the documentation and/or other materials provided with the distribution.",1
134,"SUN MIDROSYSTEMS, INC. (""SUN"") AND ITS LICENSORS SHALL NOT BE LIABLE FOR ANY DAMAGES SUFFERED BY LICENSEE AS A RESULT OF USING, MODIFYING OR DISTRIBUTING THIS SOFTWARE OR ITS DERIVATIVES.",0
518,"THE SOFTWARE IS PROVIDED ""AS IS"" AND THE AUTHOR DISCLAIMS ALL WARRANTIES WITH REGARD TO THIS SOFTWARE INCLUDING ALL IMPLIED WARRANTIES OF MERCHANTABILITY AND FITNESS.",0
365,"Redistributions in binary form must reproduce the above copyright notice, this list of conditions and the following disclaimer in the documentation and/or other materials provided with the distribution.",1
260,"You are free to distribute a Derivative Work that is formed entirely from the Program and one or more works (each, a ""FLOSS Work"") licensed under one or more of the licenses listed below in section 1, as long as:",1
113,"Permission to use, copy, modify, and distribute this software and its documentation with or without modifications and for any purpose and without fee is hereby granted, provided that any copyright notices appear in all copies and that both those copyright notices and this permission notice appear in supporting documentation, and that the names of the contributors or copyright holders not be used in advertising or publicity pertaining to distribution of the software without specific prior permission.",1
221,"Redistribution and use in source and binary forms, with or without modification, are permitted provided that the following conditions are met",1
174,"Permission to use and/or redistribute this work is granted under the terms of the LGPL License, with the exception that any usage related to military applications is expressly forbidden.",1
91,"EXCEPT AS EXPRESSLY SET FORTH IN THIS SECTION 4, THE PROGRAM IS PROVIDED ""AS IS"", WITHOUT WARRANTIES OR CONDITIONS OF ANY KIND, EITHER EXPRESS OR IMPLIED INCLUDING, WITHOUT LIMITATION, ANY WARRANTIES OR CONDITIONS OF TITLE, NON-INFRINGEMENT, MERCHANTABILITY, OR FITNESS FOR A PARTICULAR PURPOSE.",0
563,"Copying or modifying this code for any purpose is permitted, provided that this copyright notice is preserved in its entirety in all copies or modifications.",1
35,"The Licensee is authorized to distribute true copies of the Software in Source Code or Object Code form, provided that said distribution complies with all the provisions of the Agreement and is accompanied by: 1. a copy of the Agreement, 2. a notice relating to the limitation of both the Licensor's warranty and liability as set forth in Articles 8 and 9,",1
189,"Permission to use, copy, modify, and distribute this software for any purpose except publication and without fee is hereby granted, provided that the above copyright notice appear in all copies of the software.",1
100,These patterns were developed for internal GMV use and are made public in the hope that they will benefit others.,1
450,"THIS SOFTWARE IS PROVIDED BY THE COPYRIGHT HOLDERS AND CONTRIBUTORS ""AS IS"" AND ANY EXPRESS OR IMPLIED WARRANTIES, INCLUDING, BUT NOT LIMITED TO, THE IMPLIED WARRANTIES OF MERCHANTABILITY AND FITNESS FOR A PARTICULAR PURPOSE ARE DISCLAIMED.",0
356,"THE SOFTWARE IS PROVIDED ""AS IS"" AND THE AUTHOR DISCLAIMS ALL WARRANTIES WITH REGARD TO THIS SOFTWARE INCLUDING ALL IMPLIED WARRANTIES OF MERCHANTABILITY AND FITNESS.",0
88,"Subject to the terms and conditions of this License, Aptana hereby grants to You a worldwide, non-exclusive, royalty-free, patent license under Aptana's Licensed Patent Claims to make and use the Program in source code and object code form, in each case solely for Your Internal Use.",0
463,"Permission is hereby granted, free of charge, to any person obtaining a copy of the fonts accompanying this license (""Fonts"") and associated documentation files (the ""Font Software""), to reproduce and distribute the Font Software, including without limitation the rights to use, copy, merge, publish, distribute, and/or sell copies of the Font Software, and to permit persons to whom the Font Software is furnished to do so, subject to the following conditions: The above copyright and this permission notice shall be included in all copies of one or more of the Font Software typefaces.",1
353,"License to freely use and distribute this software is hereby granted by the author, subject to the condition that this copyright notice remains intact.",1
444,"THIS SOFTWARE IS PROVIDED BY THE COPYRIGHT HOLDERS AND CONTRIBUTORS ""AS IS"" AND ANY EXPRESS OR IMPLIED WARRANTIES, INCLUDING, BUT NOT LIMITED TO, THE IMPLIED WARRANTIES OF MERCHANTABILITY AND FITNESS FOR A PARTICULAR PURPOSE ARE DISCLAIMED.",0
367,"This Apple software is supplied to you by Apple Inc. (""Apple"") in consideration of your agreement to the following terms, and your use, reproduction or redistribution of this Apple software constitutes acceptance of these terms.",1
493,"Use, reproduction, and distribution of this software is permitted.",1
109,"Permission to use these fonts (embedding into PostScript, PDF, SVG and printing by using any software) is hereby granted without fee.",1
28,"retain the following if it is supplied by the Licensor with the Licensed Material: i. identification of the creator(s) of the Licensed Material and any others designated to receive attribution, in any reasonable manner requested by the Licensor (including by pseudonym if designated); ii. a copyright notice;iii. a notice that refers to this Public License;",1
321,"Permission is hereby granted, free of charge, to any person or organization (""You"") obtaining a copy of this software and associated documentation files covered by this license (the ""Software"") to use the Software as part of another work; to modify it for that purpose; to publish or distribute it, modified or not, for that same purpose; to permit persons to whom the other work using the Software is furnished to do so; subject to the following conditions: the above copyright notice and this complete and unmodified permission notice shall be included in all copies or substantial portions of the Software; You will not misrepresent modified versions of the Software as being the original.",1
392,"Redistributions in binary form must reproduce the above copyright notice, this list of conditions and the following disclaimer in the documentation and/or other materials provided with the distribution.",1
310,"IT IS PROVIDED WITHOUT WARRANTY OF ANY KIND, INCLUDING THE WARRANTIES OF MERCHANTABILITY AND FITNESS FOR A PARTICULAR PURPOSE OR OF NONINFRINGEMENT OF THIRD PARTY RIGHTS.",0
