id,license_text,is_granted
289,"Permission to use, copy, modify and distribute this software and its documentation for any purpose and without fee is hereby granted, provided that the above copyright notice appear in all copies, and that both that copyright notice and this permission notice appear in supporting documentation, and that the name of copyright holder or related entities not be used in advertising or publicity pertaining to distribution of the software without specific, written prior permission.",1
51,Limitation of Liability.,0
572,"Redistributions of source code must retain the above copyright notice, this list of conditions and the following disclaimer.",1
501,"Redistribution and use in source and binary forms, with or without modification, are permitted provided that the following conditions are met.",1
545,"THIS SOFTWARE IS PROVIDED ``AS IS'' AND ANY EXPRESSED OR IMPLIED WARRANTIES, INCLUDING, BUT NOT LIMITED TO, THE IMPLIED WARRANTIES OF MERCHANTABILITY AND FITNESS FOR A PARTICULAR PURPOSE ARE DISCLAIMED.",0
183,This notice may not be removed or altered from any source distribution.,1
485,"THIS SOFTWARE IS BEING DISTRIBUTED BY SYNOPSYS SOLELY ON AN ""AS IS"" BASIS AND ANY EXPRESS OR IMPLIED WARRANTIES, INCLUDING, BUT NOT LIMITED TO, THE IMPLIED WARRANTIES OF MERCHANTABILITY AND FITNESS FOR A PARTICULAR PURPOSE ARE HEREBY DISCLAIMED.",0
231,"DISCLAIMER THE WORK IS PROVIDED ''AS IS'', AND ANY EXPRESS OR IMPLIED WARRANTIES, INCLUDING, BUT NOT LIMITED TO, THE IMPLIED WARRANTIES OF MERCHANTABILITY AND FITNESS FOR A PARTICULAR PURPOSE ARE DISCLAIMED.",0
538,Redistributions of source code must retain copyright statements and notices.,1
236,This file may be distributed and used freely provided,1
240,"Permission to use, copy, and distribute this software and its documentation for any purpose with or without fee is hereby granted, provided that the copyright notice appear in all copies and that both that copyright notice and his permission notice appear in supporting documentation.",1
411,"The Contributing Authors assume no liability for direct, indirect, incidental, special, exemplary, or consequential damages, which may result from the use of the MNG Library, even if advised of the possibility of such damage.",0
483,"Permission to use, copy, modify, distribute, and sell this software and its documentation for any purpose is hereby granted without fee, provided that the above copyright notice appear in all copies and that both that copyright notice and this permission notice appear in supporting documentation.",1
59,"No right is granted to use any trade name, trademark, or logo of Broadcom Corporation.",0
436,"Redistributions of source code must retain the above copyright notice, this list of conditions and the following disclaimer, without modification.",1
247,"Permission to distribute binaries produced by compiling modified sources is granted, provided you 1. distribute the corresponding source modifications from the released version in the form of a patch file along with the binaries, 2. add special version identification to distinguish your version in addition to the base release version number, 3. provide your name and address as the primary contact for the support of your modified version, and 4. retain our contact information in regard to use of the base software.",1
359,Author shall not be liable for any damage resulting from the use of this utility.,0
449,"Redistribution and use in binary form, without modification, are permitted provided that the following conditions are met: Redistributions must reproduce the above copyright notice and the following disclaimer in the documentation and/or other materials provided with the distribution.",1
11,"You must retain, in the Source form of any Derivative Works that You distribute, all copyright, patent, trademark, and attribution notices from the Source form of the Work, excluding those notices that do not pertain to any part of the Derivative Works",1
256,"EXCEPT WHEN OTHERWISE STATED IN WRITING THE COPYRIGHT HOLDERS AND/OR OTHER PARTIES PROVIDE THE PROGRAM ""AS IS"" WITHOUT WARRANTY OF ANY KIND, EITHER EXPRESSED OR IMPLIED, INCLUDING, BUT NOT LIMITED TO, THE IMPLIED WARRANTIES OF MERCHANTABILITY AND FITNESS FOR A PARTICULAR PURPOSE.",0
277,"UNLESS EXPRESSLY AGREED OTHERWISE, HAUPPAUGE AND ITS SUPPLIERS AND LICENSORS DISCLAIM ANY AND ALL WARRANTIES AND GUARANTEES, EXPRESS, IMPLIED OR OTHERWISE, INCLUDING BUT NOT LIMITED TO THE WARRANTIES OF MERCHANTABILITY, NONINFRINGEMENT, OR FITNESS FOR A PARTICULAR PURPOSE.",0
210,"Subject to your compliance with these terms, you are hereby granted a non-exclusive, worldwide, royalty-free copyright license to (1) use and copy the Software; and (2) reproduce and distribute the Software as part of your own software (""Your Software""), provided Your Software does not consist solely of the Software; and (3) modify the Software for your own internal use.",1
266,"The code comes as-is, and if there are any flaws or problems with any Gems code, nobody involved with Gems - authors, editors, publishers, or webmasters - are to be held responsible.",0
179,"THIS SOFTWARE IS PROVIDED BY THE COPYRIGHT HOLDERS AND CONTRIBUTORS ""AS IS"" AND ANY EXPRESS OR IMPLIED WARRANTIES, INCLUDING, BUT NOT LIMITED TO, THE IMPLIED WARRANTIES OF MERCHANTABILITY AND FITNESS FOR A PARTICULAR PURPOSE ARE DISCLAIMED.",0
49,"THE WORK IS PROVIDED ""AS IS"" WITHOUT WARRANTIES OR CONDITIONS OF ANY KIND, EITHER EXPRESS OR IMPLIED, INCLUDING WARRANTIES OR CONDITIONS OF M ERCHANTABILITY, FITNESS FOR A PARTICULAR PURPOSE, TITLE OR NON-INFRINGEMENT.",0
265,"Using the code is permitted in any program, product, or library, non-commercial or commercial.",1
284,"You may freely use, modify, and redistribute the hdparm program, as either binary or source, or both.",1
561,"This O-UDA does not restrict your use, modification, or distribution of any portions of the Data that are in the public domain or that may be used, modified, or distributed under any other legal exception or limitation.",1
505,"If any files originating from NAUMEN or Contributors are modified, you must cause the modified files to carry prominent notices stating that you changed the files and the date of any change.",1
507,"The user is granted the right, without any fee or cost, to use, copy, modify, alter, enhance and distribute this software, and any derivative works thereof, and its supporting documentation for any purpose whatsoever, provided that this entire notice appears in all copies of the software, derivative works and supporting documentation.",1
178,Neither the name of the DARPA nor the names of its contributors may be used to endorse or promote products derived from this software without specific prior written permission.,0
237,"You do not distribute any version that lacks this copyright notice (exactly as it appears here, extending from the start to the end of the C-language comment containing these words))",1
567,"Free for non-commercial and commercial use, provided that the original author's name and copyright is quoted somewhere in the final executable and in the program's help or documentation.",1
43,"Redistribution of source code must retain the above copyright notice, this list of conditions and the following disclaimer",1
304,"The right to use, modify and redistribute this code is allowed provided the above copyright notice and the below disclaimer appear on all copies.",1
328,"Making the source available publicly means including the source for this software with the distribution, or a method to get this software via some reasonable mechanism (electronic transfer via a network or media) as well as making an offer to supply the source on request.",1
343,"IN NO EVENT SHALL THE AUTHORS OR CONTRIBUTORS BE LIABLE FOR ANY DIRECT, INDIRECT, INCIDENTAL, SPECIAL, EXEMPLARY, OR CONSEQUENTIAL DAMAGES(INCLUDING, BUT NOT LIMITED TO, PROCUREMENT OF SUBSTITUTE GOODS OR SERVICES; LOSS OF USE, DATA, OR PROFITS; OR BUSINESS INTERRUPTION) HOWEVER CAUSED AND ON ANY THEORY OF LIABILITY, WHETHER IN CONTRACT, STRICT LIABILITY, OR TORT (INCLUDING NEGLIGENCE OR OTHERWISE) ARISING IN ANY WAY OUT OF THE USE OF THIS SOFTWARE, EVEN IF ADVISED OF THE POSSIBILITY OF SUCH DAMAGE.",0
272,"The authors intend this Report to belong to the entire Haskell community, and so we grant permission to copy and distribute it for any purpose, provided that it is reproduced in its entirety, including this Notice.",1
537,"Redistribution and use of this software and associated documentation (""Software""), with or without modification, are permitted provided that the following conditions are met: ",1
318,"The sample program(s) is/are provided to you on an ""AS IS"" basis, without warranty of any kind.",0
488,"To the maximum extent permitted by applicable law, IN NO EVENT SHALL MOTOROLA BE LIABLE FOR ANY DAMAGES WHATSOEVER (INCLUDING WITHOUT LIMITATION, DAMAGES FOR LOSS OF BUSINESS PROFITS, BUSINESS INTERRUPTION, LOSS OF BUSINESS INFORMATION, OR OTHER PECUNIARY LOSS) ARISING OF THE USE OR INABILITY TO USE THE SOFTWARE.",0
18,"Redistributions in binary form must reproduce the above copyright notice, this list of conditions and the following disclaimer in the documentation and/or other materials provided with the distribution.",1
216,"THIS SOFTWARE IS PROVIDED BY THE COPYRIGHT HOLDERS AND CONTRIBUTORS ""AS IS"" AND ANY EXPRESS OR IMPLIED WARRANTIES, INCLUDING, BUT NOT LIMITED TO, THE IMPLIED WARRANTIES OF MERCHANTABILITY AND FITNESS FOR A PARTICULAR PURPOSE ARE DISCLAIMED.",0
491,"Permission is hereby granted to use or copy this program for any purpose, provided the above notices are retained on all copies.",1
154,You are free to use this code in all commercial and non-commercial applications as long as this copyright message is left intact.,1
327,"Imlib2 License Permission is hereby granted, free of charge, to any person obtaining a copy of this software and associated documentation files (the ""Software""), to deal in the Software without restriction, including without limitation the rights to use, copy, modify, merge, publish, distribute, sublicense, and/or sell copies of the Software, and to permit persons to whom the Software is furnished to do so, subject to the following conditions: The above copyright notice and this permission notice shall be included in all copies of the Software and its Copyright notices.",1
62,No title or ownership is transferred hereby.,0
460,"THIS SOFTWARE IS PROVIDED BY MEDIAAREA.NET SARL ``AS IS'' AND ANY EXPRESS OR IMPLIED WARRANTIES, INCLUDING, BUT NOT LIMITED TO, THE IMPLIED WARRANTIES OF MERCHANTABILITY AND FITNESS FOR A PARTICULAR PURPOSE ARE DISCLAIMED.",0
37,"Subject to the terms and conditions of this License, each Contributor hereby grants to You a perpetual, worldwide, non-exclusive, no-charge, royalty-free, irrevocable copyright license to reproduce, prepare Derivative Works of, publicly display, publicly perform, sublicense, and distribute the Work and such Derivative Works in Source or Object form.",1
5,"Attribution Rights. You must retain, in the Source Code of any Derivative Works that You create, all copyright, patent, or trademark notices from the Source Code of the Original Work, as well as any notices of licensing and any descriptive text identified therein as an ""Attribution Notice."" ",1
481,"WITHIN THAT CONSTRAINT, permission to use, copy, modify, and distribute this software and its documentation for any purpose and without fee is hereby granted, provided that the above copyright notice appear in all copies and that both that copyright notice and this permission notice appear in supporting documentation, and that the name of The author not be used in advertising or publicity pertaining to distribution of the software without specific, written prior permission.",1
145,Patent and trademark rights are not licensed under this Public License.,0
203,"ANY EXPRESS OR IMPLIED WARRANTIES, INCLUDING, BUT NOT LIMITED TO, THE IMPLIED WARRANTIES OF MERCHANTABILITY AND FITNESS FOR A PARTICULAR PURPOSE ARE DISCLAIMED.",0
288,"IN NO EVENT SHALL THE AUTHORS OR COPYRIGHT HOLDERS BE LIABLE FOR ANY CLAIM, DAMAGES OR OTHER LIABILITY, WHETHER IN AN ACTION OF CONTRACT, TORT OR OTHERWISE, ARISING FROM, OUT OF OR IN CONNECTION WITH THE SOFTWARE OR THE USE OR OTHER DEALINGS IN THE SOFTWARE.",0
370,"APPLE MAKES NO WARRANTIES, EXPRESS OR IMPLIED, INCLUDING WITHOUT LIMITATION THE IMPLIED WARRANTIES OF NON-INFRINGEMENT, MERCHANTABILITY AND FITNESS FOR A PARTICULAR PURPOSE, REGARDING THE APPLE SOFTWARE OR ITS USE AND OPERATION ALONE OR IN COMBINATION WITH YOUR PRODUCTS.",0
244,This program is freely distributable without licensing fees and is provided without guarantee or warrantee expressed or implied.,1
25,"The copyright notices in the Software and this entire statement, including the above license grant, this restriction and the following disclaimer, must be included in all copies of the Software, in whole or in part, and all derivative works of the Software,",1
73,"Adobe shall not be liable to any party for any loss of revenue or profit or for indirect, incidental, special, consequential, or other similar damages, whether based on tort (including without limitation negligence or strict liability), contract or other legal or equitable grounds even if Adobe has been advised or had reason to know of the possibility of such damages.",0
31,"In particular, the right of distribution includes the right to publish, transmit and communicate the Software to the general public on any or all medium, and by any or all means, and the right to market, either in consideration of a fee, or free of charge, one or more copies of the Software by any means.",1
195,"eCos is distributed in the hope that it will be useful, but WITHOUT ANY WARRANTY; without even the implied warranty of MERCHANTABILITY or FITNESS FOR A PARTICULAR PURPOSE.",0
206,"Permission is hereby granted, free of charge, to any person obtaining a copy of this software and associated documentation files (the ""Software""), to deal in the Software without restriction, including without limitation the rights to use, copy, modify, merge, publish, distribute, sublicense, and/or sell copies of the Software, and to permit persons to whom the Software is furnished to do so, subject to the following conditions: ",1
385,Altered versions may be distributed in packages under other licenses (such as the GNU license).,0
168,"CARNEGIE MELLON PROVIDES THIS SOFTWARE IN ITS ``AS IS'' CONDITION, AND ANY EXPRESS OR IMPLIED WARRANTIES, INCLUDING, BUT NOT LIMITED TO, THE IMPLIED WARRANTIES OF MERCHANTABILITY AND FITNESS FOR A PARTICULAR PURPOSE ARE DISCLAIMED.",0
165,The managers have no responsibility for any damages the users may cause and may sustain.,0
396,"You may copy and distribute verbatim copies of the Document's source code as you receive it, in any medium, provided that you appropriately publish on each copy an appropriate copyright notice and disclaimer of warranty; keep intact all the notices that refer to this License and to the absence of any warranty; and give any other recipients of the Document a copy of this License along with the Document.",1
381,"Permission is granted to anyone to use this software, in source or object code form, on any computer system, and to modify, compile, decompile, run, and redistribute it to anyone else, subject to the following restrictions: ",1
405,"IN NO EVENT SHALL THE AUTHOR(S) BE LIABLE FOR ANY DIRECT, INDIRECT, INCIDENTAL, SPECIAL, EXEMPLARY, OR CONSEQUENTIAL DAMAGES (INCLUDING, BUT NOT LIMITED TO, PROCUREMENT OF SUBSTITUTE GOODS OR SERVICES; LOSS OF USE, DATA, OR PROFITS; OR BUSINESS INTERRUPTION) HOWEVER CAUSED AND ON ANY THEORY OF LIABILITY, WHETHER IN CONTRACT, STRICT LIABILITY, OR TORT (INCLUDING NEGLIGENCE OR OTHERWISE) ARISING IN ANY WAY OUT OF THE USE OF THIS SOFTWARE, EVEN IF ADVISED OF THE POSSIBILITY OF SUCH DAMAGE.",0
404,"THIS SOFTWARE IS PROVIDED ``AS IS'' AND ANY EXPRESS OR IMPLIED WARRANTIES, INCLUDING, BUT NOT LIMITED TO, THE IMPLIED WARRANTIES OF MERCHANTABILITY AND FITNESS FOR A PARTICULAR PURPOSE ARE DISCLAIMED.",0
132,"This software is provided ""AS IS,"" without a warranty of any kind.",0
81,"In consideration of your agreement to abide by the following terms, and subject to these terms, Apple grants you a personal, non-exclusive license, under Apple's copyrights in this original Apple software (the ""Apple Software""), to use, reproduce, modify and redistribute the Apple Software, with or without modifications, in source and/or binary forms; provided that if you redistribute the Apple Software in its entirety and without modifications, you must retain this notice and the following text and disclaimers in all such redistributions of the Apple Software.",1
506,"THIS SOFTWARE IS PROVIDED BY NAUMEN ""AS IS"" AND ANY EXPRESSED OR IMPLIED WARRANTIES, INCLUDING, BUT NOT LIMITED TO, THE IMPLIED WARRANTIES OF MERCHANTABILITY AND FITNESS FOR A PARTICULAR PURPOSE ARE DISCLAIMED.",0
386,"Permission is hereby granted, free of charge, to any person obtaining a copy of this software and associated documentation files (the ""Software""), to deal in the Software without restriction, including without limitation the rights to use, copy, modify, merge, publish, distribute, sublicense, and/or sell copies of the Software, and to permit persons to whom the Software is furnished to do so, subject to the following conditions: The above copyright notice and this permission notice shall be included in all copies or substantial portions of the Software.",1
390,"In no event shall Larabie Fonts be liable for any damages whatsoever (including, without limitation, damages for loss of business profits, business interruption, loss of business information, or any other pecuniary loss) arising out of the use of or inability to use this product, even if Larabie Fonts has been advised of the possibility of such damages.",0
271,"Redistributions of source code must retain the above copyright notice, disclaimer, and this list of conditions.",1
119,"THE SOFTWARE IS PROVIDED ""AS IS"", WITHOUT WARRANTY OF ANY KIND, EXPRESS OR IMPLIED, INCLUDING BUT NOT LIMITED TO THE WARRANTIES OF MERCHANTABILITY, FITNESS FOR A PARTICULAR PURPOSE AND NONINFRINGEMENT.",0
347,"All redistributions of source code files must retain all copyright notices that are currently in place, and this list of conditions without modification.",1
219,"Redistributions in binary form must reproduce the above copyright notice, this list of conditions, and the disclaimer below in the documentation and/or other materials provided with the distribution.",1
409,"THE SOFTWARE IS PROVIDED ""AS IS"", WITHOUT WARRANTY OF ANY KIND, EXPRESS OR IMPLIED, INCLUDING BUT NOT LIMITED TO THE WARRANTIES OF MERCHANTABILITY, FITNESS FOR A PARTICULAR PURPOSE AND NONINFRINGEMENT.",0
72,"Permission is hereby granted, free of charge, to any person obtaining a copy of this documentation file, to create their own derivative works from the content of this document to use, copy, publish, distribute, sublicense, and/or sell the derivative works, and to permit others to do the same, provided that the derived work is not represented as being a copy or version of this document.",1
305,This file is provided AS IS with no warranties of any kind.,0
383,"The author accepts no liability of any kind for damages or other consequences of the use of this software, even if they arise from defects in the software.",0
468,"Permission is granted to use, copy, create derivative works and redistribute this software and such derivative works for any purpose, so long as the name of The University of Michigan is not used in any advertising or publicity pertaining to the use of distribution of this software without specific, written prior authorization.",1
372,"Redistributions in binary form must reproduce the above copyright notice, this list of conditions and the following disclaimer in the documentation and/or other materials provided with the distribution.",1
525,"If you are not a white heterosexual male you are permitted to copy, sell and use this work in any manner you choose without need to include any attribution you do not see fit.",1
282,"In addition, redistributions of modified forms of the source or binary code must carry prominent notices stating that the original code was changed and the date of the change.",1
117,"Permission is hereby granted, free of charge, to any person obtaining a copy of this software and associated documentation files (the ""Software""), to deal in the Software without restriction, including without limitation the rights to use, copy, modify, merge, publish, distribute, sublicense, and/or sell copies of the Software, and to permit persons to whom the Software is furnished to do so, subject to the following conditions.",1
230,"Original or Modified Versions of the Work may be bundled, redistributed and/or sold with any software, provided that each copy contains the above copyright notice and this license.",1
510,"Permission to use, copy, modify, and distribute this software and its documentation for any purpose with or without fee is hereby granted, provided that the above copyright notice appears in all copies and that both the copyright notice and this permission notice appear in supporting documentation, and that the name University of Delaware not be used in advertising or publicity pertaining to distribution of the software without specific, written prior permission.",1
492,"Unlimited permission is granted to use, copy, and distribute them, with or without modification, either commercially or noncommercially.",1
540,"Products derived from this Software may not be called ""OpenLDAP"" nor may ""OpenLDAP"" appear in their names without prior written permission of the OpenLDAP Foundation.",0
346,"Permission is granted to anyone to use this software for any purpose, including commercial applications, and to alter and redistribute it, provided that the following conditions are met",1
220,"THIS SOFTWARE IS PROVIDED ""AS IS"", WITHOUT WARRANTY OF ANY KIND, EXPRESS OR IMPLIED, INCLUDING, BUT NOT LIMITED TO THE WARRANTIES OF MERCHANTABILITY, FITNESS FOR A PARTICULAR PURPOSE AND NONINFRINGEMENT.",0
224,"THIS SOFTWARE IS PROVIDED BY THE COPYRIGHT HOLDER(S) ``AS IS'' AND ANY EXPRESS OR IMPLIED WARRANTIES, INCLUDING, BUT NOT LIMITED TO, THE IMPLIED WARRANTIES OF MERCHANTABILITY AND FITNESS FOR A PARTICULAR PURPOSE ARE DISCLAIMED.",0
175,"COSL License : Redistribution and use in source and binary forms, with or without modification, are permitted provided that the following conditions are met",1
424,"THIS SOFTWARE IS PROVIDED BY THE AUTHORS ``AS IS'' AND ANY EXPRESS OR IMPLIED WARRANTIES, INCLUDING, BUT NOT LIMITED TO, THE IMPLIED WARRANTIES OF MERCHANTABILITY AND FITNESS FOR A PARTICULAR PURPOSE ARE DISCLAIMED.",0
556,"This software is provided ""AS IS,"" without a warranty of any kind.",0
261,"You may choose to redistribute a copy of the Program exclusively under the terms of the GPL by removing the FLOSS Exception notice from that copy of the Program, provided that the copy has never been modified by you or any third party",1
554,"IN NO EVENT SHALL THE COPYRIGHT OWNER OR CONTRIBUTORS BE LIABLE FOR ANY DIRECT, INDIRECT, INCIDENTAL, SPECIAL, EXEMPLARY, OR CONSEQUENTIAL DAMAGES (INCLUDING, BUT NOT LIMITED TO, PROCUREMENT OF SUBSTITUTE GOODS OR SERVICES; LOSS OF USE, DATA, OR PROFITS; OR BUSINESS INTERRUPTION) HOWEVER CAUSED AND ON ANY THEORY OF LIABILITY, WHETHER IN CONTRACT, STRICT LIABILITY, OR TORT (INCLUDING NEGLIGENCE OR OTHERWISE) ARISING IN ANY WAY OUT OF THE USE OF THIS SOFTWARE, EVEN IF ADVISED OF THE POSSIBILITY OF SUCH DAMAGE.",0
52,"Permission to use, copy, modify, and distribute this software and its documentation is hereby granted, provided that the above copyright notice appears in all copies.",1
455,"Redistributions must retain the above copyright notice, this list of conditions and the following disclaimer in the documentation and/or other materials provided with the distribution.",1
395,"The Linux Documentation Project manuals (guides) may be reproduced and distributed in whole or in part, subject to the following conditions: The copyright notice above and this permission notice must be preserved complete on all complete or partial copies.",1
162,"The name and trademarks of copyright holders may NOT be used in advertising or publicity pertaining to the Software without specific, written prior permission.",0
536,"The name and trademarks of copyright holders may NOT be used in advertising or publicity pertaining to the software without specific, written prior permission.",0
235,Obtain permission before redistributing this software over the Internet or in any other medium.,1
204,"Permission is hereby granted, free of charge, to any person obtaining a copy of this software and associated documentation files (the ""Software""), to deal in the Software without restriction, including without limitation the rights to use, copy, modify, merge, publish, distribute, sublicense, and/or sell copies of the Software, and to permit persons to whom the Software is furnished to do so, subject to the following conditions",1
465,"The Font Software may be modified, altered, or added to, and in particular the designs of glyphs or characters in the Fonts may be modified and additional glyphs or characters may be added to the Fonts, only if the fonts are renamed to names not containing the word ""MgOpen"", or if the modifications are accepted for inclusion in the Font Software itself by the each appointed Administrator.",1
375,"The JMagnetic software and related documentation are provided ""AS IS"" and without warranty of any kind and the author expressly disclaims all other warranties, express or implied, including, but not limited to, the implied warranties of merchantability and fitness for a particular purpose.",0
