id,license_text,is_granted
442,"Redistributions that are modified from the original source must include the complete source code, including the source code for all components used by a binary built from the modified sources.",1
170,"Permission to use, copy, modify and distribute this software and its documentation for any purpose and without fee is hereby granted, provided that the above copyright notice appears in all copies and that both that copyright notice and this permission notice appear in supporting documentation, and that the name of CMU and The Regents of the University of California not be used in advertising or publicity pertaining to distribution of the software without specific written permission.",1
3,"Licensor grants You a worldwide, royalty-free, non-exclusive, sublicensable license, for the duration of the copyright, to do the following: b) to translate, adapt, alter, transform, modify, or arrange the Original Work, thereby creating derivative works (""Derivative Works"") based upon the Original Work",1
322,"The Software is provided ""as is"", without warranty of any kind, express or implied, including but not limited to the warranties of merchantability, fitness for a particular purpose and noninfringement.",0
124,"THIS SOFTWARE IS PROVIDED BY THE AUTHOR AND CONTRIBUTORS ``AS IS'' AND ANY EXPRESS OR IMPLIED WARRANTIES, INCLUDING, BUT NOT LIMITED TO, THE IMPLIED WARRANTIES OF MERCHANTABILITY AND FITNESS FOR A PARTICULAR PURPOSE ARE DISCLAIMED.",0
300,"Permission is granted to anyone to use this software for any purpose on any computer system, and to alter it and redistribute it, subject to the following restrictions",1
420,"THIS SOFTWARE AND DOCUMENTATION IS PROVIDED BY OPENFORTRESS AND CONTRIBUTORS ``AS IS'' AND ANY EXPRESS OR IMPLIED WARRANTIES, INCLUDING, BUT NOT LIMITED TO, THE IMPLIED WARRANTIES OF MERCHANTABILITY AND FITNESS FOR A PARTICULAR PURPOSE ARE DISCLAIMED.",0
452,"This software may be modified, redistributed, and used for any purpose, so long as its origin is acknowledged.",1
433,"THE FONT SOFTWARE IS PROVIDED ""AS IS"", WITHOUT WARRANTY OF ANY KIND, EXPRESS OR IMPLIED, INCLUDING BUT NOT LIMITED TO ANY WARRANTIES OF MERCHANTABILITY, FITNESS FOR A PARTICULAR PURPOSE AND NONINFRINGEMENT OF COPYRIGHT, PATENT, TRADEMARK, OR OTHER RIGHT.",0
487,"To the maximum extent permitted by applicable law, MOTOROLA DISCLAIMS ALL WARRANTIES WHETHER EXPRESS OR IMPLIED, INCLUDING IMPLIED WARRANTIES OF MERCHANTABILITY OR FITNESS FOR A PARTICULAR PURPOSE and any warranty against infringement with regard to the SOFTWARE (INCLUDING ANY MODIFIED VERSIONS THEREOF) and any accompanying written materials.",0
475,"Redistributions of source code must retain the above copyright notice, this list of conditions and the following disclaimer.",1
303,"The author is not responsible for the consequences of use of this software, no matter how awful, even if they arise from defects in it.",0
75,"This software code is made available ""AS IS"" without warranties of any kind.",0
374,Commercial usage or redistribution of the JMagnetic software is strictly prohibited.,1
414,"Permission to use, copy, modify, and distribute this software and its documentation for any purpose and without fee is hereby granted, provided that the above copyright notice appear in all copies and that both that copyright notice and this permission notice appear in supporting documentation.",1
139,"Redistribution and use in source and binary forms are permitted provided that the above copyright notice and this paragraph are duplicated in all such forms and that any documentation, advertising materials, and other materials related to such distribution and use acknowledge that the software was developed by the University of California, Berkeley.",1
228,"Additionally, subject to the terms and conditions of the / FreeType Project License, each contributor to the Work hereby grants to any individual or legal entity exercising permissions granted by the FreeType Project License and this section (hereafter, ""You"" or ""Your"") a perpetual, worldwide, non-exclusive, no-charge, royalty-free, irrevocable (except as stated in this section) patent license to make, have made, use, offer to sell, sell, import, and otherwise transfer the Work, where such license applies only to those patent claims licensable by such contributor that are necessarily infringed by their contribution(s) alone or by combination of their contribution(s) with the Work to which such contribution(s) was submitted.",1
459,"Redistribution and use in source and binary forms, with modification, are permitted provided that the GNU Lesser General Public License as published by the Free Software Foundation, either version 3 of the License, or any later version is met.",1
438,"MakeIndex Distribution Notice Permission is hereby granted to make and distribute original copies of this program provided that the copyright notice and this permission notice are preserved and provided that the recipient is not asked to waive or limit his right to redistribute copies as allowed by this permission notice and provided that anyone who receives an executable form of this program is granted access to a machine-readable form of the source code for this program at a cost not greater than reasonable reproduction, shipping, and handling costs.",1
437,"NO WARRANTY THIS SOFTWARE IS PROVIDED BY THE COPYRIGHT HOLDERS AND CONTRIBUTORS ``AS IS'' AND ANY EXPRESS OR IMPLIED WARRANTIES, INCLUDING, BUT NOT LIMITED TO, THE IMPLIED WARRANTIES OF NONINFRINGEMENT, MERCHANTIBILITY AND FITNESS FOR A PARTICULAR PURPOSE ARE DISCLAIMED.",0
192,In no event will the authors be held liable for any damages arising from the use of this software.,0
30,"No trademark or patent rights held by Affirmer are waived, abandoned, surrendered, licensed or otherwise affected by this document.",0
474,"Redistribution and use in source and binary forms, with or without modification, are permitted provided that the following conditions are met.",1
48,"This License does not grant any rights to use any Licensor’s or its affiliates�?names, logos, or trademarks, except as necessary to reproduce the notices described in this License.",0
233,FtpBean may be modified and used in any application free of charge by anyone so long as this copyright notice and the comments above remain intact.,1
348,"All redistributions in binary form must retain all occurrences of the above copyright notice and web site addresses that are currently in place (for example, in the About boxes).",1
366,"This software is provided by the JA-SIG collaborative ""as is"" and any expressed or implied warranties, including, but not limited to, the implied warranties of merchantability and fitness for a particular purpose are disclaimed.",0
427,"The software is provided ""as is"", without warranty of any kind, including but not limited to the warranties of title, fitness, merchantability and non-infringement.",0
547,"University Corporation for Advanced Internet Development, Inc. All rights reserved Redistribution and use in source and binary forms, with or without modification, are permitted provided that the following conditions are met: Redistributions of source code must retain the above copyright notice, this list of conditions and the following disclaimer.v",1
435,"Redistribution and use in source and binary forms, with or without modification, are permitted provided that the following conditions are met",1
56,"Any source code used, modified or distributed must reproduce and retain this copyright notice and list of conditions as they appear in the source file.",1
180,"This software is provided 'as-is', without any express or implied warranty.",0
20,NO EXPRESS OR IMPLIED LICENSES TO ANY PARTY'S PATENT RIGHTS ARE GRANTED BY THIS LICENSE.,0
292,"All rights reserved by the last person to commit a change to this repository, except for the right to commit changes to this repository, which is hereby granted to all of earth's citizens for the purpose of committing changes to this repository.",1
497,"Therefore, neither ICOT, the copyright holder, or any other organization that participated in or was otherwise related to the development of the program and their respective officials, directors, officers and other employees shall be held liable for any and all damages, including, without limitation, general, special, incidental and consequential damages, arising out of or otherwise in connection with the use or inability to use the program or any product, material or result produced or otherwise obtained by using the program, regardless of whether they have been advised of, or otherwise had knowledge of, the possibility of such damages at any time during the project or thereafter.",0
217,"Redistribution and use of the Software in source and binary forms, with or without modification, is permitted provided that the following conditions are met: - Neither the names of NCAR's Computational and Information Systems Laboratory, the University Corporation for Atmospheric Research, nor the names of its sponsors or contributors may be used to endorse or promote products derived from this Software without specific prior written permission.",1
9,"Subject to the terms and conditions of this License, each Contributor hereby grants to You a perpetual, worldwide, non-exclusive, no-charge, royalty-free, irrevocable (except as stated in this section) patent license to make, have made, use, offer to sell, sell, import, and otherwise transfer the Work, where such license applies only to those patent claims licensable by such Contributor that are necessarily infringed by their Contribution(s) alone or by combination of their Contribution(s) with the Work to which such Contribution(s) was submitted. ",1
191,"This software is provided 'as-is', without any express or implied warranty.",0
293,"The enclosed software and documentation includes copyrighted works of Hewlett-Packard Co. For as long as you comply with the following limitations, you are hereby authorized to (i) use, reproduce, and modify the software and documentation, and to (ii) distribute the software and documentation, including modifications, for non-commercial purposes only.",1
211,Facebook reserves all rights not expressly granted to you in this license agreement.,0
232,"Copying and distribution of this file, with or without modification, are permitted in any medium without royalty provided the copyright notice and this notice are preserved.",1
469,"If the above copyright notice or any other identification of the University of Michigan is included in any copy of any portion of this software, then the disclaimer below must also be included.",1
549,"THIS SOFTWARE IS PROVIDED BY THE COPYRIGHT HOLDERS AND CONTRIBUTORS ""AS IS"" AND WITH ALL FAULTS.",0
118,The above copyright notice and this permission notice shall be included in all copies or substantial portions of the Software.,1
315,"Anyone receiving this source is licensed under IBM copyrights to use it in any way he or she deems fit, including copying it, modifying it, compiling it, and redistributing it either with or without modifications.",1
153,CGI applications developed by the holder of this license may be distributed freely in source code or binary form without additional fees or royalties.,1
410,"The Contributing Authors disclaim all warranties, expressed or implied, including, without limitation, the warranties of merchantability and of fitness for any purpose.",0
93,"In particular, without limitation, this License does not grant permission to use the trade names, trademarks, service marks, or product names of Aptana.",0
58,This software is furnished under license and may be used and copied only in accordance with the following terms and conditions.,1
98,"ATMEL EXPRESSLY DISCLAIMS ANY EXPRESS, STATUTORY OR IMPLIED WARRANTIES, INCLUDING, BUT NOT LIMITED TO, THE IMPLIED WARRANTIES OF MERCHANTABILITY, FITNESS FOR A PARTICULAR PURPOSE AND NON-INFRINGEMENT.",0
546,"IN NO EVENT SHALL THE MEMBERS OF THE OPENORB COMMUNITY PROJECT OR ITS CONTRIBUTORS BE LIABLE FOR ANY DIRECT, INDIRECT, INCIDENTAL, SPECIAL, EXEMPLARY, OR CONSEQUENTIAL DAMAGES (INCLUDING, BUT NOT LIMITED TO, PROCUREMENT OF SUBSTITUTE GOODS OR SERVICES; LOSS OF USE, DATA, OR PROFITS; OR BUSINESS INTERRUPTION) HOWEVER CAUSED AND ON ANY THEORY OF LIABILITY, WHETHER IN CONTRACT, STRICT LIABILITY, OR TORT (INCLUDING NEGLIGENCE OR OTHERWISE) ARISING IN ANY WAY OUT OF THE USE OF THIS SOFTWARE, EVEN IF ADVISED OF THE POSSIBILITY OF SUCH DAMAGE.",0
68,"Neither the name of Analog Devices, Inc. nor the names of its contributors may be used to endorse or promote products derived from this software without specific prior written permission.",0
495,"Nara Institute of Science and Technology (NAIST), the copyright holders, disclaims all warranties with regard to this software, including all implied warranties of merchantability and fitness, ",0
116,"THE FONT SOFTWARE IS PROVIDED ""AS IS"", WITHOUT WARRANTY OF ANY KIND, EXPRESS OR IMPLIED, INCLUDING BUT NOT LIMITED TO ANY WARRANTIES OF MERCHANTABILITY, FITNESS FOR A PARTICULAR PURPOSE AND NONINFRINGEMENT OF COPYRIGHT, PATENT, TRADEMARK, OR OTHER RIGHT.",0
1,"Permission to use, copy, modify, and/or distribute this software for any purpose with or without fee is hereby granted.",1
159,"Products derived from this Software may not be called ""classworlds"" nor may ""classworlds"" appear in their names without prior written permission of The Codehaus.",0
291,"Copyright holder DISCLAIMS ALL WARRANTIES WITH REGARD TO THIS SOFTWARE, INCLUDING ALL IMPLIED WARRANTIES OF MERCHANTABILITY AND FITNESS.",0
368,"Neither the name, trademarks, service marks or logos of Apple Inc. may be used to endorse or promote products containing the Apple Software without specific prior written permission from Apple.",0
243,"You may copy and distribute it freely, by any means and under any conditions, as long as the code and documentation is not changed.",1
184,"The Don't Ask Me About It License Full License Text Copying and distribution of this file, with or without modification, are permitted in any medium provided you do not contact the author about the file or any problems you are having with the file.",1
467,This software is placed into the public domain and may be used for any purpose.,1
543,"Redistributions of source code must retain the above copyright notice, this list of conditions and the following disclaimer.",1
402,"Redistributions of source code must retain any existing copyright notice, and this entire permission notice in its entirety, including the disclaimer of warranties.",1
462,"THIS SOFTWARE IS PROVIDED BY THE COPYRIGHT HOLDERS AND CONTRIBUTORS ""AS IS"" AND ANY EXPRESS OR IMPLIED WARRANTIES, INCLUDING, BUT NOT LIMITED TO, THE IMPLIED WARRANTIES OF MERCHANTABILITY AND FITNESS FOR A PARTICULAR PURPOSE ARE DISCLAIMED.",0
66,"Redistribution and use in source and binary forms, with or without modification, are permitted provided that the following conditions are met: Redistributions of source code must retain the above copyright notice, this list of conditions and the following disclaimer.",1
120,You are free to use/modify this code but leave this header intact.,1
552,"Redistributions in binary form must reproduce the above copyright notice, this list of conditions and the following disclaimer in the documentation and/or other materials provided with the distribution.",1
111,"It is provided ""as is"" without express or implied warranty of any kind.",0
555,"Redistribution and use in source and binary forms, with or without modification, are permitted provided that the following conditions are met: Redistribution of source code must retain the above copyright notice, this list of conditions and the following disclaimer.",1
418,"Redistribution and use in source and binary forms, with or without modification, are permitted for any legal purpose, provided that the following conditions are met: Redistributions of source code and/or documentation must retain the above copyright notice, this list of conditions and the following disclaimer.",1
333,"In no event shall Info-ZIP or its contributors be held liable for any direct, indirect, incidental, special or consequential damages arising out of the use of or inability to use this software.",0
454,You may NOT re-distribute this code in any way except through its use.,0
430,"Neither the United States Government nor the University of California nor any of their employees, makes any warranty, express or implied, or assumes any liability or responsibility for the accuracy, completeness, or usefulness of any information, apparatus, product, or process disclosed, or represents that its use would not infringe privately-owned rights.",0
378,"Redistribution in binary form must reproduce the Copyright Notice, this License Terms and Conditions, in the documentation and/or other materials provided with the distribution.",1
207,"The above copyright notice and this permission notice shall be included in all copies of the Software, its documentation and marketing & publicity materials, and acknowledgment shall be given in the documentation, materials and software packages that this Software was used.",1
137,"Redistribution and use in source and binary forms, with or without modification, are permitted provided that the following conditions are met:",1
77,"THIS SOFTWARE IS PROVIDED BY THE AUTHORS ''AS IS'' AND ANY EXPRESS OR IMPLIED WARRANTIES, INCLUDING, BUT NOT LIMITED TO, THE IMPLIED WARRANTIES OF MERCHANTABILITY AND FITNESS FOR A PARTICULAR PURPOSE ARE DISCLAIMED.",0
527,"If you are a white heterosexual male you are provided the same permissions (reuse, modification, resale) but are required to include this license in any documentation and any public facing derivative.",1
121,"This class is public domain so you are free to use it any of your applications (Freeware, Shareware, Commercial).",1
226,"The code must retain the above copyright notice, this list of conditions and the following disclaimer.",1
535,"COPYRIGHT HOLDERS WILL NOT BE LIABLE FOR ANY DIRECT, INDIRECT, SPECIAL OR CONSEQUENTIAL DAMAGES ARISING OUT OF ANY USE OF THE SOFTWARE OR DOCUMENTATION.",0
524,"You may sell a derived work, provided that all source code for your derived work is available, at no additional charge, to anyone who buys your derived work in any form.",1
270,"Redistributions in binary form must reproduce the above copyright notice, disclaimer, and this list of conditions in the documentation and/or other materials provided with the distribution.",1
330,"No Warranty Because the program is licensed free of charge, there is no warranty for the program, to the extent permitted by applicable law.",0
380,"Disclaimer/Limitation of Liability: THIS SOFTWARE IS PROVIDED BY JPNIC ""AS IS"" AND ANY EXPRESS OR IMPLIED WARRANTIES, INCLUDING, BUT NOT LIMITED TO, THE IMPLIED WARRANTIES OF MERCHANTABILITY AND FITNESS FOR A PARTICULAR PURPOSE ARE DISCLAIMED.",0
391,"Redistribution and use in source and binary forms, with or without modification, are permitted provided that the following conditions are met: (1) Redistributions of source code must retain the above copyright notice, this list of conditions and the following disclaimer.",1
515,"Permission is granted to anyone to use this software for any purpose on any computer system, and to redistribute it freely, subject to the following restrictions",1
250,"Google hereby grants to you a perpetual, worldwide, non-exclusive, no-charge, irrevocable (except as stated in this section) patent license to make, have made, use, offer to sell, sell, import, transfer, and otherwise run, modify and propagate the contents of this implementation of the WebRTC code package, where such license applies only to those patent claims, both currently owned by Google and acquired in the future, licensable by Google that are necessarily infringed by this implementation of the WebRTC code package.",1
382,"The author makes no warranty of any kind, either expressed or implied, about the suitability of this software for any purpose.",0
376,"Use, Modification and Redistribution (including distribution of any modified or derived work) in source and/or binary forms is permitted under this License Terms and Conditions.",1
190,"Permission to use, copy, modify, distribute and sell this software and its documentation for any purpose is hereby granted without fee, provided that the above copyright notice appear in all copies and that both that copyright notice and this permission notice appear in supporting documentation.",1
90,"No Warranty Aptana represents that to its knowledge as of the date of first publication of the Program under this License, it has sufficient copyright rights in the Program, to grant the copyright license set forth in this License.",0
399,"This library is free software; you can redistribute it and/or modify it under the terms of the GNU Lesser General Public License as published by the Free Software Foundation; either version 2.1 of the License, or (at your option) any later version.",1
387,"THE SOFTWARE IS PROVIDED ""AS IS"", WITHOUT WARRANTY OF ANY KIND, EXPRESS OR IMPLIED, INCLUDING BUT NOT LIMITED TO THE WARRANTIES OF MERCHANTABILITY, FITNESS FOR A PARTICULAR PURPOSE AND NONINFRINGEMENT.",0
560,"You may use, modify, and distribute the Data made available to you by the Data Provider under this O-UDA if you follow the O-UDA's terms.",1
227,Any modifications must be clearly marked as such.,1
319,"IBM HEREBY EXPRESSLY DISCLAIMS ALL WARRANTIES, EITHER EXPRESS OR IMPLIED, INCLUDING, BUT NOT LIMITED TO, THE IMPLIED WARRANTIES OF MERCHANTABILITY AND FITNESS FOR A PARTICULAR PURPOSE.",0
494,"Any copy of this software, whether in its original form or modified, must include both the above copyright notice and the following paragraphs.",1
46,"Subject to the terms and conditions of this License, each Licensor grants to you a perpetual, worldwide, non-exclusive, royalty-free, copyright license to reproduce, prepare derivative works of, publicly display, publicly perform, sublicense and distribute its Work and any resulting derivative works in any form",1
517,"Permission to use, copy, modify, and/or distribute this software for any purpose with or without fee is hereby granted.",1
302,"Permission is granted to anyone to use this software for any purpose on any computer system, and to redistribute it freely, subject to the following restrictions",1
296,"HEWLETT-PACKARD COMPANY DOES NOT WARRANT THAT THE USE, REPRODUCTION, MODIFICATION OR DISTRIBUTION OF THE SOFTWARE OR DOCUMENTATION WILL NOT INFRINGE A THIRD PARTY'S INTELLECTUAL PROPERTY RIGHTS.",0
33,"Besides, if the Licensor owns or comes to own one or more patents protecting all or part of the functions of the Software or of its components, the Licensor undertakes not to enforce the rights granted by these patents against successive Licensees using, exploiting or modifying the Software.",0
176,"Redistributions of source code must retain the original author's copyright notice, this list of conditions and the following disclaimer.",1
490,"THIS MATERIAL IS PROVIDED AS IS, WITH ABSOLUTELY NO WARRANTY EXPRESSED OR IMPLIED.",0
363,"Redistribution and use in source and binary forms, with or without modification, are permitted provided that the following conditions are met",1
351,"Intel Corporation grants a world-wide, royalty-free, non-exclusive license under patents it now or hereafter owns or controls to make, have made, use, import, offer to sell and sell (""Utilize"") this software, but solely to the extent that any such patent is necessary to Utilize the software alone, or in combination with an operating system licensed under an approved Open Source license as listed by the Open Source Initiative at http://opensource.org/licenses.",1
24,"Permission is hereby granted, free of charge, to any person or organization obtaining a copy of the software and accompanying documentation covered by this license (the ""Software"") to use, reproduce, display, distribute, execute, and transmit the Software, and to prepare derivative works of the Software, and to permit third-parties to whom the Software is furnished to do so, all subject to the following:",1
290,"It is provided ""as is"" without express or implied warranty.",0
248,Permission to distribute the released version of the source code along with corresponding source modifications in the form of a patch file is granted with same provisions 2 through 4 for binary distributions.,1
521,"The recipient, and any party obtaining a copy of these files from the recipient, directly or indirectly, is granted, free of charge, a full and unrestricted irrevocable, world-wide, paid up, royalty-free, nonexclusive right and license to deal in this software and documentation files (the ""Software""), including without limitation the rights to use, copy, modify, merge, publish, distribute, sublicense, and/or sell copies of the Software, and to permit persons who receive copies from any such party to do so.",1
140,The name of the University may not be used to endorse or promote products derived from this software without specific prior written permission.,0
150,"Permission is granted to use CGIC in any application, commercial or noncommercial, at no cost.",1
38,You must give any other recipients of the Work or Derivative Works a copy of this License,1
257,THE ENTIRE RISK AS TO THE QUALITY AND PERFORMANCE OF THE PROGRAM IS WITH YOU.,0
499,You are allowed to modify the source code in any way you want except you cannot modify the copyright details at the top of each module.,1
