id,text,commercial_use,distribution,modification,private_use,patent_use,trademark_use,disclose_source,license_and_copyright_notice,same_license,state_changes,liability,warranty
1,warranty disclaimer binding agreement and additional terms and agreements,0,0,0,0,0,0,0,0,0,0,0,0
2,the software and other information is delivered to you as is and with all faults,0,0,0,0,0,0,0,0,0,0,0,0
3,adobe its suppliers and certification authorities do not and cannot warrant the performance or results you may obtain by using the software certificate authority services or other third party offerings,0,0,0,0,0,0,0,0,0,0,0,0
4,except to the extent any warranty condition representation or term cannot or may not be excluded or limited by law applicable to you in your jurisdiction adobe and its suppliers and certification authorities make no warranties conditions representations or terms express or implied whether by statute common law custom usage or otherwise as to any matter including without limitation noninfringement of third party rights merchantability integration satisfactory quality or fitness for any particular purpose,0,0,0,0,0,0,0,0,0,0,0,0
5,the provisions of sections 11 and 10 shall survive the termination of this agreement howsoever caused but this shall not imply or create any continued right to use the software after termination of this agreement,0,0,0,0,0,0,0,0,0,0,0,0
6,adobe permits you to use the software only in accordance with the terms of this agreement,0,0,0,0,0,0,0,0,0,0,0,0
7,use of some third party materials included in the software may be subject to other terms and conditions typically found in a separate license agreement a read me file located near such materials or in the third party software notices and or additional terms and conditions found at http  wwwadobecom go thirdparty,0,1,0,0,0,0,0,0,0,0,0,0
8,such other terms and conditions will supersede all or portions of this agreement in the event of a conflict with the terms and conditions of this agreement,0,0,0,0,0,0,0,0,1,0,1,0
9,if you obtained the software from adobe or one of its authorized licensees and subject to your compliance with the terms of this agreement including the restrictions in section 4 adobe grants to you a non exclusive license to use the software in the manner and for the purposes described in the documentation as follows 31 general use,0,0,0,1,0,0,0,0,0,0,0,0
10,you may install and use one copy of the software on your compatible computer,0,0,0,0,0,0,0,0,0,0,0,0
11,see section 4 for important restrictions on the use of the software,0,0,0,0,0,0,0,0,0,0,0,0
12,this agreement does not permit you to install or use the software on a computer file server,0,0,0,0,0,0,0,0,0,0,0,0
13,for information on use of software on a computer file server please refer to http  wwwadobecom go acrobat_distribute for information about adobe reader or http  wwwadobecom go licensing for information about the adobe runtimes,0,0,0,0,0,0,1,0,0,0,0,0
14,this license does not grant you the right to sublicense or distribute the software,0,1,0,0,0,0,0,0,0,0,0,0
15,for information about obtaining the right to distribute the software on tangible media or through an internal network or with your product or service please refer to http  wwwadobecom go acrobat_distribute for information about adobe reader or http  wwwadobecom go licensing for information about the adobe runtimes,0,0,0,0,0,0,1,0,0,0,0,0
16,you may make one backup copy of the software provided your backup copy is not installed or used other than for archival purposes,0,0,0,0,0,0,1,0,0,0,0,0
17,you may not transfer the rights to a backup copy unless you transfer all rights in the software as provided under section 5,0,0,0,0,0,0,0,0,0,0,0,0
18,you will not use any adobe runtime on any non pc device or with any embedded or device version of any operating system,0,0,0,0,0,0,0,0,0,0,0,0
19,for the avoidance of doubt and by example only you may not use an adobe runtime on any a mobile device set top box stb handheld phone game console tv dvd player media center other than with windows xp media center edition and its successors electronic billboard or other digital signage internet appliance or other internet connected device pda medical device atm telematic device gaming machine home automation system kiosk remote control device or any other consumer electronics device b operator based mobile cable satellite or television system or c other closed system device,0,0,0,0,0,0,0,0,0,0,0,0
20,no right or license to use any adobe runtime is granted for such prohibited uses,0,0,0,0,0,0,0,0,0,0,0,0
21,for information on software license terms for non pc versions of adobe runtimes please visit http  wwwadobecom go runtime_mobile_eula,0,0,0,0,0,0,0,0,0,0,0,0
22,for information on licensing adobe runtimes for distribution on such systems please visit http  wwwadobecom go licensing,0,0,0,0,0,0,0,0,0,0,0,0
23,the software may contain h264 avc video technology the use of which requires the following notice from mpeg la llc,0,0,0,0,0,0,0,0,0,0,0,0
24, this software is licensed under the avc patent portfolio license for the personal and non commercial use of a consumer to i encode video in compliance with the avc standard avc video and or ii decode avc video that was encoded by a consumer engaged in a personal and non commercial activity and or was obtained from a video provider licensed to provide avc video,1,0,0,1,0,0,0,0,0,0,0,0
25,no license is granted or shall be implied for any other use,0,0,0,0,0,0,0,0,0,0,0,0
26,additional information may be obtained from mpeg la llc,0,0,0,0,0,0,0,0,0,0,0,0
27,the h264 avc software encoding functionality available in the adobe runtimes is licensed solely for personal non commercial use,1,0,0,1,0,0,0,0,0,0,0,0
28,for more information on obtaining the right to use the h264 avc software encoding functionality for commercial purposes please refer to http  wwwadobecom go licensing,1,0,1,1,0,0,0,0,0,0,0,0
29,you will not use adobe flash player with any application or device that circumvents technological measures for the protection of video audio and or data content including any of adobeâs secure rtmp measures,0,0,0,0,0,0,0,0,0,0,0,0
30,no right or license to use adobe flash player is granted for such prohibited uses,0,0,0,0,0,0,0,0,0,0,0,0
31,you will not integrate or use adobe reader with any other software plugin or enhancement that uses or relies upon adobe reader when converting or transforming pdf files into a different format eg a pdf file into a tiff jpeg or svg file,0,0,0,0,0,0,0,0,0,0,0,0
32,you will not integrate or use adobe reader with any plug in software not developed in accordance with the adobe integration key license agreement more information can be found at http  wwwadobecom go rikla_program,0,0,0,0,0,0,0,0,0,0,0,0
33,adobe reader may contain features or functionalities that are hidden or appear disabled or grayed out the disabled features,0,0,0,0,0,0,0,0,0,0,0,0
34,disabled features will activate only when opening a pdf document that was created using enabling technology available only from adobe,0,0,0,0,0,0,0,0,0,0,0,0
35,you will not access or attempt to access any disabled features other than through the use of such enabling technologies nor will you rely on adobe reader to create a feature substantially similar to any disabled feature or otherwise circumvent the technology that controls activation of any such feature,0,0,0,0,0,0,0,0,0,0,0,0
36,for more information on disabled features please refer to http  wwwadobecom go readerextensions,0,0,0,0,0,0,0,0,0,0,0,0
37,you shall not alter or remove any copyright or other proprietary notice that appears on or in the software,0,0,0,0,0,0,0,1,0,0,0,0
38,you shall not modify adapt translate or create derivative works based upon the software,0,0,1,0,0,0,0,0,0,0,0,0
39,you shall not reverse engineer decompile disassemble or otherwise attempt to discover the source code of the software,0,0,0,0,0,0,0,0,0,0,0,0
40,if you are located in the european union please refer to the additional terms at the end of this agreement under the header european union provisions in section 16,0,0,0,0,0,0,0,0,0,0,0,0
41,you may not rent lease sublicense assign or transfer your rights in the software or authorize all or any portion of the software to be copied onto another userâs computer except as may be expressly permitted by this agreement,0,0,0,0,0,0,0,0,0,0,0,0
42,you may however transfer all your rights to use the software to another person or legal entity provided that a you also transfer i this agreement and ii the software and all other software or hardware bundled or pre installed with the software including all copies updates and prior versions to such person or entity b you retain no copies including backups and copies stored on a computer and c the receiving party accepts the terms and conditions of this agreement and any other terms and conditions upon which you obtained a valid license to the software,0,1,1,0,0,0,0,0,0,0,0,0
43,notwithstanding the foregoing you may not transfer education pre release or not for resale copies of the software,0,0,0,0,0,0,0,0,0,0,0,0
44,the software and any authorized copies that you make are the intellectual property of adobe and its suppliers,0,0,0,0,0,0,0,0,0,0,0,0
45,the structure organization and code of the software are the valuable intellectually property eg,0,0,0,1,0,0,0,0,0,0,0,0
46,trade secrets and confidential information of adobe and its suppliers,0,0,0,0,0,0,0,0,0,0,0,0
47,the software is protected by law including without limitation the copyright laws of the united states and other countries and by international treaty provisions,0,0,0,0,0,0,0,0,0,0,0,0
48,except as expressly stated herein this agreement does not grant you any intellectual property rights in the software and all rights not expressly granted are reserved by adobe and its suppliers,0,0,0,0,0,0,0,0,0,0,0,0
49,you acknowledge and agree to the following 71 use of pdf files,0,0,0,0,0,0,0,0,0,0,0,0
50,when you use the software to open a pdf file that has been enabled to display ads your computer may connect to a website operated by adobe an advertiser or other third party,0,0,0,0,0,0,0,0,0,0,0,0
51,your internet protocol address ip address is sent when this happens,0,0,0,0,0,0,0,0,0,0,0,0
52,the party hosting the site may use technology to send or serve advertising or other electronic content that appears in or near the opened pdf file,0,0,0,0,0,0,0,0,0,0,0,0
53,the website operator may also use javascript web beacons also known as action tags or single pixel gifs and other technologies to increase and measure the effectiveness of advertisements and to personalize advertising content,0,1,0,0,0,0,0,0,0,0,0,0
54,your communication with adobe websites is governed by the adobe online privacy policy found at http  wwwadobecom go privacy adobe online privacy policy,0,0,0,0,0,0,0,0,0,0,0,0
55,adobe may not have access to or control over features that a third party may use and the information practices of third party websites are not covered by the adobe online privacy policy,0,0,0,0,0,0,0,0,0,0,0,0
56,if your computer is connected to the internet the software may without additional notice check for updates that are available for automatic download and installation to your computer and let adobe know the software is successfully installed,0,0,0,0,0,0,0,0,0,0,0,0
57,for reader updates may be automatically downloaded but not installed without additional notice unless you change your preferences to accept automatic installation,0,0,0,0,0,0,0,0,0,0,0,0
58,only non personally identifying information is transmitted to adobe when this happens except to the extent that ip addresses may be considered personally identifiable in some jurisdictions,0,0,0,0,0,0,0,0,0,0,0,0
59,the use of such information including your ip address as provided by the auto update process is governed by the adobe online privacy policy,0,0,0,0,0,0,0,0,0,0,0,0
60,please consult the documentation for information about changing default update settings at http  wwwadobecom go settingsmanager for flash player http  wwwadobecom go update_details_url or successor website for reader and http  wwwadobecom go air_update_details for adobe air,0,0,0,0,0,0,1,0,0,0,0,0
61,flash player and adobe air may allow third parties to store certain information on your computer in a local data file known as a local shared object,0,0,0,0,0,0,0,0,0,0,0,0
62,the type and amount of information that the third party application requests to be stored in a local shared object can vary by application and such requests are controlled by the third party,0,0,0,0,0,0,0,0,0,0,0,0
63,to find more information on local shared objects and learn how to limit or control the storage of local shared objects on your computer please visit http  wwwadobecom go flashplayer_security,0,0,0,0,0,0,0,0,0,0,0,0
64,flash player and third party programs using adobe air may save certain user settings by storing them on your computer as a local shared object,0,0,0,0,0,0,0,0,0,0,0,0
65,these settings do not contain personally identifiable information associated with you,0,0,0,0,0,0,0,0,0,0,0,0
66,they are associated with the instance of flash player or the third party program using adobe air on your computer allowing you to customize runtime features,0,0,0,0,0,0,0,0,0,0,0,0
67,the flash player settings manager permits you to modify such settings including the ability to limit third parties from storing local shared objects or grant third party content the right to access your computerâs microphone and camera,0,1,1,0,0,0,0,0,0,0,0,0
68,you can find more information on how to configure settings in your version of flash player including information on how to disable local shared objects using the flash player settings manager at http  wwwadobecom go settingsmanager,0,0,0,0,0,0,1,0,0,0,0,0
69,you can remove equivalent settings for third party programs using adobe air by uninstalling the third party program,0,0,0,0,0,0,0,0,0,0,0,0
70,adobe flash player and adobe air runtimes provide the ability for applications built by third parties to connect to an adobe server or service and permit direct communication between two adobe runtime clients or to connect an adobe runtime client as part of a peer or distributed network that allows a portion of your resources such as network bandwidth to be made directly available to other participants,0,0,0,0,0,0,0,0,0,0,0,0
71,prior to joining such peer or distributed network you will be provided with the opportunity to accept such connectivity,0,0,0,0,0,0,0,0,0,0,0,0
72,you can manage peer assisted networking settings using the flash player settings manager,0,0,0,0,0,0,0,0,0,0,0,0
73,learn more about using the settings manager at http  wwwadobecom go settingsmanager,0,0,0,0,0,0,0,0,0,0,0,0
74,you can find more information on peer assisted networking at http  wwwadobecom go rtmfp,0,0,0,0,0,0,0,0,0,0,0,0
75,if you use the adobe runtimes to access content that has been protected with adobe flash media rights management server or flash access software content protection in order to let you play the protected content the software may automatically request media usage rights and individualization from a server on the internet and may download and install required components of the software including any available content protection updates,0,1,1,0,0,0,0,0,0,0,0,0
76,you can clear the content license information using the flash player settings manager,0,0,0,0,0,0,0,0,0,0,0,0
77,learn more about using the settings manager at http  wwwadobecom go settingsmanager,0,0,0,0,0,0,0,0,0,0,0,0
78,you can find more information on content protection at http  wwwadobecom go protected_content,0,0,0,0,0,0,0,0,0,0,0,0
79,if your computer is connected to the internet the software may without additional notice and on an intermittent or regular basis facilitate your access to content and services that are hosted on websites maintained by adobe or its affiliates adobe online services,0,1,0,0,0,0,0,0,0,0,0,0
80,examples of such adobe online services might include but are not limited to acrobatcom,0,0,0,0,0,0,0,0,0,0,0,0
81,in some cases an adobe online service might appear as a feature or extension within the software even though it is hosted on a website,0,0,0,0,0,0,0,0,0,0,0,0
82,in some cases access to an adobe online service might require a separate subscription or other fee in order to access it and or your assent to additional terms of use,0,1,0,0,0,0,0,0,0,0,0,0
83,adobe online services might not be available in all languages or to residents of all countries and adobe may at any time and for any reason modify or discontinue the availability of any adobe online service,0,0,0,0,0,0,0,0,0,0,0,0
84,adobe also reserves the right to begin charging a fee for access to or use of an adobe online service that was previously offered at no charge,1,0,0,0,0,0,0,0,0,0,0,0
85,if your computer is connected to the internet the software may without additional notice update downloadable materials from these adobe online services so as to provide immediate availability of these adobe online services even when you are offline,0,1,0,0,0,0,0,0,0,0,0,0
86,when the software connects to the internet as a function of an adobe online service your ip address user name and password may be sent to adobeâs servers and stored by adobe in accordance with the additional terms of use or the help menu in the software,0,0,0,0,0,0,0,0,0,0,0,0
87,this information may be used by adobe to send you transactional messages to facilitate the adobe online service,0,0,0,0,0,0,0,0,0,0,0,0
88,adobe may display in product marketing to provide information about the software and other adobe products and services including but not limited to adobe online services based on certain software specific features including but not limited to the version of the software including without limitation platform version version of the software and language,0,0,0,0,0,0,0,0,0,0,0,0
89,for further information about in product marketing please see the help menu in the software,0,0,0,0,0,0,0,0,0,0,0,0
90,whenever the software makes an internet connection and communicates with an adobe website whether automatically or due to explicit user request the adobe online privacy policy shall apply,0,0,0,0,0,0,0,0,0,0,0,0
91,additionally unless you are provided with separate terms of use at that time the adobecom terms of use http  wwwadobecom go terms shall apply,0,0,0,0,0,0,0,0,0,0,0,0
92,please note that the adobe privacy policy allows tracking of website visits and it addresses in detail the topic of tracking and use of cookies web beacons and similar devices,0,0,0,0,0,0,0,0,0,0,0,0
93,you acknowledge and agree to the following 81 third party offerings,0,0,0,0,0,0,0,0,0,0,0,0
94,the software may allow you to access and interoperate with third party content software applications and data services including rich internet applications third party offerings,0,0,0,0,0,0,0,0,0,0,0,0
95,your access to and use of any third party offering including any goods services or information is governed by the terms and conditions respecting such offerings and copyright laws of the united states and other countries,0,0,0,0,0,0,0,0,0,0,0,0
96,third party offerings are not owned or provided by adobe,0,0,0,0,0,0,0,0,0,0,0,0
97,you agree that you will not use any of such third party offerings in violation of copyright laws of the united states or other countries,0,0,0,0,0,0,0,0,0,0,0,0
98,adobe or the third party may at any time for any reason modify or discontinue the availability of any third party offerings,0,0,0,0,0,0,0,0,0,0,0,0
99,adobe does not control endorse or accept responsibility for third party offerings,0,0,0,0,0,0,0,0,0,0,0,0
100,any dealings between you and any third party in connection with a third party offerings including such partyâs privacy policies and use of your personal information delivery of and payment for goods and services and any other terms conditions warranties or representations associated with such dealings are solely between you and such third party,0,0,0,0,0,0,0,0,0,0,0,0
101,third party offerings might not be available in all languages or to residents of all countries and adobe or the third party may at any time and for any reason modify or discontinue the availability of any third party offerings,0,0,0,0,0,0,0,0,0,0,0,0
102,82 except as expressly agreed by adobe or its affiliates or a third party in a separate agreement your use of adobe and third party offerings is at your own risk under the warranty and liability limitations of sections 11 and 10,0,0,0,0,0,0,0,0,0,0,0,1
103,you acknowledge and agree to the following 91 use,0,0,0,0,0,0,0,0,0,0,0,0
104,adobe air uses digital certificates to help you identify the publisher of adobe air applications created by third parties,0,0,0,0,0,0,0,0,0,0,0,0
105,additionally adobe air uses digital certificates to establish the identity of servers accessed via the transport layer security tls protocol including access via https,0,0,0,0,0,0,1,0,0,0,0,0
106,adobe reader uses digital certificates to sign and validate signatures within pdf documents and to validate certified pdf documents,0,1,0,0,0,0,1,0,0,0,0,0
107,adobe runtimes use digital certificates to secure protected content from unauthorized usage,0,1,0,0,0,0,0,0,0,0,0,0
108,your computer may connect to the internet at the time of validation of a digital certificate in order to download current certificate revocation lists crls or to update the list of digital certificates,0,0,0,0,0,0,0,0,0,0,0,0
109,this access may be made both by the software and by applications based on the software,0,0,0,0,0,0,0,0,0,0,0,0
110,digital certificates are issued by third party certificate authorities including adobe certified document services cds vendors listed at http  wwwadobecom go partners_cds and adobe approved trust list aatl vendors listed at http  wwwadobecom go aatl and individualization vendors found at http  wwwadobecom go protected_content collectively certification authorities or can be selfsigned,0,0,0,0,0,0,0,0,0,0,0,0
111,purchase use and reliance upon digital certificates are the responsibility of you and a certification authority,0,0,0,0,0,0,0,0,0,0,0,0
112,before you rely upon any certified document digital signature or certification authority services you should review the applicable terms and conditions under which the relevant certification authority provides services including for example any subscriber agreements relying party agreements certificate policies and practice statements,0,0,0,0,0,0,0,0,0,0,0,0
113,see the links on http  wwwadobecom go partners_cds for information about adobeâs cds vendors and http  wwwadobecom go aatl for information about adobeâs aatl vendors,0,0,0,0,0,0,0,0,0,0,0,0
114,you agree that a a digital certificate may have been revoked prior to the time of verification making the digital signature or certificate appear valid when in fact it is not b the security or integrity of a digital certificate may be compromised due to an act or omission by the signer of the document the applicable certification authority or any other third party and c a certificate may be a self signed certificate not provided by a certification authority,0,0,0,0,0,1,0,0,0,0,0,0
115,you are solely responsible for deciding whether or not to rely on a certificate,0,0,0,0,0,0,0,0,0,0,0,0
116,unless a separate written warranty is provided to you by a certification authority you use digital certificates at your sole risk,0,0,0,0,0,0,0,0,0,0,0,1
117,you agree that any certification authority you rely upon is a third party beneficiary of this agreement and shall have the right to enforce this agreement in its own name as if it were adobe,0,0,0,0,0,0,0,0,0,0,0,0
118,you agree to hold adobe and any applicable certification authority except as expressly provided in its terms and conditions harmless from any and all liabilities losses actions damages or claims including all reasonable expenses costs and attorneys fees arising out of or relating to any use of or reliance on by you or any third party that receives a document from you with a digital certificate any service of such authority including without limitation a reliance on an expired or revoked certificate b improper verification of a certificate c use of a certificate other than as permitted by any applicable terms and conditions this agreement or applicable law d failure to exercise reasonable judgment under the circumstances in relying on issuer services or certificates or e failure to perform any of the obligations as required in the terms and conditions related to the services,0,0,0,0,0,0,0,0,0,0,0,0
119,in no event will adobe its suppliers or certification authorities be liable to you for any damages claims or costs whatsoever including any consequential indirect incidental damages or any lost profits or lost savings even if an adobe representative has been advised of the possibility of such loss damages or claims,0,0,0,0,0,0,0,0,0,0,1,0
120,the foregoing limitations and exclusions apply to the extent permitted by applicable law in your jurisdiction,0,0,0,0,0,0,0,0,0,0,0,0
121,adobeâs aggregate liability and that of its suppliers and certification authorities under or in connection with this agreement shall be limited to the amount paid for the software if any,0,0,0,0,0,0,0,0,0,0,1,0
122,nothing contained in this agreement limits adobeâs liability to you in the event of death or personal injury resulting from adobeâs negligence or for the tort of deceit fraud,0,0,0,0,0,0,0,0,0,0,1,0
123,adobe is acting on behalf of its suppliers and certification authorities for the purpose of disclaiming excluding and or limiting obligations warranties and liability as provided in this agreement but in no other respects and for no other purpose,0,0,0,0,0,0,0,0,0,0,1,0
