id,text,commercial_use,distribution,modification,private_use,patent_use,trademark_use,disclose_source,license_and_copyright_notice,same_license,state_changes,liability,warranty
124,for further information please see the jurisdiction specific information at the end of this agreement if any or contact adobeâs customer support department,0,0,0,0,0,0,0,0,0,0,0,0
125,you agree that the software will not be shipped transferred or exported into any country or used in any manner prohibited by the united states export administration act or any other export laws restrictions or regulations collectively the export laws,0,0,0,0,0,0,0,0,0,0,0,0
126,in addition if the software is identified as export controlled items under the export laws you represent and warrant that you are not a citizen or otherwise located within an embargoed nation including without limitation iran syria sudan cuba and north korea and that you are not otherwise prohibited under the export laws from receiving the software,0,1,0,0,0,0,0,0,0,0,0,0
127,all rights to use the software are granted on condition that such rights are forfeited if you fail to comply with the terms of this agreement,0,0,0,0,0,0,0,0,0,0,0,0
128,if you are a consumer who uses the software for only personal non business purposes then this agreement will be governed by the laws of the state in which you purchased the license to use the software,0,0,0,1,0,0,0,0,0,0,0,0
129,if you are not such a consumer this agreement will be governed by and construed in accordance with the substantive laws in force in a the state of california if a license to the software is obtained when you are in the united states canada or mexico or b japan if a license to the software is obtained when you are in japan or c singapore if a license to the software is obtained when you are in a member state of the association of southeast asian nations the peopleâs republic of china including hong kong sar,0,0,0,0,0,0,0,0,1,0,0,0
130, taiwan or the republic of korea or d england if a license to the software is obtained when you are in any jurisdiction not described above,0,0,0,0,0,0,0,0,0,0,0,0
131,the respective courts of santa clara county california when california law applies tokyo district court in japan when japanese law applies and the competent courts of london england when the law of england applies shall each have non exclusive jurisdiction over all disputes relating to this agreement,0,0,0,0,0,0,0,0,0,0,1,0
132,when singapore law applies any dispute arising out of or in connection with this agreement including any question regarding its existence validity or termination shall be referred to and finally resolved by arbitration in singapore in accordance with the arbitration rules of the singapore international arbitration centre siac for the time being in force which rules are deemed to be incorporated by reference in this section,0,0,0,0,0,0,0,0,0,0,1,0
133,there shall be one arbitrator selected jointly by the parties,0,0,0,0,0,0,0,0,0,0,0,0
134,if the arbitrator is not selected within thirty 30 days of the written demand by a party to submit to arbitration the chairman of the siac shall make the selection,0,0,0,0,0,0,0,0,0,0,0,0
135,notwithstanding any provision in this agreement adobe or you may request any judicial administrative or other authority to order any provisional or conservatory measure including injunctive relief specific performance or other equitable relief prior to the institution of legal or arbitration proceedings or during the proceedings for the preservation of its rights and interests or to enforce specific terms that are suitable for provisional remedies,0,0,0,0,0,0,0,0,0,0,0,0
136,the english version of this agreement will be the version used when interpreting or construing this agreement,0,0,0,0,0,0,0,0,0,0,0,0
137,this agreement will not be governed by the conflict of law rules of any jurisdiction or the united nations convention on contracts for the international sale of goods the application of which is expressly excluded,0,0,0,0,0,0,0,0,0,0,1,0
138,if any part of this agreement is found void and unenforceable it will not affect the validity of the balance of this agreement which shall remain valid and enforceable according to its terms,0,0,0,0,0,0,0,0,0,0,1,0
139,this agreement shall not prejudice the statutory rights of any party dealing as a consumer,0,0,0,0,0,0,0,0,0,0,1,0
140,this agreement may only be modified by a writing signed by an authorized officer of adobe,0,0,0,0,0,0,0,0,0,0,0,0
141,updates may be licensed to you by adobe with additional or different terms,0,0,0,0,0,0,0,0,0,0,0,0
142,this is the entire agreement between adobe and you relating to the software and it supersedes any prior representations discussions undertakings communications or advertising relating to the software,0,0,0,0,0,0,0,0,0,0,0,0
143,for us government end users adobe agrees to comply with all applicable equal opportunity laws including if appropriate the provisions of executive order 11246 as amended section 402 of the vietnam era veterans readjustment assistance act of 1974 38 usc 4212 and section 503 of the rehabilitation act of 1973 as amended and the regulations at 41 cfr parts 60 1 through 60 60 60 250 and 60 741,0,0,0,0,0,0,0,0,0,0,0,0
144,the affirmative action clause and regulations contained in the preceding sentence shall be incorporated by reference in this agreement,0,0,0,0,0,0,0,0,0,0,0,0
145,if you are a business or organization you agree that upon request from adobe or adobeâs authorized representative you will within thirty 30 days fully document and certify that use of any and all software at the time of the request is in conformity with your valid licenses from adobe,0,0,0,0,0,0,0,0,0,0,0,0
146,nothing included in this agreement including section 45 shall limit any non waivable right to decompile the software that you may enjoy under mandatory law,0,0,0,0,0,0,0,0,0,0,0,0
147,for example if you are located in the european union eu you may have the right upon certain conditions specified in the applicable law to decompile the software if it is necessary to do so in order to achieve interoperability of the software with another software program and you have first asked adobe in writing to provide the information necessary to achieve such interoperability and adobe has not made such information available,0,0,0,0,0,0,0,0,0,0,0,0
148,in addition such decompilation may only be done by you or someone else entitled to use a copy of the software on your behalf,0,0,0,0,0,0,0,0,0,0,0,0
149,adobe has the right to impose reasonable conditions before providing such information,0,0,0,0,0,0,0,0,0,0,0,0
150,any information supplied by adobe or obtained by you as permitted hereunder may only be used by you for the purpose described herein and may not be disclosed to any third party or used to create any software which is substantially similar to the expression of the software or used for any other act which infringes adobe or its licensorsâ copyright,0,0,0,0,0,0,0,0,0,0,0,0
151,171 limitation of liability for users residing in germany and austria,0,0,0,0,0,0,0,0,0,0,0,0
152,1711 if you obtained the software in germany or austria and you usually reside in such country then section 10 does not apply,0,0,0,0,0,0,0,0,0,0,0,0
153,instead subject to the provisions in section 1712 adobeâs statutory liability for damages shall be limited as follows a adobe shall be liable only up to the amount of damages as typically foreseeable at the time of entering into the license agreement in respect of damages caused by a slightly negligent breach of a material contractual obligation and b adobe shall not be liable for damages caused by a slightly negligent breach of a non material contractual obligation,0,0,0,0,0,0,0,0,0,0,1,0
154,1712 the aforesaid limitation of liability shall not apply to any mandatory statutory liability in particular to liability under the german product liability act liability for assuming a specific guarantee or liability for culpably caused personal injuries,0,0,0,0,0,0,0,0,0,0,1,0
