id,text,commercial_use,distribution,modification,private_use,patent_use,trademark_use,disclose_source,license_and_copyright_notice,same_license,state_changes,liability,warranty
82,you will not enter into a settlement with the government as to any portion of the appeal affecting bugsense without bugsenseâs prior written consent,0,0,0,0,0,0,0,0,0,0,0,0
83,if you elect not to appeal a cda dispute such election must be made within thirty 30 days of the governmentâs final decision and you agree to notify bugsense within three 3 days after you elect not to appeal,0,0,0,0,0,0,0,0,0,0,1,0
84,if bugsense elects to pursue appeal of such decision by the contracting officer bugsense will provide written notice of such election to you and the parties will enter into a sponsorship agreement pursuant to which bugsense will have the right to prosecute in your name any and all appeals arising from the governmentâs determination,0,0,0,0,0,0,0,0,0,0,1,0
85,any such appeal brought by bugsense in your name will be at the expense of bugsense provided however that you at your expense will provide bugsense with reasonable assistance in the presentation of such appeal,0,0,0,0,0,0,0,0,0,0,0,0
86,iii if you are the us government as a party to this agreement this agreement will be governed by and interpreted in accordance with the contract disputes act of 1978 as amended 41 usc,0,0,0,0,0,0,0,0,1,0,0,0
87,failure of the parties to reach agreement on any request for equitable adjustment claim appeal or action arising under or relating to this agreement will be a dispute to be resolved in accordance with the clause at 48 cfr 52233 1 which is incorporated in this agreement by reference,0,0,0,0,0,0,0,0,0,0,1,0
88,all notices required or permitted under this agreement will be by email,0,0,0,0,0,0,0,0,0,0,0,0
89,all notices to bugsense will be sent to mobilesupport@splunkcom or to such other email address as we may notice to you from time to time,0,0,0,0,0,0,0,0,0,0,0,0
90,all notices to you will be sent to the email address you provide to bugsense as part of registering and establishing an account with us or to such other email address as you may notice to us from time to time,0,0,0,0,0,0,0,0,0,0,0,0
91,you may not assign delegate or transfer this agreement in whole or in part by agreement operation of law or otherwise,0,0,0,0,0,0,0,0,1,0,0,0
92,bugsense may assign this agreement in whole or in part to i an affiliate ii in connection with an internal reorganization or iii in connection with a merger acquisition sale of all or a portion of bugsenseâs business assets or stock or similar transaction,1,0,0,0,0,0,0,0,1,0,0,0
93,further bugsense may assign its rights to receive payment due as a result of performance of this agreement to a bank trust company or other financing institution including any federal lending agency in accordance with the assignment of claims act 31 usc,0,0,0,0,0,0,0,0,0,0,0,0
94,3727 and may assign this agreement in accordance with the provisions at 48 cfr 4212 as applicable,0,0,0,0,0,0,0,0,0,0,0,0
95,any attempt to assign this agreement other than as permitted herein will be null and void,0,0,0,0,0,0,0,0,0,0,0,0
96,subject to the foregoing this agreement will bind and inure to the benefit of the partiesâ permitted successors and assigns,0,0,0,0,0,0,0,0,0,0,0,0
97,this agreement including any exhibits or schedules hereto and any additional terms incorporated by reference constitutes the complete and exclusive understanding and agreement between the parties and supersedes any and all prior or contemporaneous agreements communications and understandings written or oral relating to their subject matter,0,0,0,0,0,0,0,0,1,0,0,0
98,any waiver modification or amendment of any provision of this agreement will be effective only if in writing and signed by duly authorized representatives of both parties,0,0,0,0,0,0,0,0,0,0,1,0
99,any terms and conditions contained or referenced by either party in a quote purchase order acceptance invoice or any similar document purporting to modify the terms and conditions contained in this agreement are hereby rejected and will be disregarded and have no effect unless otherwise expressly agreed to by the parties in accordance with the preceding sentence,0,1,0,1,0,0,0,0,0,0,0,0
100,this agreement is a binding contract between you and bugsense governing your use of the bugsense sdk however if you and bugsense enter into a separate written agreement that specifically states that it supersedes this agreement in whole or in part such separate written agreement will apply to your use of the bugsense sdk and supersede this agreement to the extent and as set forth in such separate written agreement,0,0,0,1,0,0,0,0,1,0,0,0
