id,text,commercial_use,distribution,modification,private_use,patent_use,trademark_use,disclose_source,license_and_copyright_notice,same_license,state_changes,liability,warranty
1,redistribution and use in source and binary forms with or without modification are permitted provided that the following conditions are met 1,0,1,1,1,0,0,0,0,0,0,0,0
2,redistributions of source code must retain the above copyright notice this list of conditions and the following disclaimer,0,1,0,0,0,0,0,1,0,0,0,0
3,the origin of this software must not be misrepresented you must not claim that you wrote the original software,0,0,0,0,0,0,0,0,0,1,0,0
4,if you use this software in a product an acknowledgment in the product documentation would be appreciated but is not required,0,0,0,0,0,0,0,0,0,0,0,0
5,altered source versions must be plainly marked as such and must not be misrepresented as being the original software,0,0,0,0,0,0,0,0,0,1,0,0
6,the name of the author may not be used to endorse or promote products derived from this software without specific prior written permission,0,0,0,0,0,1,0,0,0,0,0,0
7,this software is provided by the author ``as is and any express or implied warranties including but not limited to the implied warranties of merchantability and fitness for a particular purpose are disclaimed,0,0,0,0,0,0,0,0,0,0,0,1
