id,text,commercial_use,distribution,modification,private_use,patent_use,trademark_use,disclose_source,license_and_copyright_notice,same_license,state_changes,liability,warranty
1,the timer and work manager for application servers specification is being provided by the copyright holders under the following license,0,0,0,0,0,0,0,0,0,0,0,0
2,by using and or copying this work you agree that you have read understood and will comply with the following terms and conditions permission to copy and display the timer and work manager for application servers specification and or portions thereof without modification in any medium without fee or royalty is hereby granted provided that you include the following on all copies of the timer and work manager for application servers specification or portions thereof that you make 1,0,1,1,1,0,0,0,0,0,0,0,0
3,a link or url to the timer and work manager for application servers specification at this location http  dev2devbeacom technologies commonj indexjsp or at this location http  wwwibmcom developerworks library j commonj sdowmt  2,0,0,0,0,0,0,0,0,0,0,0,0
4,the full text of this copyright notice as shown in the timer and work manager for application servers specification,0,0,0,0,0,0,0,1,0,0,0,0
5,ibm and bea collectively the authors agree to grant you a royalty free license under reasonable non discriminatory terms and conditions to patents that they deem necessary to implement the timer and work manager for application servers specification,0,0,0,0,1,0,0,0,0,0,0,0
6,the timer and work manager for application servers specification is provided as is and the authors make no representations or warranties express or implied regarding this specification and the implementation of its contents including but not limited to warranties of merchantability fitness for a particular purpose non infringement or title,0,0,0,0,0,0,0,0,0,0,0,0
7,the authors will not be liable for any direct indirect special incidental or consequential damages arising out of or relating to any use or distribution of the timer and work manager for application servers specification,0,0,0,0,0,0,0,0,0,0,1,0
8,the name and trademarks of the authors may not be used in any manner including advertising or publicity pertaining to the timer and work manager for application servers specification or its contents without specific written prior permission,0,0,0,0,0,1,0,0,0,0,0,0
9,title to copyright in the timer and work manager for application servers specification will at all times remain with the authors,0,0,0,0,0,0,0,0,0,0,0,0
