id,text,commercial_use,distribution,modification,private_use,patent_use,trademark_use,disclose_source,license_and_copyright_notice,same_license,state_changes,liability,warranty
1,this educational community license the license applies to any original work of authorship the original work whose owner the licensor has placed the following notice immediately following the copyright notice for the original work copyright c <year> <copyright holders> licensed under the educational community license version 10 this original work including software source code documents or other related items is being provided by the copyright holders subject to the terms of the educational community license,0,0,0,0,0,0,0,1,0,0,0,0
2,by obtaining using and or copying this original work you agree that you have read understand and will comply with the following terms and conditions of the educational community license permission to use copy modify merge publish distribute and sublicense this original work and its documentation with or without modification for any purpose and without fee or royalty to the copyright holders is hereby granted provided that you include the following on all copies of the original work or portions thereof including modifications or derivatives that you make the full text of the educational community license in a location viewable to users of the redistributed or derivative work,0,1,1,1,0,0,0,1,0,0,0,0
3,any pre existing intellectual property disclaimers notices or terms and conditions,0,0,0,0,0,0,0,0,0,0,0,0
4,notice of any changes or modifications to the original work including the date the changes were made,0,0,1,0,0,0,0,0,0,1,0,0
5,any modifications of the original work must be distributed in such a manner as to avoid any confusion with the original work of the copyright holders,0,0,0,0,0,0,0,0,0,0,0,0
6,the software is provided as is without warranty of any kind express or implied including but not limited to the warranties of merchantability fitness for a particular purpose and noninfringement,0,0,0,0,0,0,0,0,0,0,0,1
7,in no event shall the authors or copyright holders be liable for any claim damages or other liability whether in an action of contract tort or otherwise arising from out of or in connection with the software or the use or other dealings in the software,0,0,0,0,0,0,0,0,0,0,0,1
8,the name and trademarks of copyright holders may not be used in advertising or publicity pertaining to the original or derivative works without specific written prior permission,0,0,0,0,0,1,0,0,0,0,0,0
