id,text,commercial_use,distribution,modification,private_use,patent_use,trademark_use,disclose_source,license_and_copyright_notice,same_license,state_changes,liability,warranty
1,this library is free software you can redistribute it and or modify it under the terms of the gnu general public license as published by the free software foundation either version 2 or at your option any later version,0,1,1,0,0,0,0,0,0,0,0,0
2,this library is distributed in the hope that it will be useful but without any warranty without even the implied warranty of merchantability or fitness for a particular purpose,0,0,0,0,0,0,0,0,0,0,0,1
3,see the gnu general public license for more details,0,0,0,0,0,0,0,0,0,0,0,0
4,you should have received a copy of the gnu general public license along with this library see the file copying,0,0,0,0,0,0,0,0,0,0,0,0
5,if not write to the free software foundation 51 franklin street fifth floor boston ma 02110 1301 usa,0,0,0,0,0,0,0,0,0,0,0,0
6,as a special exception if you create a document which uses this font and embed this font or unaltered portions of this font into the document this font does not by itself cause the resulting document to be covered by the gnu general public license,0,0,0,0,0,0,0,1,0,0,0,0
7,this exception does not however invalidate any other reasons why the document might be covered by the gnu general public license,0,0,0,0,0,0,0,0,0,0,0,0
8,if you modify this font you may extend this exception to your version of the font but you are not obligated to do so,0,0,1,0,0,0,0,0,0,0,0,0
