id,text,commercial_use,distribution,modification,private_use,patent_use,trademark_use,disclose_source,license_and_copyright_notice,same_license,state_changes,liability,warranty
1,permission is hereby granted free of charge to any person obtaining a copy of this software and associated documentation files the âsoftwareâ to deal in the software without restriction including without limitation the rights to use copy modify merge publish distribute sublicense and or sell copies of the software and to permit persons to whom the software is furnished to do so subject to the following conditions the above copyright notice and this permission notice shall be included in all copies or substantial portions of the software,1,1,1,1,0,0,0,1,0,0,0,0
2,no harm the software may not be used by anyone for systems or activities that actively and knowingly endanger harm or otherwise threaten the physical mental economic or general well being of other individuals or groups in violation of the united nations universal declaration of human rights https  wwwunorg en universal declaration human rights ,0,0,0,0,0,0,0,0,0,0,1,0
3,services if the software is used to provide a service to others the licensee shall as a condition of use require those others not to use the service in any way that violates the no harm clause above,0,0,0,0,0,0,0,0,0,0,0,0
4,enforceability if any portion or provision of this license shall to any extent be declared illegal or unenforceable by a court of competent jurisdiction then the remainder of this license or the application of such portion or provision in circumstances other than those as to which it is so declared illegal or unenforceable shall not be affected thereby and each portion and provision of this agreement shall be valid and enforceable to the fullest extent permitted by law,0,1,0,0,0,0,0,0,0,0,0,0
5,the software is provided âas isâ without warranty of any kind express or implied including but not limited to the warranties of merchantability fitness for a particular purpose and noninfringement,0,0,0,0,0,0,0,0,0,0,0,1
6,in no event shall the authors or copyright holders be liable for any claim damages or other liability whether in an action of contract tort or otherwise arising from out of or in connection with the software or the use or other dealings in the software,0,0,0,0,0,0,0,0,0,0,0,1
