id,text,commercial_use,distribution,modification,private_use,patent_use,trademark_use,disclose_source,license_and_copyright_notice,same_license,state_changes,liability,warranty
1,imlib2 license permission is hereby granted free of charge to any person obtaining a copy of this software and associated documentation files the software to deal in the software without restriction including without limitation the rights to use copy modify merge publish distribute sublicense and or sell copies of the software and to permit persons to whom the software is furnished to do so subject to the following conditions the above copyright notice and this permission notice shall be included in all copies of the software and its copyright notices,1,1,1,1,0,0,0,1,0,0,0,0
2,in addition publicly documented acknowledgment must be given that this software has been used if no source code of this software is made available publicly,0,0,0,0,0,0,0,0,0,0,0,0
3,making the source available publicly means including the source for this software with the distribution or a method to get this software via some reasonable mechanism electronic transfer via a network or media as well as making an offer to supply the source on request,0,0,0,0,0,0,1,0,0,0,0,0
4,this copyright notice serves as an offer to supply the source on on request as well,0,0,0,0,0,0,0,0,0,0,0,0
5,instead of this supplying acknowledgments of use of this software in either copyright notices manuals publicity and marketing documents or any documentation provided with any product containing this software,0,0,0,0,0,0,0,1,0,0,0,0
6,this license does not apply to any software that links to the libraries provided by this software statically or dynamically but only to the software provided,0,0,0,0,0,0,0,0,0,0,0,0
7,please see the copying plain for a plain english explanation of this notice and its intent,0,0,0,0,0,0,0,1,0,0,0,0
8,the software is provided as is without warranty of any kind express or implied including but not limited to the warranties of merchantability fitness for a particular purpose and noninfringement,0,0,0,0,0,0,0,0,0,0,0,1
