id,text,commercial_use,distribution,modification,private_use,patent_use,trademark_use,disclose_source,license_and_copyright_notice,same_license,state_changes,liability,warranty
1,permission to use copy modify and distribute this software and its documentation for non commercial or commercial purposes and without fee is hereby granted,1,1,1,1,0,0,0,0,0,0,0,0
2,please note that this software comes with no warranty because the program is licensed free of charge there is no warranty for the program to the extent permitted by applicable law,0,0,0,0,0,0,0,0,0,0,0,1
3,except when otherwise stated in writing the copyright holders and or other parties provide the program as is without warranty of any kind either expressed or implied including but not limited to the implied warranties of merchantability and fitness for a particular purpose,0,0,0,0,0,0,0,0,0,0,0,1
4,the entire risk as to the quality and performance of the program is with you,0,0,0,0,0,0,0,0,0,0,1,0
5,should the program prove defective you assume the cost of all necessary servicing repair or correction,0,0,0,0,0,0,0,0,0,0,0,1
