id,text,commercial_use,distribution,modification,private_use,patent_use,trademark_use,disclose_source,license_and_copyright_notice,same_license,state_changes,liability,warranty
1,this is the linux documentation project ``manifesto last revision 21 september 1998 by michael k johnson copyright and license here is a ``boilerplate license you may apply to your work,0,0,0,0,0,0,0,1,0,0,0,0
2,it has not been reviewed by a lawyer feel free to have your own lawyer review it or your modification of it for its applicability to your own desires,0,0,0,0,0,0,0,0,0,0,1,0
3,remember that in order for your document to be part of the ldp you must allow unlimited reproduction and distribution without fee,0,1,0,0,0,0,0,0,0,0,0,0
4,this manual may be reproduced and distributed in whole or in part without fee subject to the following conditions the copyright notice above and this permission notice must be preserved complete on all complete or partial copies,0,1,0,0,0,0,0,1,0,0,0,0
5,any translation or derived work must be approved by the author in writing before distribution,0,0,0,0,0,0,0,0,0,0,0,0
6,if you distribute this work in part instructions for obtaining the complete version of this manual must be included and a means for obtaining a complete version provided,0,0,0,0,0,0,1,0,0,0,0,0
7,small portions may be reproduced as illustrations for reviews or quotes in other works without this permission notice if proper citation is given,0,0,0,0,0,0,0,1,0,0,0,0
8,exceptions to these rules may be granted for academic purposes write to the author and ask,0,0,0,0,0,0,0,0,0,0,0,0
9,these restrictions are here to protect us as authors not to restrict you as learners and educators,0,0,0,0,0,0,0,0,0,0,0,0
