id,text,commercial_use,distribution,modification,private_use,patent_use,trademark_use,disclose_source,license_and_copyright_notice,same_license,state_changes,liability,warranty
1,redistribution and use of the mame code or any derivative works are permitted provided that the following conditions are met redistributions may not be sold nor may they be used in a commercial product or activity,1,1,0,1,0,0,0,0,0,0,0,0
2,redistributions that are modified from the original source must include the complete source code including the source code for all components used by a binary built from the modified sources,0,1,1,0,0,0,1,0,0,0,0,0
3,however as a special exception the source code distributed need not include anything that is normally distributed in either source or binary form with the major components compiler kernel and so on of the operating system on which the executable runs unless that component itself accompanies the executable,0,1,1,0,0,0,1,0,0,0,0,0
4,redistributions must reproduce the above copyright notice this list of conditions and the following disclaimer in the documentation and or other materials provided with the distribution,0,0,0,0,0,0,0,1,0,0,0,0
5,this software is provided by the copyright holders and contributors as is and any express or implied warranties including but not limited to the implied warranties of merchantability and fitness for a particular purpose are disclaimed,0,0,0,0,0,0,0,0,0,0,0,1
