id,text,commercial_use,distribution,modification,private_use,patent_use,trademark_use,disclose_source,license_and_copyright_notice,same_license,state_changes,liability,warranty
123,the limits of liability in this section apply to the fullest extent permitted by applicable law but do not apply to 1 the partiesâ obligations under section 8 or exhibit a or 2 breach of any confidentiality obligation or violation of the others intellectual property rights,0,0,0,0,0,0,0,0,0,0,1,0
124,we reserve all rights not expressly granted under this agreement and no other rights are granted under this agreement by implication or estoppel or otherwise,0,0,0,1,0,0,0,0,0,0,0,0
125,you must send notices by mail to the address listed for the microsoft contracting entity listed in exhibit a applicable to your primary place of business with a copy to microsoft legal and corporate affairs developer division one microsoft way redmond wa 98052 usa you agree to receive electronic notices from us related to the services which will be sent by email to your specified end user or administrator contact information or presented to you in the service experience,0,0,0,0,0,0,0,0,0,0,0,0
126,notices are effective on the date on the return receipt for mail the date sent for email and the date presented if within the service experience,0,0,0,0,0,0,0,0,0,0,0,0
127,you may not assign this agreement either in whole or in part,0,0,0,0,0,0,0,0,0,0,0,0
128,if any part of this agreement is held unenforceable the rest remains in full force and effect,0,0,0,1,0,0,0,0,0,0,0,0
129,failure to enforce any provision of this agreement will not constitute a waiver,0,0,0,0,0,0,0,0,0,0,0,0
130,this agreement does not create an agency partnership or joint venture,0,0,0,0,0,0,0,0,0,0,0,0
131,there are no third party beneficiaries to this agreement,0,0,0,0,0,0,0,0,0,0,0,0
132,the choice of law and venue applicable to the geography of your primary place of business is listed in exhibit a,0,0,0,0,0,0,0,0,0,0,0,0
133,this agreement is the entire agreement concerning its subject matter and supersedes any prior or concurrent communications,0,0,0,0,0,0,0,0,0,0,1,0
134,additional terms applicable to this agreement based on the geography of your primary place of business are listed in exhibit a,0,0,0,0,0,0,0,0,0,0,0,0
135,the following provisions will survive this agreementâs termination 1b 2a b 4 5a d 5f g 6 7 8 9 10 11 exhibit a and all other definitions,0,0,0,0,0,0,0,0,0,0,0,0
136,you must comply with all applicable laws including the us,0,0,0,0,0,0,0,0,0,0,0,0
137,export administration regulations the international traffic in arms regulations and end user end use and destination restrictions issued by us and other governments,0,0,0,0,0,0,0,0,0,0,0,0
138,availability of the services including specific features and language versions varies by country,0,0,0,0,0,0,0,0,0,0,0,0
139,you will defend us against any claim that arises from 1 any aspect of the current or former employment relationship between you and any of your current or former personnel or contractors or under any collective agreements including without limitation claims for wrongful termination breach of express or implied employment contracts or payment of benefits or wages unfair dismissal costs or redundancy costs or 2 any obligations or liabilities whatsoever arising under the acquired rights directive council directive 2001 23 ec formerly council directive 77 187 ec as amended by council directive 98 50 ec or any national laws or regulations implementing the same or similar laws or regulations including the transfer of undertakings protection of employment regulations 2006 in the united kingdom including a claim from your current or former personnel or contractors including a claim in connection with the termination of their employment by us following any transfer of their employment to us pursuant to such laws or regulations,0,0,0,0,0,0,0,0,0,0,0,0
140,you must pay the amount of any resulting adverse final judgment or settlement to which you consent,0,0,0,0,0,0,0,0,0,0,1,0
141,this section provides our exclusive remedy for these claims,0,0,0,0,0,0,0,0,0,0,0,0
142,we will notify you promptly in writing of a claim subject to this section,0,0,0,0,0,0,0,0,0,0,0,0
143,we must 1 give you sole control over the defense or settlement of such claim and 2 provide reasonable assistance in defending the claim,0,0,0,0,0,0,0,0,0,0,0,0
144,you will reimburse us for reasonable out of pocket expenses that we incur in providing assistance,0,0,0,0,0,0,0,0,0,0,1,0
145,neither party will be liable for any failure in performance due to causes beyond its reasonable control such as fire explosion power blackout earthquake flood severe storms strike embargo labor disputes acts of civil or military authority war terrorism including cyber terrorism acts of god acts or omissions of internet traffic carriers actions or omissions of regulatory or governmental bodies including the passage of laws or regulations or other acts of government that impact the delivery of services,0,0,0,0,0,0,0,0,0,0,1,0
146,we may modify this agreement at any time with or without individual notice to you by posting a revised version on the legal information section of the developer services and documentation portals or an alternate site we identify or by notifying you in accordance with section 10b,0,0,0,0,0,0,0,0,0,0,0,0
147,any modifications will be effective upon your continued use of a service,0,0,0,0,0,0,0,0,0,0,0,0
148,notices and procedure for making claims of copyright infringement,0,0,0,0,0,0,0,0,0,0,0,0
149,pursuant to title 17 united states code section 512c2 notifications of claimed copyright infringement should be sent to our designated agent,0,0,0,0,0,1,0,0,0,0,0,0
150,all inquiries not relevant to the following procedure will not receive a response,0,0,0,0,0,0,0,0,0,0,0,0
151,see notice and procedure for making claims of copyright infringement  http  wwwmicrosoftcom info cpyrtinfrghtm,0,0,0,0,0,0,0,0,0,0,0,0
152,exhibit a customer location agreement addendum the microsoft entity entering into this agreement the applicable microsoft entity contact information the controlling law and venue and additional terms governing this agreement with you are indicated in the table below for the country or region of your primary place of business,0,0,0,0,0,0,0,0,0,0,0,0
153,if your primary place of business is in africa europe or the middle east then these terms apply to our agreement,0,0,0,0,0,0,0,0,0,0,0,0
154,microsoft entity and contact information	applicable law and venue	additional terms microsoft ireland operations limited the atrium block b carmenhall road sandyford industrial estate dublin 18 ireland	this agreement is governed by the laws of ireland without regard to its conflict of laws principles except that 1 if you are a us government entity this agreement is governed by the laws of the united states and 2 if you are a state or local government entity in the united states this agreement is governed by the laws of that state,0,0,0,0,0,0,0,0,1,0,0,0
155,if we bring an action to enforce this agreement we will bring it in the jurisdiction where you have your headquarters,0,0,0,0,0,0,0,0,0,0,1,0
156,if you bring an action to enforce this agreement you will bring it in ireland,0,0,0,0,0,0,0,0,0,0,1,0
157,this choice of jurisdiction does not prevent either party from seeking injunctive relief in any appropriate jurisdiction with respect to violation of intellectual property rights,0,0,0,0,0,0,0,0,0,0,1,0
158,if your primary place of business is in american samoa australia bangladesh bhutan brunei darussalam cambodia east timor hong kong sar india indonesia lao peoples democratic republic macau sar malaysia maldives nepal new zealand peopleâs republic of china philippines republic of korea samoa singapore sri lanka thailand vanuatu or vietnam then these terms apply to our agreement,0,0,0,0,0,0,0,0,0,0,0,0
159,microsoft entity and contact information	applicable law and venue	additional terms microsoft regional sales corporation 438b alexandra road #04 09 12 block b alexandra technopark singapore 119968	 this agreement is governed by state of washington law without regard to its conflict of laws principles,0,0,0,0,0,0,0,0,0,0,0,0
160,subject to sections i and ii below if we bring an action to enforce this agreement we will bring it in the jurisdiction where you have your headquarters,0,0,0,0,0,0,0,0,0,0,1,0
161,if you bring an action to enforce this agreement you will bring it in the state of washington usa,0,0,0,0,0,0,0,0,0,0,0,0
162,this choice of jurisdiction does not prevent either party from seeking injunctive relief with respect to a violation of intellectual property rights,0,0,0,0,0,0,0,0,0,0,1,0
163,if your principal place of business is in brunei malaysia or singapore you consent to the non exclusive jurisdiction of the singapore courts,0,0,0,0,0,0,0,0,0,0,0,0
164,if your principal place of business is in bangladesh cambodia india indonesia macau sar the peoples republic of china sri lanka thailand the philippines or vietnam any dispute arising out of or in connection with this agreement including any question regarding its existence validity or termination shall be referred to and finally resolved by arbitration in singapore in accordance with the arbitration rules of the singapore international arbitration centre siac which rules are deemed to be incorporated by reference into this subsection,0,0,0,0,0,0,0,0,0,0,1,0
165,the tribunal shall consist of one arbitrator to be appointed by the chairman of siac,0,0,0,0,0,0,0,0,0,0,0,0
166,the decision of the arbitrator shall be final binding and incontestable and may be used as a basis for judgment thereon in the above named countries or elsewhere,0,0,0,0,0,0,0,0,0,0,1,0
167,to the maximum extent permitted by applicable law the parties waive their right to any form of appeal or other similar recourse to a court of law,0,0,0,0,0,0,0,0,0,0,0,0
168,for the purpose of this agreement only the peoples republic of china does not include hong kong sar macau sar and taiwan,0,0,0,0,0,0,0,0,0,0,0,0
169,the parties agree that this agreement be written and executed in english and that in the event this agreement is translated into bahasa indonesia to comply with the implementing regulations of indonesian law no,0,0,0,1,0,0,0,0,0,0,0,0
170,24 2009 the english language version of this agreement controls,0,0,0,1,0,0,0,0,0,0,0,0
171,if your primary place of business is in north america south america or all remaining regions and countries not included in the above and where the services are lawfully available then these terms apply to our agreement,0,1,0,0,0,0,0,0,0,0,0,0
172,microsoft entity and contact information	applicable law and venue	additional terms microsoft corporation one microsoft way redmond wa 98052 ãtats unis	this agreement is governed by state of washington law without regard to its conflict of laws principles,0,0,0,0,0,0,0,0,0,0,0,0
173,any action to enforce this agreement must be brought in the state of washington,0,0,0,0,0,0,0,0,0,0,1,0
174,this choice of jurisdiction does not prevent either party from seeking injunctive relief in any appropriate jurisdiction with respect to violation of intellectual property rights,0,0,0,0,0,0,0,0,0,0,1,0
175,grant of rights a copyright grant   subject to the terms of this license including the license conditions and limitations in section 3 each contributor grants you a non exclusive worldwide royalty free copyright license to reproduce its contribution prepare derivative works of its contribution and distribute its contribution or any derivative works that you create,0,1,0,0,0,0,0,0,0,0,0,0
176,b patent grant   subject to the terms of this license including the license conditions and limitations in section 3 each contributor grants you a non exclusive worldwide royalty free license under its licensed patents to make have made use sell offer for sale import and or otherwise dispose of its contribution in the software or derivative works of the contribution in the software,1,0,0,0,1,0,0,0,0,0,0,0
177,conditions and limitations a no trademark license  this license does not grant you rights to use any contributorsâ name logo or trademarks,0,0,0,0,0,1,0,0,0,0,0,0
178,b if you bring a patent claim against any contributor over patents that you claim are infringed by the software your patent license from such contributor to the software ends automatically,0,0,0,0,1,0,0,0,0,0,0,0
179,c if you distribute any portion of the software you must retain all copyright patent trademark and attribution notices that are present in the software,0,0,0,0,0,0,0,1,0,0,0,0
180,d if you distribute any portion of the software in source code form you may do so only under this license by including a complete copy of this license with your distribution,0,0,0,0,0,0,0,1,0,0,0,0
181,if you distribute any portion of the software in compiled or object code form you may only do so under a license that complies with this license,0,0,0,0,0,0,0,0,1,0,0,0
182,the contributors give no express warranties guarantees or conditions,0,0,0,0,0,0,0,0,0,0,0,1
183,you may have additional consumer rights under your local laws which this license cannot change,0,0,0,0,0,0,0,0,0,0,0,0
184,to the extent permitted under your local laws the contributors exclude the implied warranties of merchantability fitness for a particular purpose and non infringement,0,0,0,0,0,0,0,0,0,0,0,0
