id,text,commercial_use,distribution,modification,private_use,patent_use,trademark_use,disclose_source,license_and_copyright_notice,same_license,state_changes,liability,warranty
1,this agreement is between you or the entity you represent and the microsoft entity listed in exhibit a and consists of the terms below exhibit a exhibit b the slas offer details for any service as published on the date of a service purchase or renewal terms incorporated by reference terms applicable to other microsoft web sites and services that you use and are necessary to use the services for example your microsoft account and the privacy statement together the agreement,0,0,0,1,0,0,0,0,0,0,0,0
2,if you are entering into this agreement on behalf of an entity such as your employer you represent that you have the legal authority to bind that entity,0,0,0,0,0,0,0,0,0,0,0,0
3,if you specify a company name in connection with signing up for or ordering a service you will be deemed to have placed that order and to have entered into this agreement on behalf of that organization or company,0,0,0,0,0,0,0,0,0,0,0,0
4,in addition if you are a windows azure customer this agreement supplements your existing windows azure agreement and governs to the extent of any conflict with the windows azure terms except that the windows azure billing terms will continue to apply,0,0,0,0,0,0,0,0,1,0,0,0
5,we grant you the right to access and use the services in accordance with this agreement,0,0,0,0,0,0,0,0,0,0,0,0
6,each user of the visual studio online portion of the developer services must be allocated an individual user plan whether they access the service directly or indirectly,0,0,0,0,0,0,0,0,0,0,0,0
7,you may not reverse engineer decompile disassemble or work around technical limitations in the services except to the extent that applicable law permits it despite these limitations disable tamper with or otherwise attempt to circumvent any mechanism that limits your use of the services rent lease lend resell transfer or sublicense any services or portion thereof to or for third parties except as explicitly permitted herein or in license terms that accompany any services component use the services for any purpose that is unlawful or prohibited by this agreement or use the services in any manner that could damage disable overburden or impair any microsoft service or the networks connected to any microsoft service or interfere with any other partyâs use and enjoyment of any services,1,0,0,1,0,0,0,0,0,0,0,0
8,we may make changes to the services from time to time including the availability of features how long how much or how often any given feature may be used and feature dependencies upon other services or software,0,0,0,0,0,0,0,0,0,0,0,0
9,we will provide you with prior notice before removing any material feature or functionality of the developer services excluding previews unless security legal or system performance considerations require an expedited removal,0,0,0,0,0,0,0,0,0,0,0,0
10,we may make features available on a preview basis,0,0,0,0,0,0,0,0,0,0,0,0
11,previews are provided as is and are excluded from the slas and warranties in section 7 below,0,0,0,0,0,0,0,0,0,0,0,1
12,previews may be subject to reduced or different security compliance privacy availability reliability and support commitments as further explained in the privacy statement and any additional notices provided with the preview,0,0,0,0,0,0,0,0,0,0,0,0
13,we may change or discontinue previews at any time without notice,0,0,0,0,0,0,0,0,0,0,0,0
14,we also may choose not to release a preview into general availability and if we do make previews generally available we may charge for any such features,0,0,0,0,0,0,0,0,0,0,0,0
15,microsoft may provide you with microsoft software through or as a part of the developer services,0,0,0,0,0,0,0,0,0,0,0,0
16,termination of use of or access to the developer services or the termination of this agreement terminates your right to possess or use any such microsoft software and the suspension or termination of a user plan terminates that userâs right to possess or use any such microsoft software that was acquired through is attached to or otherwise requires that user plan,0,0,0,0,0,0,0,0,0,0,0,0
17,you must delete all copies of such microsoft software licensed under this agreement and destroy any associated media upon the termination of the associated possession or usage rights,0,0,0,0,0,0,0,0,0,0,0,0
18,microsoft may provide you with microsoft software for use outside the developer services and with 1 the developer services or 2 programs you develop using the developer services,1,0,0,0,0,0,0,0,0,0,0,0
19,if the microsoft software is provided with its own license terms those terms control as modified by the foregoing,0,0,0,0,0,0,0,0,1,0,0,0
20,if the microsoft software does not have its own license terms then you may install and use any number of copies of the microsoft software to design develop and test your programs on devices,0,0,0,0,0,0,0,0,0,0,0,0
21,this subsection does not apply to microsoft software addressed in subsection b below,0,0,0,0,0,0,0,0,0,0,0,0
22,software on documentation portalssoftware accessible on the documentation portals is made available by the designated publisher under the associated license terms,0,0,0,0,0,0,0,0,0,0,0,0
23,if software is accessible on the documentation portals without license terms then subject subsection c below you may use it to design develop and test your programs,0,0,0,0,0,0,0,0,0,0,0,0
24,if any such software without license terms is marked as sample or example then you may use it under the terms of the microsoft limited public license,0,0,0,0,0,0,0,0,0,0,0,0
25,all microsoft software are the copyrighted works of microsoft or its suppliers,0,0,1,0,0,0,0,0,0,0,0,0
26,all microsoft software are licensed not sold and may not be transferred unless specified otherwise in any license terms provided with the microsoft software,0,0,0,0,0,0,0,0,1,0,0,0
27,rights to access microsoft software on any device do not give you any right to implement microsoft patents or other microsoft intellectual property in software or devices that access that device,0,0,0,0,0,0,0,0,0,0,0,0
28,you are solely responsible for any third party software that you install connect or use with any service,1,0,0,0,0,0,0,0,0,0,0,0
29,we will not run or make any copies of such third party software outside of our relationship with you,0,0,0,0,0,0,0,0,0,0,0,0
30,you may only install or use any third party software with any service in a way that does not subject our intellectual property or technology to any terms governing such software,0,0,0,0,0,0,0,0,0,0,0,0
31,we are not a party to and are not bound by any terms governing your use of any third party software,0,0,0,0,0,0,0,0,0,0,0,0
32,we do not grant any licenses or rights express or implied to such third party software,0,0,0,0,0,0,0,0,0,0,0,0
33,if the service uses or distributes any third party software with open source software license terms open source then such open source is licensed to you by microsoft solely to allow you to interact with the service under terms of this agreement,0,0,0,0,0,0,0,0,0,0,0,0
34,copies of those applicable open source licenses and any other notices if any are included for your information only,0,0,0,0,0,0,0,0,0,0,0,0
35,microsoft will not assert any of its patent rights on account of your products calling application programming interfaces that it publishes on the documentation portals apis in order to receive services from the microsoft product that exposes the apis,0,0,0,0,0,0,0,0,0,0,0,0
36,all microsoft content is the copyrighted work of microsoft or its suppliers and is governed by the terms of the license agreement that accompanies or is included with the microsoft content,0,0,0,0,0,0,0,0,0,0,0,0
37,if the microsoft content does not include a license agreement then you may make a reasonable number of copies of the microsoft content for your internal use in designing developing and testing your software products and services that is made available to you on the documentation portals without a license agreement,0,0,0,0,0,0,0,0,0,0,0,0
38,you must preserve the copyright notice in all copies of the microsoft content and ensure that both the copyright notice and this permission notice appear in those copies,0,1,0,0,0,0,0,1,0,0,0,0
39,accredited educational institutions such as k 12 schools universities and private or public colleges may download and reproduce microsoft content for distribution in the classroom for educational purposes,1,1,1,0,0,0,0,0,0,0,0,0
40,we maintain technical and organizational measures internal controls and data security routines intended to protect customer data against accidental loss or change unauthorized disclosure or access or unlawful destruction,0,0,0,0,0,0,0,0,0,0,1,0
41,we treat customer data in accordance with the terms herein and our privacy statement,0,0,0,0,0,0,0,0,0,0,0,0
42,we may transfer to store and process customer data in the united states or in any country where we or our affiliates or subcontractors have facilities used for developer services,0,0,0,0,0,0,0,0,0,0,0,0
43,you will obtain any necessary consent or rights from end users or others whose data or personal information or other data you will be hosting in the services,0,0,0,0,0,0,0,0,0,0,0,0
44,you must have and you hereby grant us sufficient rights to use and distribute customer data including customer data sourced from third parties necessary for us to provide you the developer services without violating the rights of any third party or otherwise obligating microsoft to you or to any third party,0,0,0,0,0,0,0,0,0,0,0,0
45,we do not assume any additional obligations that may apply to customer data except as required by applicable law,0,0,0,0,0,0,0,0,0,0,0,0
46,except for software and content we license to you as between the parties you retain all right title and interest in and to customer data,0,1,0,0,0,0,0,0,0,0,0,0
47,we acquire no rights in customer data other than as described in this section 4,0,0,0,0,0,0,0,0,0,0,0,0
48,we will use customer data to provide the services,0,0,0,0,0,0,0,0,0,0,0,0
49,this use may include troubleshooting to prevent find and fix problems with the operation of the services and ensuring compliance with this agreement,0,0,0,0,0,0,0,0,0,0,0,0
50,it may also include providing you with suggestions to help you discover and use functionality within the services improving the features of our services and otherwise use patterns trends and other statistical data derived from customer data to provide operate maintain and improve our products and services,0,0,0,0,1,0,0,0,0,0,0,0
51,we will not use customer data or derive information from it for any 1 advertising or 2 other commercial purposes beyond providing you with the services without your consent,1,0,0,0,0,0,0,0,0,0,0,0
52,you may delete your customer data at any time,0,0,0,0,0,0,0,0,0,0,0,0
53,if you terminate your account we may delete customer data immediately without any retention period,0,0,0,0,0,0,0,0,0,0,0,0
54,we have no additional obligation to continue to hold export or return customer data and have no liability whatsoever for deletion of customer data pursuant to this agreement,0,0,0,0,0,0,0,0,0,0,0,0
55,the developer services may have features that incur additional charges or are only available at a specific paid for service feature tier,0,0,0,0,0,0,0,0,0,0,0,0
56,if your account is in arrears or is downgraded to a lesser service feature tier your customer data will be preserved but certain features necessary to access that customer data may be inaccessible,0,0,0,0,0,0,0,0,0,0,0,0
57,we will not disclose customer data to a third party including law enforcement other government entity or civil litigant but excluding our subcontractors except as you direct or unless required by law,0,0,0,0,0,0,0,0,0,0,0,0
58,we will ask any third party demanding access to your customer data to contact you directly using your basic contact information,0,0,0,0,0,0,0,0,0,0,0,0
59,we will promptly notify you and provide a copy of the demand unless legally prohibited,0,0,0,0,0,0,0,0,0,0,0,0
60,you are responsible for responding to requests by a third party regarding your use of services,0,0,0,0,0,0,0,0,0,0,0,0
61,we may hire other companies to provide limited services on our behalf such as customer support,0,0,0,0,1,0,0,0,0,0,0,0
62,any such subcontractors will be permitted to obtain customer data only to deliver the services we have retained them to provide,0,0,0,0,1,0,0,0,0,0,0,0
63,we remain responsible for our subcontractorsâ compliance with the obligations set forth in this agreement,0,0,0,0,0,0,0,0,0,0,1,0
64,we will comply with all laws applicable to our provision of the services including applicable security breach notification laws but not including any laws applicable to you or your industry that are not generally applicable to information technology services providers,0,0,0,0,0,0,0,0,0,0,0,0
65,you will comply with all laws applicable to your customer data and use of the services including any laws applicable to you or your industry,0,0,0,0,0,0,0,0,0,0,0,0
66,the developer services shall be subject to any security privacy and compliance practices specifically described for the developer services at the developer services portal,0,0,0,0,0,0,0,0,0,0,0,0
67,these obligations do not apply to any other elements of the services,0,0,0,0,0,0,0,0,0,0,0,0
68,we will inform you if we receive notice claiming that your usage of the service infringes a third partyâs intellectual property rights and in such instances we may provide your basic contact information to the third party,0,0,0,0,0,0,0,0,0,0,0,0
69,if any of the services requires you to open an account you must complete the registration process by providing us with current complete and accurate information,0,0,0,0,0,0,0,0,0,0,0,0
70,you may not select an account user name or identifier that impersonates someone else is or may be illegal or may be protected by trademark or other proprietary rights is vulgar or offensive or may cause confusion,0,0,0,0,0,0,0,0,0,0,0,0
71,we reserve the right to reject and or reassign these user names and service identifiers in our sole discretion,0,0,0,0,0,0,0,0,0,0,0,0
72,you are responsible for any and all activities that occur under your account maintaining the confidentiality of any non public authentication credentials associated with your use of the services and promptly notifying our customer support team about any possible misuse of your accounts or authentication credentials or any security incident related to the services,0,0,0,0,0,0,0,0,0,0,0,0
73,your conduct and the availability of third party content and links to third party content,0,0,0,0,0,0,0,0,0,0,0,0
74,for any public community interaction you undertake on the services you must follow the rules of conduct,0,0,0,0,0,0,0,0,0,0,0,0
75,we have no obligation to monitor the content and communications of third parties on the services however we reserve the right to review and remove any such materials posted to the documentation portals in our sole discretion,0,0,0,0,0,0,0,0,0,0,0,0
76,third parties that participate on the services are not authorized microsoft spokespersons and their views do not necessarily reflect those of microsoft,0,1,1,0,0,0,0,0,0,0,0,0
77,we may provide services that supplement microsoft software and rely upon your user account or other identity mechanism,0,0,0,0,0,0,0,0,0,0,0,0
78,we may use this information to identify you and authorize access to microsoft content microsoft software and other resources across the services,0,1,1,0,0,0,0,0,0,0,0,0
79,we do not claim ownership of any submission unless otherwise agreed to by the parties,0,0,0,0,0,0,0,0,0,0,0,0
80,however by providing a submission you are irrevocably granting microsoft and its affiliates the right to make use modify distribute and otherwise commercialize the submission in any way and for any purpose including by granting the general public the right to use your submissions in accordance with this agreement which may change over time,0,1,1,1,0,0,0,0,0,0,0,0
81,for submissions provided to the documentation portals you further grant the right to publish specific identifying information detailed in the privacy statement in connection with your submission,0,0,0,0,0,0,1,0,0,0,0,0
82,these rights are granted under all applicable intellectual property rights you own or control,0,0,0,0,0,0,0,0,0,0,0,0
83,no compensation will be paid with respect to the use of your submissions,0,0,0,0,0,0,0,0,0,0,0,0
84,microsoft is under no obligation to post or use any submission and microsoft may remove any submission at any time,0,0,0,0,0,0,0,0,0,0,0,0
85,by providing a submission you warrant that you own or otherwise control all of the rights to your submission and that your submission is not subject to any rights of a third party including any personality or publicity rights of any person,0,0,0,0,0,0,0,0,0,0,0,0
86,elements of the services may be accessible to you on an invitation only basis for example as part of a program for using pre release services and providing feedback to us eg through the connect portal,0,0,0,0,0,0,0,0,0,0,0,0
87,you may not disclose this confidential information to any third party for a period of five years,0,0,0,0,0,0,0,0,0,0,0,0
88,this restriction does not apply to any information that is or becomes publicly available without a breach of this restriction was lawfully known to the receiver of the information without an obligation to keep it confidential is received from another source who can disclose it lawfully and without an obligation to keep it confidential or is independently developed,0,1,0,0,0,0,0,0,0,0,0,0
89,you may disclose this confidential information if required to comply with a court order or other government demand that has the force of law,0,0,0,0,0,0,0,0,0,0,0,0
90,before doing so you must seek the highest level of protection available and when possible give us enough prior notice to provide a reasonable chance to seek a protective order,0,0,0,0,0,0,0,0,0,0,0,0
91,if you have purchased access to developer services through windows azure then you must pay any amounts due and owing,0,0,0,0,0,0,0,0,0,0,0,0
92,in any country where any current or future government regulation or requirement that applies to us but not generally to businesses operating there presents a hardship to us operating the services without change and or causes us to believe this agreement or the services may be in conflict with any such regulation or requirement we may change the services or terminate the agreement,0,0,0,0,0,0,0,0,1,0,0,0
93,your sole remedy for such changes to the services under this section is to terminate this agreement,0,0,0,0,0,0,0,0,0,0,0,0
94,we may suspend your use of the services if 1 reasonably needed to prevent unauthorized access to customer data 2 you fail to respond to a claim of alleged infringement under sections 4k or 8 within a reasonable time or 3 you violate this agreement,0,0,0,0,0,0,0,0,0,0,0,0
95,we will attempt to suspend access to the minimum necessary part of the services while the condition or need exists,0,0,0,0,0,0,0,0,0,0,0,0
96,we will give notice before we suspend except where we reasonably believe we need to suspend immediately,0,0,0,0,0,0,0,0,0,0,1,0
97,if you do not fully address the reasons for the suspension within 60 days after we suspend we may terminate this agreement and delete your customer data without any retention period,0,0,0,0,0,0,0,0,0,0,0,0
98,we may also terminate your account if your use of the developer services is suspended more than twice in any 12 month period,0,0,0,0,0,0,0,0,0,0,0,0
99,we may suspend or terminate a service account after a prolonged period of inactivity,0,0,0,0,0,0,0,0,0,0,0,0
100,for developer services if you have a free account we may terminate this agreement and or delete any customer data automatically generated during the developer services sign up process if you fail to upload or create any customer data within 90 days of your initial provisioning of the developer service,0,0,0,0,0,0,0,0,1,0,0,0
101,we will provide you with notice prior to any account suspension or termination or customer data deletion,0,0,0,0,0,0,0,0,0,0,0,0
102,we reserve the right to terminate your access to the documentation portals at any time without notice for any reason whatsoever,0,0,0,0,0,0,0,0,0,0,0,0
103,if you are a windows azure customer who has purchased access to the developer services then we warrant that the developer services will satisfy the sla during the term for the paid for portion of the developer services,0,0,0,0,0,0,0,0,0,0,0,0
104,your only remedies for breach of this limited warranty are those in the sla,0,0,0,0,0,0,0,0,0,0,0,1
105,this warranty is subject to the following limitations any implied warranties guarantees or conditions not able to be disclaimed as a matter of law will last one year from the start of the limited warranty this limited warranty does not cover problems caused by accident abuse or use of the developer services in a manner inconsistent with this agreement or our published documentation or guidance or resulting from events beyond our reasonable control this limited warranty does not apply to problems caused by the failure to meet minimum system requirements and this limited warranty does not apply to previews or free offerings,0,0,0,0,0,0,0,0,0,0,0,1
106,other than this warranty or except as warranted in a separate agreement microsoft and its respective suppliers provide the services including the content and apis as is with all faults and as available,0,0,0,0,0,0,0,0,1,0,0,0
107,we provide no warranties guarantees or conditions whether express implied statutory or otherwise including warranties of merchantability fitness for a particular purpose and non infringement,0,0,0,0,0,0,0,0,0,0,0,1
108,you may have additional rights under your local laws which this agreement cannot change,0,0,0,0,0,0,0,0,0,0,0,0
109,these disclaimers will apply to the fullest extent permitted under applicable law including application to the implied warranties of merchantability fitness for a particular purpose and non infringement,0,0,0,0,0,0,0,0,0,0,0,0
110,microsoft does not control review revise endorse or accept responsibility for any third party content information messages materials projects accessible from or linked through the services and except as warranted in a separate agreement microsoft makes no representations or warranties whatsoever about and shall not be responsible for any of the foregoing,0,0,0,0,0,0,0,0,0,0,0,0
111,any dealings you may have with such third parties are at your own risk,0,0,0,0,0,0,0,0,0,0,0,0
112,we will defend you against any claims made by an unaffiliated third party that the developer services or developer services software infringe its patent copyright or trademark or makes unlawful use of its trade secret,0,0,0,0,1,0,0,0,0,0,0,0
113,you will defend us against any claims made by an unaffiliated third party that any 1 non microsoft product that is not made available through the developer services or developer services software or 2 customer data you provide directly or indirectly in using the services infringe the third partyâs patent copyright or trademark or makes unlawful use of its trade secret,0,0,0,0,0,0,0,0,0,0,0,0
114,our obligations in section 8a will not apply to a claim or award based on 1 customer data non microsoft product modifications you make to the services or materials you provide or make available as part of using the services 2 your combination of the services with or damages based upon the value of a non microsoft product data or business process 3 your use of a microsoft trademark without our express written consent or your use of the services after we notify you to stop due to a third party claim or 4 your redistribution of the services to or use for the benefit of any unaffiliated third party,0,0,0,0,0,0,0,0,0,0,0,0
115,if we reasonably believe that a claim under section 8a may bar your use of the developer services or developer services software we will seek to 1 obtain the right for you to keep using it or 2 modify or replace it with a functional equivalent,0,0,0,0,0,0,0,0,0,0,0,0
116,if these options are not commercially reasonable we may terminate your rights to use the developer services or developer services software,0,0,0,0,0,0,0,0,0,0,0,0
117,each party must notify the other promptly of a claim under this section 8,0,0,0,0,0,0,0,0,0,0,0,0
118,the party seeking protection must 1 give the other sole control over the defense and settlement of the claim and 2 give reasonable help in defending the claim,0,0,0,0,0,0,0,0,0,0,0,0
119,the party providing the protection will 1 reimburse the other for reasonable out of pocket expenses that it incurs in giving that help and 2 pay the amount of any resulting adverse final judgment or settlement that the other consents to,0,0,0,0,0,0,0,0,0,0,1,0
120,the partiesâ respective rights to defense and payment of judgments or settlements under this section are in lieu of any common law or statutory indemnification rights or analogous rights and each party waives such common law rights,0,0,0,0,0,0,0,0,0,0,0,0
121,the aggregate liability of each party under this agreement is limited to direct damages up to the amount paid under this agreement for the developer services giving rise to that liability during the 12 months before the liability arose or for services provided free of charge five hundred united states dollars $50000 usd,0,0,0,0,0,0,0,0,0,0,1,0
122,neither party nor its suppliers will be liable for loss of revenue lost profits or indirect special incidental consequential punitive or exemplary damages even if the party knew they were possible,0,0,0,0,0,0,0,0,0,0,1,0
