id,text,commercial_use,distribution,modification,private_use,patent_use,trademark_use,disclose_source,license_and_copyright_notice,same_license,state_changes,liability,warranty
1,copyright â© 2004 national ict australia ltd all rights reserved,0,0,0,0,0,0,0,0,0,0,0,0
2,by this licence national ict australia ltd nicta grants permission free of charge to any person who obtains a copy of this software and any associated documentation files the software to use and deal with the software in source code and binary forms without restriction with or without modification and to permit persons to whom the software is furnished to do so provided that the following conditions are met   redistributions of source code must retain the above copyright notice this list of conditions and the following disclaimers,0,1,1,1,0,0,0,1,0,0,0,0
3,  redistributions in binary form must reproduce the above copyright notice this list of conditions and the following disclaimers in the documentation and or other materials provided with the distribution,0,1,0,0,0,0,0,1,0,0,0,0
4,  the name of nicta may not be used to endorse or promote products derived from this software without specific prior written permission,0,0,0,0,0,1,0,0,0,0,0,0
5,except as expressly stated in this licence and to the full extent permitted by applicable law the software is provided as is and nicta makes no representations warranties or conditions of any kind express or implied including without limitation any representations warranties or conditions regarding the contents or accuracy of the software or of title merchantability fitness for a particular purpose noninfringement the absence of latent or other defects or the presence or absence of errors whether or not discoverable,0,0,0,0,0,0,0,0,0,0,0,1
6,to the full extent permitted by applicable law in no event will nicta be liable on any legal theory including without limitation negligence for any loss or damage whatsoever including without limitation loss of production or operation time loss damage or corruption of data or records or loss of anticipated savings opportunity revenue profit or goodwill or other economic loss or any special incidental indirect consequential punitive or exemplary damages arising out of or in connection with this licence the software or the use of the software even if nicta has been advised of the possibility of such damages,0,0,0,0,0,0,0,0,0,0,1,0
7,if applicable legislation implies warranties or conditions or imposes obligations or liability on nicta in respect of the software that cannot be wholly or partly excluded restricted or modified nictas liability is limited to the full extent permitted by the applicable legislation at its option to a in the case of goods any one or more of the following i the replacement of the goods or the supply of equivalent goods ii,0,0,0,0,0,0,0,0,0,0,0,0
8,the payment of the cost of replacing the goods or of acquiring equivalent goods iv,0,0,0,0,0,0,0,0,0,0,0,0
9,the payment of the cost of having the goods repaired or b in the case of services i the supplying of the services again or ii,0,0,0,0,0,0,0,0,0,0,0,0
