id,text,commercial_use,distribution,modification,private_use,patent_use,trademark_use,disclose_source,license_and_copyright_notice,same_license,state_changes,liability,warranty
1,permission to use copy modify distribute and sublicense this software and its documentation for any purpose and without fee is hereby granted provided that the above copyright notices appear in all copies and that both those copyright notices and this permission notice appear in supporting documentation and that the name of adobe systems incorporated not be used in advertising or publicity pertaining to distribution of the software without specific written prior permission,0,1,1,1,0,0,0,1,0,0,0,0
2,no trademark license to use the adobe trademarks is hereby granted,0,0,0,0,0,1,0,0,0,0,0,0
3,if the adobe trademark display postscripttm is used to describe this software its functionality or for any other purpose such use shall be limited to a statement that this software works in conjunction with the display postscript system,0,0,0,1,0,0,0,0,0,0,0,0
4,proper trademark attribution to reflect adobes ownership of the trademark shall be given whenever any such reference to the display postscript system is made,0,0,0,0,0,0,0,0,0,0,0,0
5,adobe makes no representations about the suitability of the software for any purpose,0,0,0,0,0,0,0,0,0,0,0,0
6,it is provided as is without express or implied warranty,0,0,0,0,0,0,0,0,0,0,0,1
7,adobe disclaims all warranties with regard to this software including all implied warranties of merchantability fitness for a particular purpose and non  infringement of third party rights,0,0,0,0,0,0,0,0,0,0,0,1
8,in no event shall adobe be liable to you or any other party for any special indirect or consequential damages or any damages whatsoever whether in an action of contract negligence strict liability or any other action arising out of or in connection with the use or performance of this software,0,0,0,0,0,0,0,0,0,0,1,0
9,adobe will not provide any training or other support for the software,0,0,0,0,0,0,0,0,0,0,0,0
